username,tweet_id,date,favorites,hashtags,mentions,retweets,replies,text,topical_persons,topical_orgs,persons,orgs,propn,compound,neg,neu,pos
davesumnersmith,1235482463926980608,2020-03-05 08:29:08+00:00,1,#coronavirus,@Conservatives,0,0,Deaths of older people from #coronavirus would certainly impact on membership of the @Conservatives...,,,coronavirus,,# coronavirus @Conservatives,0.34,0.0,0.8440000000000001,0.156
NancyLangani,1235481682263846913,2020-03-05 08:26:01+00:00,0,#coronavirus,,0,0,It’s sad to see how one virus has caused so many businesses to collapse and so many people isolated due to the corona virus #coronavirus,,,,,coronavirus,-0.8344,0.287,0.713,0.0
Dutch_editor,1235476942712795136,2020-03-05 08:07:11+00:00,0,#coronavirus,,0,1,What if the only thing that can save us from #coronavirus is being impregnated by Boris Johnson - and he knew all along? – at Bankside Beach,johnson,,,Bankside Beach,# coronavirus Boris Johnson Bankside Beach,0.4939,0.0,0.89,0.11
rtruscott,1235472959390744576,2020-03-05 07:51:22+00:00,0,#CoronaVirus,@BBCr4today,0,0,"Papers review on @BBCr4today full of London streets deserted of tourists &amp; flights empty due to #CoronaVirus - I don’t believe it, I flew back from busy Seville Tues eve on a packed Ryanair to busy Stanstead &amp; worked yesterday in normally busy Tottenham &amp; Wood Green!",,,Wood Green,,London amp # CoronaVirus Seville Tues eve Stanstead amp Tottenham Wood Green,-0.2714,0.043,0.957,0.0
EricdeMarylebon,1235472696416153601,2020-03-05 07:50:19+00:00,2,#Coronavirus,,0,0,"""Coronavirus: Cases rise in South Korea as Australia imposes travel ban"" #Coronavirus ",,,Coronavirus,,Coronavirus South Korea Australia # Coronavirus,-0.6124,0.333,0.667,0.0
aliclow,1235467345268785153,2020-03-05 07:29:03+00:00,0,#coronavirus,,0,0,When I went to Milan v Lazio a few years ago it felt like it was already being played behind closed doors! #coronavirus,,,,,Milan Lazio coronavirus,0.636,0.0,0.802,0.198
romerley,1235458210166788096,2020-03-05 06:52:45+00:00,7,#coronavirusuk #CoronavirusOutbreak #Covid_19 #COVID #London #commuting #CoronaAlert #covid19UK #coronavirus #Coronvirus,,2,0,The joys of commuting in London! #coronavirusuk #CoronavirusOutbreak #Covid_19 #COVIDー19 #London #commuting #CoronaAlert #covid19UK #coronavirus #Coronvirus,,,,,London # CoronavirusOutbreak COVIDー19 London # CoronaAlert Coronvirus,0.5411,0.0,0.8109999999999999,0.189
romerley,1235456840525176832,2020-03-05 06:47:19+00:00,1,#Coronvirus #coronavirusuk #CoronaAlert #Covid_19 #COVID #CoronavirusOutbreak #coronavirus,@NHSEnglandLDN @BorisJohnson,0,0,"Remember the promise that if we leave the EU, the @NHSEnglandLDN would get £350 million? Time to come good on your promise @BorisJohnson because we need it now, more than ever! #Coronvirus #coronavirusuk #CoronaAlert #Covid_19 #COVIDー19 #CoronavirusOutbreak #coronavirus ",,,,,EU @NHSEnglandLDN Coronvirus CoronaAlert COVIDー19 # CoronavirusOutbreak,0.7644,0.028,0.7909999999999999,0.181
AdamBates_D6,1235428289637908480,2020-03-05 04:53:52+00:00,0,#coronavirus,,0,0,Lunacy hits Australia as people panic buy toilet paper #coronavirus ,,,,,Lunacy Australia coronavirus,-0.5106,0.268,0.732,0.0
fariskadir91,1235420765765488640,2020-03-05 04:23:58+00:00,0,#coronavirus,,0,0,It's 4.20am and i couldn't sleep. Nak keluar sorg2 takut kena tumbuk pulak. #coronavirus,,,Nak keluar,,Nak keluar takut kena tumbuk pulak coronavirus,0.0,0.0,1.0,0.0
AdamBates_D6,1235387753174413313,2020-03-05 02:12:47+00:00,0,#coronavirus #nightmare,,0,2,"The terror of being stuck on a cruise ship with passengers, crew & #coronavirus #nightmare",,,,,crew # coronavirus #,-0.6597,0.293,0.7070000000000001,0.0
AdamBates_D6,1235381728140840960,2020-03-05 01:48:50+00:00,0,#coronavirus,,0,0,I never thought I would tweet with “it is hard to lick your elbows” #coronavirus ,,,,,coronavirus,-0.1027,0.091,0.909,0.0
gaetano_91_xx,1235374819358781445,2020-03-05 01:21:23+00:00,3,#EFFETTOCORONAVIRUS #scuolechiuse #coronavirusitalianews #fake #covid_19italia #Salvini #amuchina #cineAmuchina #Codogno #CODVID19italia #CONVID19 #coranavirusitalia #Corona #coronavirus #CoronaVirusitaly #coronavirusitalianews,,0,0,È arrivata l’ottava Contagiosa Puntata di #EFFETTOCORONAVIRUS #scuolechiuse #coronavirusitalianews #fake #covid_19italia #Salvini #amuchina #cineAmuchina #Codogno #CODVID19italia #CONVID19 #coranavirusitalia #Corona #coronavirus #CoronaVirusitaly #coronavirusitalianews,,,,,È Contagiosa Puntata covid_19italia # Salvini # Corona # CoronaVirusitaly #,-0.4767,0.129,0.871,0.0
AntoniZolciak,1235371033542131719,2020-03-05 01:06:21+00:00,0,#technology #coronavirus #Conference2020,,0,0,Did you see that already? https://www.isitcanceledyet.com/ #technology #coronavirus #Conference2020,,,,,# Conference2020,0.0,0.0,1.0,0.0
BAPF61,1235370082043392000,2020-03-05 01:02:34+00:00,2,#Brexit #Coronavirus,,0,0,"She wouldn’t make such good wines if she was :) Le Collins is out again,reforming his bloody awful Genesis ! So cruel on top of #Brexit #Coronavirus, this could be the last straw",,,Brexit,,Le Collins Genesis Brexit # Coronavirus,-0.6242,0.24,0.5870000000000001,0.173
3Heckmonwyke,1235356779724369920,2020-03-05 00:09:42+00:00,0,#Coronavirus,@TomSwarbrick1 @LBC,1,0,"Really @TomSwarbrick1 @LBC ""We are moving on from the #Coronavirus conversstion"" dont You mean Scaremongering that You and callers are doing Every night. – at Clissold Park Lake",,,,,@TomSwarbrick1 Coronavirus Clissold Park Lake,0.0,0.0,1.0,0.0
savabroad,1235714778619719680,2020-03-05 23:52:16+00:00,9,,,0,1,newfound talent: suppressing my cough on the tube so people don’t think I have coronavirus,,,,,newfound coronavirus,0.4215,0.0,0.833,0.16699999999999998
KoikiMedia,1235713252568547341,2020-03-05 23:46:12+00:00,0,,,0,0,"Coronavirus cases in the UK have risen to 115 - with 25 of them in London, new figures show https://bbc.in/3asuMdx @London, United Kingdom https://www.instagram.com/p/B9XvMD7HwlG/?igshid=17ux4ah1i502i",,,,,Coronavirus UK London @London United Kingdom,0.4215,0.0,0.8909999999999999,0.109
HunterGodson,1235712782844248065,2020-03-05 23:44:20+00:00,1,,,0,0,Not usually a coronavirus fan but this is top quality,,,,,coronavirus,0.431,0.0,0.675,0.325
HunterGodson,1235711784809418754,2020-03-05 23:40:22+00:00,10,,,1,1,Important to hear the opinion of the Coronavirus imho ,,,,Coronavirus,Coronavirus,0.2023,0.0,0.816,0.184
Reezlon_Don,1235710952475168768,2020-03-05 23:37:04+00:00,0,,,0,0,Who from London Twitter going Rolling Loud Portugal? They having a Covid19 sale at £450 including three days tickets and hotels,,,,,London Twitter Rolling Loud Portugal Covid19,0.0,0.0,1.0,0.0
MusicNewsWeb,1235709442240348160,2020-03-05 23:31:04+00:00,1,#slipknot,@slipknot @SlipKnotFans9 @slipknotdaily,4,0,http://Music-News.com Slipknot have cancelled their Asia tour because of the coronavirus - #slipknot @slipknot @SlipKnotFans9 @slipknotdaily http://dlvr.it/RRKswT,,,,,http://Music News.com Slipknot Asia coronavirus @SlipKnotFans9 @slipknotdaily http://dlvr.it/RRKswT,-0.25,0.111,0.889,0.0
hackneycharlie,1235708822288769024,2020-03-05 23:28:36+00:00,0,,,0,0,"Tim Stanley doesn't understand that hoarding loo roll is a reaction to Covid-19, and Brexit.",,,,,Tim Stanley Brexit,0.0,0.0,1.0,0.0
BCoidan,1235707994442215424,2020-03-05 23:25:18+00:00,0,,,0,0,I said Covid 19 bird brain! ,,,,,Covid,0.0,0.0,1.0,0.0
Ruben_E_O,1235706691628552193,2020-03-05 23:20:08+00:00,0,,,0,0,Coronavirus and Eurovision Song contest 2020!!! https://youtu.be/Al5EwxsbtTw,,,https://youtu.be/Al5EwxsbtTw,,Coronavirus Eurovision Song,0.0,0.0,1.0,0.0
Dr_Ronx,1235706198051217413,2020-03-05 23:18:10+00:00,2,,,0,1,That’s my covid-19 outfit ,,,,,covid-19,0.0,0.0,1.0,0.0
DrTomFlynn,1235705659842273281,2020-03-05 23:16:02+00:00,4,#bbcqt,,0,0,Next up BBC newsround: “we asked this group of 8 year olds what they think about school closures due to the spread of the coronavirus...” #bbcqt,,,,,BBC newsround coronavirus,0.0,0.0,1.0,0.0
MeLadyFreshness,1235705595258441729,2020-03-05 23:15:46+00:00,1,,,0,1,So the healing pools don't cure coronavirus?,,,,,coronavirus,0.0,0.0,1.0,0.0
MFenderesky,1235704184785289221,2020-03-05 23:10:10+00:00,0,,,0,0,Completely agree.. working on COVID all day everyday... with no stop in sight... contingency planning now in force.,,,,,COVID,0.5692,0.0,0.774,0.226
_kedem,1235703018395291648,2020-03-05 23:05:32+00:00,2,#AdobeSummit #COVID19,,0,0,#AdobeSummit is online-only event due to #COVID19 virus. Good move from Adobe to prevent the disease spreading. Hope everything gets sorted before the EMEA event. ,,,,EMEA,AdobeSummit Adobe EMEA,0.7096,0.0,0.7609999999999999,0.239
MusicNewsWeb,1235702516173533184,2020-03-05 23:03:32+00:00,3,#katyperry #katyperry,@katyperry,4,0,http://Music-News.com Katy Perry and Orlando Bloom have reportedly postponed their wedding due to the coronavirus outbreak - #katyperry @katyperry http://dlvr.it/RRKpTg,,,,Orlando Bloom,http://Music News.com Katy Perry Orlando Bloom coronavirus katyperry,-0.2023,0.087,0.9129999999999999,0.0
Ruben_E_O,1235702486033289216,2020-03-05 23:03:25+00:00,1,#Coronvirus #CoronaVirusChallenge #Eurovision #ESC2020 #new #video #ComingSoon,,0,0,https://youtu.be/Al5EwxsbtTw Coronavirus Eurovision song contest 2020 What do you think about it? #Coronvirus #CoronaVirusChallenge #Eurovision #ESC2020 #new #video #ComingSoon,,,,,https://youtu.be/Al5EwxsbtTw Coronavirus Eurovision ComingSoon,0.0,0.0,1.0,0.0
shonabland,1235702459416211456,2020-03-05 23:03:19+00:00,0,,@AAFLondon,0,0,This is horrendous! Vietnamese curator banned from UK event after being told ‘Asians are seen as carriers of coronavirus’ https://www.independent.co.uk/arts-entertainment/art/news/coronavirus-affordable-arts-fair-an-nguyen-asian-vietnamese-battersea-a9378481.html I hope the @AAFLondon invite him to exhibit without the gallery!,,,,,UK Asians coronavirus https://www.independent.co.uk coronavirus asian vietnamese a9378481.html @AAFLondon,-0.5972,0.19,0.6940000000000001,0.11599999999999999
CraigBeck,1235702284031574026,2020-03-05 23:02:37+00:00,1,#COVID19 #Coronvirus,,0,1,"Cancelling your plans because of Covid-19? Don’t be a dick - you are falling into the trap of thinking the media are trying to protect you. They want people afraid, it’s the whole reason to exist. #COVID19 #Coronvirus",,,,,Covid-19,-0.6249,0.2,0.713,0.087
skennedyclarke,1235701082137006080,2020-03-05 22:57:50+00:00,0,,,0,1,If I get coronavirus I’m swinging everyone’s jaw I’ve met or that’s touched me in the previous 48 hours.,,,,,coronavirus ’s jaw,0.0,0.0,1.0,0.0
SueYasee,1235699280570126336,2020-03-05 22:50:41+00:00,2,,,0,0,Good point re: Coronavirus - if you are homeless how do you self isolate?,,,,,Coronavirus,0.2732,0.10800000000000001,0.7190000000000001,0.174
taylordiciocco,1235697418303229953,2020-03-05 22:43:17+00:00,0,,,0,1,"There is a dangerous ongoing narrative in which the media says Coronavirus is linked to the entirety of Italy. This is not true. It’s linked to the northern region, and only specific towns within it.",,,,,Coronavirus Italy,-0.6632,0.141,0.8590000000000001,0.0
itsroesworld,1235696970074861570,2020-03-05 22:41:30+00:00,0,,,0,1,Did you say there’s been a Coronavirus death in the UK? ,,,,,Coronavirus UK,-0.5994,0.281,0.7190000000000001,0.0
DenisMacShane,1235696250936274945,2020-03-05 22:38:39+00:00,0,,@toryboypierce @Kevin_Maguire @RhonddaBryant,0,1,"Oh dear. French deputy (MP) down with Coronavirus. How long before a UK MP ditto? Line that 650 UK MPs in crammed space breathing, coughing on each other then spreading out all over UK is unsustainable @toryboypierce @Kevin_Maguire @RhonddaBryant",,,,@toryboypierce,MP Coronavirus UK MP UK UK,0.3818,0.0,0.9359999999999999,0.064
MFenderesky,1235695461064990720,2020-03-05 22:35:30+00:00,10,#COVID,@NorthMidNHS,3,2,Now this is dedication! Divisional director gone beardless for COVID. I’m seriously impressed!! #COVIDー19 @NorthMidNHS,,,,COVID,COVID COVIDー19,0.5067,0.091,0.696,0.213
NJhnko,1235694691087273999,2020-03-05 22:32:27+00:00,4,,,3,0,so it’s only now because of coronavirus that you’re washing your hands? dirty pig,,,,,coronavirus pig,-0.4404,0.182,0.818,0.0
Justme_uk,1235694277545648129,2020-03-05 22:30:48+00:00,0,,,0,0,Oh fuck India call centers has the coronavirus wake up,,,,,India,-0.5423,0.28,0.72,0.0
JoshuaNevett,1235693427607695373,2020-03-05 22:27:25+00:00,1,,,0,0,I do think the wall-to-wall coverage of the coronavirus outbreak has been too over-zealous and sensationalised across the media landscape. And this is coming for a former tabloid journalist. It’s a serious matter but the extent to which it has been covered feels disproportionate ,,,,,coronavirus,-0.0258,0.026000000000000002,0.95,0.024
EdatEdison,1235690977379024896,2020-03-05 22:17:41+00:00,1,,,0,1,Had a night out with friend tonight. Ended up in a local independent Italian. Waitress thanked us for coming as said some Italians suffering racism due to Coronavirus.This is not the world I hoped to grow old in. That’s all.,,,,Coronavirus,Italian Waitress Italians Coronavirus,0.128,0.141,0.688,0.171
nicosuavehh,1235688105774067713,2020-03-05 22:06:17+00:00,0,,@MetroUK,0,0,Most doctors fear NHS not prepared for coronavirus outbreak https://metro.co.uk/2020/03/02/doctors-fear-nhs-not-prepared-coronavirus-outbreak-survey-says-12337045/?ito=article.amp.share.top.twitter via @MetroUK,,nhs,,,NHS coronavirus https://metro.co.uk/2020/03/02/doctors-fear-nhs-not-prepared-coronavirus-outbreak-survey-says-12337045/?ito=article.amp.share.top.twitter,-0.6303,0.34,0.66,0.0
A1isonG1ynn,1235686577646563329,2020-03-05 22:00:12+00:00,0,,,0,0,Can you ask what role private sector (hospitals and staff) can play in supporting nhs during COVID 19 crisis.,,nhs,,,COVID,0.0516,0.161,0.63,0.209
whealie,1235686186791788545,2020-03-05 21:58:39+00:00,0,#Coronvirus #CoronaVirusSA #Covid_19,,0,0,The US has an 8.5% death rate from #Coronvirus #CoronaVirusSA #Covid_19 - the highest reported - or the president is lying again. ,,,,,US # Coronvirus,-0.8074,0.267,0.733,0.0
williamson90,1235681366714576900,2020-03-05 21:39:30+00:00,0,,,0,0,"Good news, 22 men on the pitch won’t shake hands to stop the spread of coronavirus, just the 60,000 odd fans in the stand to worry about next",,,,,Good coronavirus,-0.6369,0.26,0.657,0.083
thisisyogic,1235680661643685888,2020-03-05 21:36:42+00:00,1,,,0,1,Today in a cafe I overheard a young male entrepreneur type telling his teenaged business mentee that everyone is overreacting to Coronavirus as it only affects old and sick people and there’s no way he’s going to let it ruin his skiing holiday to France or his wedding in June,,,,,Coronavirus France June,-0.765,0.16,0.7929999999999999,0.047
GeorgeJurgens,1235680533864017922,2020-03-05 21:36:11+00:00,2,#startup,,0,0,"New #startup idea called ‘COVID-19’ - the virus safe cinema. Watch movies with 18 of your closest friends, remotely, but together. ",,,,,#,0.4588,0.0,0.826,0.174
RobertCorp,1235679321534103556,2020-03-05 21:31:22+00:00,5,,,0,2,The amount of rain we’ve had today has washed the coronavirus right out of Ham* *may not be scientifically accurate,,,,,coronavirus Ham,0.0,0.0,1.0,0.0
NanaAnsah20,1235677249367662592,2020-03-05 21:23:08+00:00,10,#Iran,@WHO,5,0,"22 laboratories now have capacity to test for COVID19 in IR #Iran. So far, @WHO has provided lab testing kits enough to test at least 110,000 people and protective equipment and supplies for least 31,000 health care workers....",,,,,IR Iran @WHO,0.4939,0.0,0.92,0.08
itsroesworld,1235673340750295040,2020-03-05 21:07:36+00:00,0,,,0,0,This Coronavirus serious unah,,,,Coronavirus,Coronavirus,-0.0772,0.302,0.698,0.0
keplerniko,1235672153162313728,2020-03-05 21:02:53+00:00,0,,,0,1,"Also was Shapps writing because of 14 Flybe slots at LHR that will need filling by IAG, or was he writing about Coronavirus slowdown making filling slots difficult for everyone? Clarity needed. Heathrow is probably pissed off at HMG anyway for botching the third runway plans.",,,,,Shapps Flybe IAG Coronavirus Heathrow HMG,-0.6124,0.128,0.821,0.052000000000000005
RMJewell,1235670748909498379,2020-03-05 20:57:18+00:00,0,,,0,0,"Does he know what 1% is? Of course he does, he is one of them. Tell him the coronavirus only affects the 1%.",,,,,,0.0,0.0,1.0,0.0
HistoryChanging,1235670523066986496,2020-03-05 20:56:25+00:00,2,,,1,0,"The Coronavirus has severely cut down air travel, reduced China’s industrial output, forced many to stay at home and crashed the world economy. Is that why it’s green?",,,,,Coronavirus China,-0.7964,0.245,0.755,0.0
AnthonyJayJay1,1235667671972077568,2020-03-05 20:45:05+00:00,2,,,0,1,Coronavirus In New York Right Now. ,,,,New York,Coronavirus New York,0.0,0.0,1.0,0.0
FrHadan,1235666590714056704,2020-03-05 20:40:47+00:00,8,,,3,4,Am I the only who think the whole thing of the Coronavirus is a bit too much? Of course is dangerous but I think there is also the desire to create global social alarm and panic. If we focus in the coronavirus we don’t pay attention to other matters anymore.,,,,Coronavirus,Coronavirus,-0.5927,0.182,0.6990000000000001,0.11900000000000001
Sapper1801,1235665875165945856,2020-03-05 20:37:56+00:00,0,,,0,0,Coronavirus stuff??? Assuming you're not Louis Pasteur.. Then doing a Jurgen would be a good idea,,,Jurgen,,Coronavirus Louis Pasteur Jurgen,0.5329999999999999,0.0,0.813,0.187
GeordieRussell,1235665852458024968,2020-03-05 20:37:51+00:00,0,,,0,0,"""80,000 People are Sick with Coronavirus at the Moment - of which 77,000 are in China. This means that if you are not from China than this should remove 96% of your worry. Also with the Coronavirus 81% of the… https://www.instagram.com/p/B9XZoWCnOnr/?igshid=16t8x91cbpqrv",,,,,Coronavirus Moment China China Coronavirus,-0.7351,0.13699999999999998,0.863,0.0
FlottaConsultin,1235664749150552065,2020-03-05 20:33:28+00:00,1,#pilots #exeter #ceomess,@flybe,0,0,"We contacted @flybe to help them with acquiring and card fees more than nine months ago. We got a ‘we have it under control’ reply. As one of the pilots said today, poor leadership and management led to this mess, not the Coronavirus. #pilots #exeter #ceomess",,,,,Coronavirus,-0.5065,0.11599999999999999,0.8320000000000001,0.052000000000000005
Falbs,1235664174837088259,2020-03-05 20:31:11+00:00,2,,,0,1,Is coronavirus the universe forcing us to travel and consume less?!,,,,,coronavirus universe,0.0,0.0,1.0,0.0
CalumCurry,1235663862520836107,2020-03-05 20:29:57+00:00,1,#coronavirusuk,,0,0,"BREAKING: First death in Britain from coronavirus confirmed. “The patient, who was being treated at the Royal Berkshire Hospital, was an older patient who had underlying health conditions"" - Chief Med Officer Whitty. #coronavirusuk",,,coronavirusuk,,Britain coronavirus Royal Berkshire Hospital Chief Med Officer Whitty,-0.5994,0.106,0.894,0.0
paulclements,1235660049407545345,2020-03-05 20:14:47+00:00,1,#attenSHUN,,0,1,So what are we doing instead of coronavirus handshakes? I’d like the chef’s kiss or a limp military salute to catch on #attenSHUN,,,,,coronavirus,0.6486,0.0,0.7979999999999999,0.20199999999999999
rossobr1en,1235658932414230529,2020-03-05 20:10:21+00:00,1,,,0,0,It looks like your timing was spot on though. Sad to hear about the Los Angeles County declaration of the coronavirus emergency. Thinking of you guys!,,,,,Los Angeles County coronavirus,-0.5411,0.19,0.73,0.079
Blitzwalker,1235657366244405248,2020-03-05 20:04:08+00:00,0,,,0,0,Great breeding ground for Coronavirus too!,,,,Coronavirus,Coronavirus,0.6588,0.0,0.532,0.46799999999999997
daniluvsuall,1235657359973904398,2020-03-05 20:04:06+00:00,2,,,0,0,Sod the coronavirus I think I may need a gas mask at the moment ,,,,,Sod,0.0,0.0,1.0,0.0
SalahuddinQP,1235656540662661122,2020-03-05 20:00:51+00:00,0,,,0,0,Trump calls WHO's global death rate from coronavirus 'a false number' ,,,,WHO,coronavirus,-0.5574,0.275,0.634,0.092
Lizzybeth23,1235655608654798853,2020-03-05 19:57:09+00:00,2,,,0,1,In 24 hours two events cancelled as well as my marathon which I have been working my bollocks off in training for. NB if you comes near me with a sniffle or a coronavirus joke I *will* punch you in the face.,,,,,,0.3182,0.044000000000000004,0.861,0.095
sola__mas,1235655294925107200,2020-03-05 19:55:54+00:00,2,,,0,1,when are people going to start making coronavirus art,,,,,coronavirus,0.0,0.0,1.0,0.0
Observista_uk,1235654786839646213,2020-03-05 19:53:53+00:00,0,#coronavirusUK #TATE #RoyalAcademy,,0,0,"""Coronavirus like pasta, Ai Weiwei's comparison on Instagram"" #coronavirusUK #TATE #RoyalAcademy",,,coronavirusUK,,Coronavirus Ai Weiwei Instagram # coronavirusUK # TATE # RoyalAcademy,0.3612,0.0,0.8,0.2
zibycherry,1235653890613350400,2020-03-05 19:50:19+00:00,0,,,0,0,All the schools which are closed and events cancelled over coronavirus fears ,,,,,coronavirus,-0.5859,0.324,0.6759999999999999,0.0
aisshhaaaaaa,1235653881750839297,2020-03-05 19:50:17+00:00,4,,,0,0,crazy to think that this coronavirus stuff has the Haram empty now ,,,,,coronavirus Haram,-0.4939,0.29600000000000004,0.7040000000000001,0.0
joseph_grieve,1235652824593313793,2020-03-05 19:46:05+00:00,1,,,0,2,It's the End Times.CoronaVirus is clear evidence of this fact.,,,,CoronaVirus,End Times CoronaVirus,0.3818,0.0,0.7759999999999999,0.22399999999999998
JoshhhUTC,1235650184614461440,2020-03-05 19:35:35+00:00,14,,,0,3,Coronavirus this and that... SHUT THE FUCK UP.,,,,Coronavirus,Coronavirus FUCK,-0.6408,0.377,0.623,0.0
JoeZBlair,1235649815901544449,2020-03-05 19:34:08+00:00,10,,,2,4,"Alexa, show me someone who hasn't understood a word of what's been reported about Coronavirus ""OK, here's Matt Le Tissier "" ",hancock,,Matt Le Tissier,,Alexa Coronavirus Matt Le Tissier,0.0,0.0,1.0,0.0
neptunia97,1235649119898787845,2020-03-05 19:31:22+00:00,1,,,0,0,Now is a good time to start your own mask company and exploit dumb ignorant people that think it’ll protect them from coronavirus...,,,,,coronavirus,-0.0772,0.22399999999999998,0.594,0.182
CharlesHolt1,1235648465994231808,2020-03-05 19:28:46+00:00,0,,,0,0,"PSA - COVID-19 CANNOT BE TRANSMITTED FROM CONTACT IN MATCH, RT TO SAVE A LIFE ",,,,CANNOT,PSA MATCH RT,0.6037,0.0,0.7809999999999999,0.21899999999999997
hbbeautee,1235647310945632256,2020-03-05 19:24:10+00:00,1,#Coronvirus #COVID19 #CoronaAlert,,0,0,"Its funny how i've only heard old people pass due to this ""new"" virus. Come back to me when its not an ""older"" person that has passed because of the virus or someone that had health conditions before they got the virus. Tired of it now. #Coronvirus #COVID19 #CoronaAlert",,,,,CoronaAlert,0.0,0.055,0.89,0.055
Liv80867502,1235644827443884036,2020-03-05 19:14:18+00:00,0,#EastLondon #Coronvirus #masks,@coronavirus,0,0,@coronavirus #EastLondon #Coronvirus getting ready in east London #masks – at Bethnal Green Gardens,,,,,EastLondon Coronvirus London Bethnal Green Gardens,0.3612,0.0,0.8390000000000001,0.161
michaeltimm1966,1235644788352970754,2020-03-05 19:14:09+00:00,0,,,0,0,"""My colleague has coronavirus so now others are skiving off work,"" caller tells Nigel Farage https://www.lbc.co.uk/radio/presenters/nigel-farage/my-colleague-has-coronavirus-now-skiving/ Another dumbass is helping to spread the virus instead of taking &amp; broadcasting the advice of the health authorities. This could invect kill many. Thanks Farage!",,,,taking &amp,coronavirus Nigel Farage https://www.lbc.co.uk nigel farage coronavirus skiving/ amp Farage,-0.6696,0.166,0.735,0.099
JustEricWalker,1235643201756762117,2020-03-05 19:07:51+00:00,3,,,1,0,One elderly person died of complications from Coronavirus today. 460 died of a heart attack. 450 died of cancer. 5 died on the road. Just a sense of perspective. Don’t panic!,,,,,Coronavirus,-0.9788,0.515,0.485,0.0
DScilly,1235639378602389504,2020-03-05 18:52:39+00:00,0,,,0,1,"“OPEC ministers took a gamble, agreeing on a 1.5 million-barrel a day output cut to offset .. demand hit from .. coronavirus, without overcoming Russian opposition.... if Moscow doesn't join ... in the deal, the cartel wouldn't act ... that would almost g’tee.. oil price crash”",,,,,OPEC coronavirus Moscow,-0.2705,0.11,0.8420000000000001,0.048
tonypiper,1235639169977901057,2020-03-05 18:51:49+00:00,1,,@WeWork,0,1,"Curious to know what effect Coronavirus has had on the consumption of the free biscuits (stored in mason jars, no tongs provided) at @WeWork locations around the world.",,,,Coronavirus,Coronavirus mason,0.5267,0.067,0.762,0.171
BCoidan,1235638748857024513,2020-03-05 18:50:09+00:00,0,,,1,0,Covid-19 – The right medicine for the world economy ,,,,,Covid-19,0.0,0.0,1.0,0.0
vinf_net,1235638612395466753,2020-03-05 18:49:36+00:00,6,#LonVMUG,,2,1,"#LonVMUG monitoring the whole Coronavirus situation for our April 30th event, will make a call closer to the end of March",,,,,LonVMUG Coronavirus April March,0.0,0.0,1.0,0.0
jeremyoharris,1235637884813815808,2020-03-05 18:46:43+00:00,108,,,3,3,"True facts keep Biden and Bernie both away from coronavirus, these agéd men won’t survive it.",,,Bernie,,Biden Bernie coronavirus,0.4215,0.0,0.843,0.157
MODAmua,1235637222335860736,2020-03-05 18:44:05+00:00,0,#Covid,@flybe,0,0,I have never flown with @flybe but so sad that the fall out will affect so many domestic airports for staff at all levels I feel for you #Covid-19 will see more go ,,,,,Covid-19,-0.757,0.146,0.8540000000000001,0.0
johnper85647262,1235637186671841284,2020-03-05 18:43:56+00:00,0,,,0,0,CORONAVIRUS HAS ANOTHER COUNTRY SPRAYED AN INFECTIOUS DESEASE INTO THE AIR ? KIND REGARDS JOHN EDWARD PERRY.,,,,,CORONAVIRUS COUNTRY INFECTIOUS KIND REGARDS EDWARD PERRY,0.6289,0.0,0.795,0.205
dockerz77,1235636011520139265,2020-03-05 18:39:16+00:00,1,,,0,0,Booked a bed today so hope coronavirus does one by then! ,,,,,coronavirus,0.6166,0.0,0.713,0.287
