username,tweet_id,date,favorites,hashtags,mentions,retweets,replies,text,topical_persons,topical_orgs,persons,orgs,propn,compound,neg,neu,pos
FrazerBrown,1235555776309194760,2020-03-05 13:20:27+00:00,3,,,2,0,"I don't know if you caught my statement the other day, I TRULY believe we need to be PRO-ACTIVE not REACTIVE. If (IF) COVID19 continues to spread we owe it to casts,crew &amp; the public to safeguard in any way possible.Inevitably a true pandemic will close shows due to lack of sales",,,,,REACTIVE IF amp,0.7739,0.039,0.809,0.152
keplerniko,1235554304297234433,2020-03-05 13:14:36+00:00,0,,,1,1,"Coronavirus didn’t tip Flybe into insolvency (considering they were insolvent in January), it provided the cover story for Virgin and others to crystallise the failure and liquidate everything. Someone getting some nice Heathrow slots out of this event.",,,,,Coronavirus Flybe January Virgin Heathrow,-0.128,0.078,0.855,0.067
HeronChe,1235552644820680705,2020-03-05 13:08:00+00:00,5,,,0,0,Coronavirus was punishment for brexit,,,,Coronavirus,Coronavirus brexit,-0.4939,0.444,0.556,0.0
lennynaar,1235548268567973888,2020-03-05 12:50:37+00:00,3,#COVID19,@renireni,1,0,"This is on point. Has me thinking of @renireni's book ""Why I'm no longer talking to white people about race."" #COVID19 is giving a whole lot of (white) people a new experience of discrimination. ",,,,,@renireni,0.0516,0.06,0.8740000000000001,0.066
SirGuyGuisborne,1235547844422991872,2020-03-05 12:48:56+00:00,5,,,0,6,New MotoGP calendar Darley Dale Kyalami (no coronavirus in SA yet) And that’s it,,,,SA,New MotoGP Darley Dale Kyalami SA,0.0,0.0,1.0,0.0
AnarkoMontana,1235546922125058048,2020-03-05 12:45:16+00:00,0,,,0,1,If the coronavirus doesn't kill you before ,,,,,,0.5773,0.0,0.616,0.384
AlMcNulty,1235546696970645505,2020-03-05 12:44:22+00:00,4,,,0,0,The attempts to cancel the 6 Nations due to “Coronavirus fears” is actually because there’s a Latin-Celtic conspiracy to stop England winning. Do not ask me for proof.,,,,,Nations Coronavirus England,-0.4939,0.217,0.6859999999999999,0.09699999999999999
Innovandiamo,1235545422262702080,2020-03-05 12:39:18+00:00,0,,,0,0,Express: Coronavirus map LIVE: UK outbreak moves to second phase of emergency plan - cases soar. ,,,,,Coronavirus UK,-0.3818,0.14800000000000002,0.852,0.0
malc_finch,1235545055747768324,2020-03-05 12:37:51+00:00,0,,,0,0,"There has got to be a doctor's coronavirus special, or maybe holby city. Will Charlie get coronavirus in casualty? It could be a multi crossover with BBC breakfast news reporting 20 minute updates?",,,,,coronavirus special Charlie coronavirus BBC news,-0.264,0.1,0.828,0.07200000000000001
onisillos,1235544462203314178,2020-03-05 12:35:29+00:00,6,,,0,1,Note to self: look up severe cases “common cold” coronavirus infections,,,,,cold coronavirus,-0.3818,0.20600000000000002,0.794,0.0
onemichaelrossi,1235544056597340162,2020-03-05 12:33:53+00:00,3,#Coronvirus,,0,0,"Whilst I agree paper money can spread the coronavirus, I literally only use it these days for two taxi rides from/to Macclesfield train station. The rest of the time I use Google Pay/contactless, which is also infinitely better for managing your financies #Coronvirus",,,,,Macclesfield Google Pay,0.6597,0.0,0.884,0.11599999999999999
malc_finch,1235543620926820352,2020-03-05 12:32:09+00:00,0,,,1,2,"As most BBC programmes seem to be running a corona virus special, how long before we get pointless Coronavirus? Eastenders the coronavirus week? Homes under the Coronavirus?",,,,Coronavirus,BBC Coronavirus Coronavirus,0.5007,0.0,0.889,0.111
Sam72736122,1235542423738048512,2020-03-05 12:27:23+00:00,0,,,0,1,Coronavirus LIVE: UK cases soar as London HSBC HQ is evacuated ,,,,London HSBC HQ,Coronavirus LIVE UK London HSBC,0.0,0.0,1.0,0.0
eddie_grun,1235542137422430211,2020-03-05 12:26:15+00:00,110,,,2,3,The people I know who are freaking out about coronavirus are the same people I’ve seen snort multiple lines of coke off toilet seats at gig venues.,,,,,coronavirus,-0.4215,0.09699999999999999,0.903,0.0
francesleach_,1235541447299854338,2020-03-05 12:23:30+00:00,4,,,0,0,Just got temperature checked (presumably for Coronavirus) in the Shangri-La Hotel and my face was too cold to check aha HELP,,,,,Coronavirus Shangri La Hotel HELP,0.5319,0.0,0.853,0.147
Sonic_Screwup,1235540457763016704,2020-03-05 12:19:35+00:00,11,#Blood,@AcornTV,2,2,Hey America you don’t have to go out and catch coronavirus you can stay in and watch #Blood on @AcornTV instead from March 9th. Much safer.,,,,,America coronavirus @AcornTV March,0.4215,0.0,0.899,0.10099999999999999
Sam72736122,1235539929482047488,2020-03-05 12:17:29+00:00,0,,,0,0,Cruise ship linked to coronavirus death held off coast of San Francisco ,,,,,coronavirus San Francisco,-0.5994,0.262,0.738,0.0
camiladotjs,1235538597362700289,2020-03-05 12:12:11+00:00,0,,,0,0,"I can't believe I had to get annual multi trip travel insurance, coronavirus is forcing me to become an adult",,,,coronavirus,coronavirus,0.0,0.0,1.0,0.0
steveharcourt,1235538063121580034,2020-03-05 12:10:04+00:00,1,#bccconf,@MattHancock @cwchamber @PrimeCharAccnts,0,0,@MattHancock asking for clear heads and determination to get through the Coronavirus outbreak. #bccconf @cwchamber @PrimeCharAccnts,,,,,@MattHancock Coronavirus,0.6486,0.0,0.725,0.275
DomUnsworth,1235536819120410625,2020-03-05 12:05:07+00:00,0,#bccconf #COVID19 #Coronvirus #containanddelay #publichealth,@MattHancock @britishchambers,0,0,"@MattHancock talks about following scientific advice to minimise social and economic impact and notes "" ...business done right is a moral force for good..."" @britishchambers #bccconf #COVID19 #Coronvirus #containanddelay #publichealth",,,,,,0.4404,0.0,0.909,0.091
steveharcourt,1235536060488302595,2020-03-05 12:02:06+00:00,0,#bccconf,@MattHancock,0,0,@MattHancock at #bccconf talking about economic certainty and oh yes Coronavirus.,,,,Coronavirus,Coronavirus,0.5719,0.0,0.657,0.34299999999999997
JosephCornforth,1235535949997752322,2020-03-05 12:01:40+00:00,1,#Coronvirus #Disability #COVID19 #ToriesOut,,1,0,"So firstly tories think people with learning disabilities don’t understand money, but now they think they launch cyberattacks. What next; are they going to somehow blame disabled people for #Coronvirus? #Disability #COVID19 #ToriesOut",,,,,# Coronvirus ToriesOut,-0.4767,0.08800000000000001,0.912,0.0
JamesMarsh1974,1235535260479340544,2020-03-05 11:58:55+00:00,0,,@Baddiel,0,0,"I remember @Baddiel using one of these in a show. Absolutely hilarious. I imagine ""Coronavirus"" will illicit the same laughs from our descendants in 200 years.",,,,,Coronavirus,0.7346,0.0,0.795,0.205
rrachy_,1235535077599150080,2020-03-05 11:58:12+00:00,0,,,0,0,best part about coronavirus is i can get a seat on the train now,,,,,coronavirus,0.6369,0.0,0.7559999999999999,0.244
Innovandiamo,1235535030245560321,2020-03-05 11:58:00+00:00,0,,,0,0,Coronavirus: England v Italy Six Nations match in Rome postponed | World News | Sky News ,,,,,Coronavirus England Italy Six Nations Rome | World News | Sky News,-0.2023,0.107,0.893,0.0
DavisonEm,1235534945394843648,2020-03-05 11:57:40+00:00,10,,,0,1,News: Don’t worry about coronavirus it’s only a higher risk to those with a weakened immune system. Me: I have a weekend immune system!,,,,,coronavirus,-0.4926,0.245,0.613,0.142
jackhuskinson16,1235532981214814208,2020-03-05 11:49:52+00:00,3,,,0,0,Can summer hurry up and fuck Coronavirus off,,,,Coronavirus,Coronavirus,-0.5423,0.33299999999999996,0.667,0.0
MattWLandD,1235531878398136320,2020-03-05 11:45:29+00:00,4,,,0,1,I’m not this guys biggest fan (making teams other than mine successful rubs me up the wrong way) but I do love his answer here to being asked about Coronavirus and the weird things we ask our celebrities to talk about! ,,,,Coronavirus,Coronavirus,0.7929999999999999,0.08199999999999999,0.7170000000000001,0.20199999999999999
startle65,1235530037320986626,2020-03-05 11:38:10+00:00,49,#COVID19,,0,12,Hello.... Chocks away! #COVID19 – at St. Mary's Hospital,,,,,St. Mary,0.0,0.0,1.0,0.0
equinesilk,1235529898799886336,2020-03-05 11:37:37+00:00,2,#Coronvirus,,1,0,"NHS London have confirmed that, The Trophy Room in Tottenham Hotspur's new Stadium will be used to treat Coronavirus patients, Stating "" We need somewhere not visited by London's population "" #Coronvirus ",,nhs,,,NHS London Trophy Room Tottenham Hotspur Stadium Coronavirus London,0.4019,0.0,0.92,0.08
samyulldn,1235528121295699970,2020-03-05 11:30:33+00:00,8,,,0,0,Coronavirus and I’m seeing some of the most unhygienic niggas with face masks. you’re the issue??,,,,Coronavirus,Coronavirus,-0.4657,0.168,0.8320000000000001,0.0
CamCar67,1235527920120000519,2020-03-05 11:29:45+00:00,0,#COVID,,0,0,"So it appears Coronavirus has mutated into 2 strains: S-type L-type The later Type (L) being more aggressive and contagious, it’s possible to be infected with both types. #COVIDー19",,,,,Coronavirus COVIDー19,-0.8384,0.285,0.715,0.0
Pairsonnalites,1235527116877225984,2020-03-05 11:26:34+00:00,0,,,1,0,"Here's The Latest Advice From Experts About Coronavirus And HIV: Because the overwhelming majority of people in the UK who are known to be HIV-positive have undetectable viral loads, there is a danger of those who ... http://dlvr.it/RRHlcG",,,,,Coronavirus HIV UK HIV,-0.5267,0.084,0.9159999999999999,0.0
JoksieA,1235526027763494912,2020-03-05 11:22:14+00:00,1,,,0,0,coronavirus now has 24 hour stories,,,,,coronavirus,0.0,0.0,1.0,0.0
nicosuavehh,1235525799479894016,2020-03-05 11:21:20+00:00,0,,,0,0,Corbyn warns NHS at 94% bed occupancy before coronavirus https://www.bbc.co.uk/news/av/uk-politics-51729453/jeremy-corbyn-says-nhs-at-94-bed-occupancy-before-coronavirus,,nhs,,coronavirus https://www.bbc.co.uk/news/av/uk-politics-51729453/jeremy-corbyn,NHS coronavirus https://www.bbc.co.uk news av uk politics-51729453 jeremy corbyn nhs coronavirus,-0.1027,0.135,0.865,0.0
grahambog,1235525601370529792,2020-03-05 11:20:32+00:00,1,,,0,0,Johnson must not be permitted to use Coronavirus as an excuse to suspend parliament ,johnson,,,Coronavirus,Johnson Coronavirus,-0.25,0.147,0.769,0.083
me_throu_a_lens,1235524877832028166,2020-03-05 11:17:40+00:00,0,,,0,0,The Coronavirus Is Much Worse Than You Think | Psychology Today ,,,,,Coronavirus | Psychology,-0.4767,0.237,0.763,0.0
macor247,1235524813378248704,2020-03-05 11:17:25+00:00,0,,@boltapp,0,0,"@boltapp - You must tell us what the secret is, that drivers using your app are not at risk of Coronavirus ",,,,Coronavirus,Coronavirus,0.2057,0.0,0.917,0.083
Marietta298,1235519010411892737,2020-03-05 10:54:21+00:00,3,,@AITOHQ,0,0,@AITOHQ General Meeting has a heavy agenda today as its members debate both COVID-19 and the climate change and how best to manage both crises,,,,,@AITOHQ General Meeting,0.6369,0.0,0.851,0.149
JenLipgloss,1235518968980369409,2020-03-05 10:54:11+00:00,0,,,0,0,Coronavirus is flopping the base I can’t lie /:,,,,Coronavirus,Coronavirus,-0.3182,0.223,0.777,0.0
fraserjacks26,1235518703460118529,2020-03-05 10:53:08+00:00,7,,,0,2,Why can’t my exam be cancelled because of coronavirus,,,,,coronavirus,-0.25,0.2,0.8,0.0
jcMenendez,1235517806260572160,2020-03-05 10:49:34+00:00,0,,,0,0,Guy on the right is coronavirus appropriate ,,,Guy,,Guy coronavirus,0.0,0.0,1.0,0.0
juliet_dennis,1235515779908382720,2020-03-05 10:41:31+00:00,7,,@AitoAgents @AITOHQ,4,0,Aito AGM: Aito to run a weekly telephone update on coronavirus for members @AitoAgents @AITOHQ,,,,,Aito AGM Aito coronavirus,0.0,0.0,1.0,0.0
g_bonincontro,1235515575129923584,2020-03-05 10:40:42+00:00,0,,,0,0,MPs told coronavirus strategy has moved from 'mainly contain' to 'mainly delay' ,,,,,MPs coronavirus,-0.3182,0.17300000000000001,0.8270000000000001,0.0
tariqtahir,1235514198769184768,2020-03-05 10:35:14+00:00,0,,,0,0,Just had first press release from PR boasting how Coronavirus has seen spike in sign up for their products,,,,Coronavirus,PR Coronavirus,0.0,0.0,1.0,0.0
fizzyade,1235513998411522051,2020-03-05 10:34:26+00:00,0,,@djosh78,0,0,"@djosh78 I’m trying to find out if any of the liver team have been on the wards with Coronavirus. I was at suite 9 + ultrasound on Wednesday and MRI on Sunday, have been horribly ill this week with flu type cough, sickness etc. PSC patient.",,,,,@djosh78 Coronavirus suite Wednesday MRI Sunday PSC,-0.8316,0.17,0.83,0.0
Lightsinlights,1235511304762331136,2020-03-05 10:23:44+00:00,3,#sussexhour,@SussexHour,0,3,Goodmorning .@sussexhour #sussexhour - where’s the sunshine gone? coronavirus could affect our business if people decided to hold fire on booking their special events ? It hasn’t impacted us as yet - a good question and food for thought though,,,,,coronavirus,0.7757,0.05,0.757,0.193
DownieKeen,1235510861529321473,2020-03-05 10:21:58+00:00,2,,,0,2,"He's not wrong. 76,000 people died of flu in the UK last year. Not a single death in the UK of Coronavirus yet.",,,,Coronavirus,UK UK Coronavirus,-0.128,0.201,0.615,0.184
EricdeMarylebon,1235510799503851522,2020-03-05 10:21:43+00:00,0,,,0,0,"""MPs told coronavirus strategy has moved from 'mainly contain' to 'mainly delay'"" ",,,,,MPs coronavirus,-0.3182,0.17300000000000001,0.8270000000000001,0.0
carolynjoy,1235508342904193025,2020-03-05 10:11:58+00:00,7,#nerds #austen,,1,1,Nerdy workplace coronavirus precautions #nerds #austen,,,,,,-0.0516,0.19399999999999998,0.8059999999999999,0.0
ItaChinelo,1235506485687246848,2020-03-05 10:04:35+00:00,1,,,0,2,Just found out someone in the office beside mine has the coronavirus. The office has been closed down apparently. Lord help us.,,,,,Lord,0.4019,0.0,0.8859999999999999,0.114
HistoryChanging,1235506336248614912,2020-03-05 10:03:59+00:00,0,,,0,0,"The trouble is that the vast majority of people with flu like symptoms are not being tested for Coronavirus because authorities in Europe and US want to quell anxiety about it. However, every death is recorded, so that inflates the death rate; which increases anxiety anyway.",,,,,Coronavirus Europe US,-0.9136,0.28300000000000003,0.652,0.065
Lebzzz,1235505611376398336,2020-03-05 10:01:06+00:00,3,,,1,0,"Praying for everyone in Bergamo affected by coronavirus. @London, United Kingdom https://www.instagram.com/p/B9WQw78Ay0C/?igshid=r8ru9ijz1zbx",,,,,Bergamo coronavirus @London United Kingdom,0.5719,0.10099999999999999,0.5660000000000001,0.33299999999999996
TheOrangeFamily,1235504939557928960,2020-03-05 09:58:26+00:00,0,,,0,0,BBC News - Coronavirus symptoms: What are they and how to protect yourself? ,,,,BBC News - Coronavirus,BBC News Coronavirus,0.3818,0.0,0.8220000000000001,0.17800000000000002
sophiasgaler,1235504521771659264,2020-03-05 09:56:47+00:00,55,,,2,1,people are shocked about coronavirus in Italy and it’s like - do you know how much we touch each other the whole time? We love strangers so much we kiss them twice,,,,,coronavirus Italy,0.8158,0.057,0.6990000000000001,0.244
KatieClaw,1235504484148789250,2020-03-05 09:56:38+00:00,2,,@mdx_EL @MdxNursing @mdxclinicalteam,2,0,A fascinating article about China’s public health measures to prevent the spread of Covid 19 https://www.reddit.com/r/China_Flu/comments/fbt49e/the_who_sent_25_international_experts_to_china/?utm_medium=android_app&amp;utm_source=share @mdx_EL @MdxNursing @mdxclinicalteam,,,,,China Covid https://www.reddit.com/r/China_Flu/comments/fbt49e/the_who_sent_25_international_experts_to_china/?utm_medium=android_app&amp;utm_source=share,0.5574,0.0,0.787,0.213
_freyafarmer,1235503743766052869,2020-03-05 09:53:41+00:00,1,,,0,0,"I told my housemate that I was surprised to get home from work in 20 minutes rather than an hour, he said it was because of coronavirus ",,,,,coronavirus,0.2263,0.0,0.932,0.068
StJamesChurchWS,1235502812345270272,2020-03-05 09:49:59+00:00,3,#Covid_19 #Furzedown,@furzedown_net,1,0,....We hope you understand. We expect to be back next week and ask that anyone with a cold or cough stays home from clubs until symptoms have passed. Thank you 2/2 #Covid_19 #Furzedown @furzedown_net,,,,,,0.6597,0.0,0.856,0.14400000000000002
MeadeClaire,1235501209781493760,2020-03-05 09:43:37+00:00,6,#Shakespeare #ShakespeareSavesLives #LadyMacbeth #Covid_19,,5,1,"Think #Shakespeare is boring, think again! Out damned spot... the perfect way to fight viruses! #ShakespeareSavesLives #LadyMacbeth #Covid_19 ",,,,,Shakespeare LadyMacbeth,-0.5242,0.314,0.5429999999999999,0.14300000000000002
MikScarlet,1235500326993551362,2020-03-05 09:40:07+00:00,7,,,1,2,Coronavirus or climate change? I know which one I'm worried about. We'll have a vaccine by next year I'm sure but climate change? We need a vaccine for that now before it is unstoppable.,,,,,Coronavirus,-0.3632,0.113,0.8420000000000001,0.045
Veronica_Foote_,1235496502295846913,2020-03-05 09:24:55+00:00,1,#Covid19 #Italy #Italia,@YouTube,1,0,"Italy is experiencing an unprecedented trauma: #Covid19. With it’s typical resourcefulness &amp; resilience, Italy will pull through but this beautiful country will need our support. #Italy #Italia Italy The Extraordinary Commonplace https://youtu.be/rAq9-zdlad8 via @YouTube",,,,,Italy Covid19 amp Italy # Italy # Italia Italy Extraordinary Commonplace https://youtu.be/rAq9-zdlad8 @YouTube,0.8775,0.044000000000000004,0.723,0.233
rachelkennedy84,1235495782209540097,2020-03-05 09:22:03+00:00,1,#COVID19,@CMO_England,0,0,"‘Don’t touch your face, wash your hands, then do what you like’ Chris Whitty @CMO_England advice on when you’ve been out and about #COVID19",,,Chris Whitty @CMO_England,,Chris Whitty @CMO_England,0.0,0.0,1.0,0.0
RobertJamesBone,1235493081547489281,2020-03-05 09:11:19+00:00,2,,,0,1,Everyone’s having to put holidays past HR to make sure it’s all good for coronavirus but I don’t have any :(,,,,,HR coronavirus :(,-0.1154,0.147,0.648,0.20600000000000002
AnnMroz,1235492428347564032,2020-03-05 09:08:43+00:00,0,,,2,0,We’ve got a live blog for school staff to get the latest news and help on everything Coronavirus related ,,,,Coronavirus,Coronavirus,0.4019,0.0,0.87,0.13
samdally,1235492306247127042,2020-03-05 09:08:14+00:00,0,#covid19,,0,0,The best #covid19 advice going tbf ,,,,,,0.6369,0.0,0.5429999999999999,0.457
Crundwell,1235491504677888000,2020-03-05 09:05:03+00:00,0,#COVID19,,0,0,Or comment on #COVID19 !,,,,,,0.0,0.0,1.0,0.0
Crundwell,1235490581633216512,2020-03-05 09:01:23+00:00,2,#COVID19,,0,1,#COVID19 Dudders - now go and wash your paws! ,,,,,,0.0,0.0,1.0,0.0
LettsomGrow,1235490397432041472,2020-03-05 09:00:39+00:00,2,#COVID19,,1,0,This is esp important in an densely populated area with a transient population and a high number of residents don't have English as their first language. Telephone triage is a way to help people understand not to spread contagious diseases. This isn't just about #COVID19,,,,,English,0.7037,0.0,0.84,0.16
hugeb0ss,1235489521904619525,2020-03-05 08:57:10+00:00,0,,@mrjamesob @NickFerrariLBC,0,0,@mrjamesob @NickFerrariLBC Coronavirus could end up destroying the EU quicker than anything unfortunately,,,,EU,@mrjamesob Coronavirus EU,-0.7184,0.353,0.647,0.0
hugeb0ss,1235489284444098561,2020-03-05 08:56:14+00:00,0,,@mrjamesob @NickFerrariLBC,0,0,@mrjamesob @NickFerrariLBC question who is going to take responsibility for the Syrian migrants out in Turkey if they get Coronavirus and does James think that Germany is going to open its hospitals to Italians with Coronavirus as they need they beds for they own people,,,,Coronavirus,@mrjamesob Turkey Coronavirus James Germany Italians Coronavirus,0.0,0.0,1.0,0.0
ARBaggs,1235488939751944192,2020-03-05 08:54:52+00:00,0,,,0,0,"Incredible that 8years in from the 2012 Olympics and a successful pilot of London’s ability to remote work, so few companies are allowing employees to work remotely all the time anyway - Covid-19 or not.",,,,,Olympics London,0.7269,0.0,0.8440000000000001,0.156
andyhyde45,1235488218121830402,2020-03-05 08:52:00+00:00,1,,,0,1,Save our Hong Kong warns residents not to kiss pets after dog contracts coronavirus ,,,,,Hong Kong coronavirus,0.12,0.20800000000000002,0.613,0.17800000000000002
morwenw,1235487274277748736,2020-03-05 08:48:15+00:00,1,#Covid_19,,0,0,A really strong listen #Covid_19 ,,,,,,0.5563,0.0,0.527,0.473
A1isonG1ynn,1235486317774954496,2020-03-05 08:44:27+00:00,0,#Coronvirus #urgentquestion #NHS,@JonAshworth,0,0,@JonAshworth can you find out if DH are exploring how private sector resources(hospitals and staff) might support NHS response to COVID 19? #Coronvirus #urgentquestion #NHS,,nhs,,,@JonAshworth DH NHS COVID Coronvirus NHS,0.4019,0.0,0.899,0.10099999999999999
A_Pregel,1235486216730152960,2020-03-05 08:44:02+00:00,1,#covid19,,0,1,"Have you checked how many rolls remain in the toilet paper aisle? If the answer is 0, it may explain why people are avoiding fibre. Your experiment may prove the correlation postulated in the original theory - someone may be up for a Nobel here. I’ll go prepare a speech. #covid19",,,,,Nobel,-0.0258,0.045,0.912,0.043
dleighpemberton,1235485628155887621,2020-03-05 08:41:42+00:00,6,#HarryPotter #paddingtonbear #WorldBookDay,@WorldBookDayUK @UKParliament @MattHancock @BorisJohnson,1,1,Why is it that only kids are allowed to dress up for @WorldBookDayUK? Wouldn’t it be great if grown ups could too? I’d love to be at work at @UKParliament &amp; see @MattHancock talk Coronavirus as #HarryPotter or @BorisJohnson give a statement as #paddingtonbear... #WorldBookDay,,,@BorisJohnson,,@WorldBookDayUK @UKParliament amp Coronavirus # HarryPotter @BorisJohnson #,0.8645,0.0,0.8320000000000001,0.168
pjchen,1235485358348894208,2020-03-05 08:40:38+00:00,8,#Taiwan #COVID19 #JAMA,,2,1,#Taiwan's comprehensive public health mechanism to #COVID19 published in #JAMA. Taiwan’s government learned from its 2003 SARS experience and has done an example of how a society can respond quickly to a crisis and protect the interests of its citizens.,,government,,,Taiwan JAMA Taiwan SARS,0.128,0.08800000000000001,0.7709999999999999,0.141
GaryGreen28,1235485062268846081,2020-03-05 08:39:27+00:00,0,,,0,0,"Id rather be made aware by media being anal about coronavirus than not, also 3000 deaths isnt over hyping unless your god..and your not, keep on guard with your health m8",,,,,coronavirus god,0.34,0.0,0.9259999999999999,0.07400000000000001
johnDmartinez,1235484894538719232,2020-03-05 08:38:47+00:00,0,#Flybe #Flybecollapse,,0,0,They have quoted coronavirus as a factor that exacerbated an already precarious situation for the airline #Flybe #Flybecollapse,,,,,coronavirus Flybe Flybecollapse,0.0,0.0,1.0,0.0
chantalchamp,1235483570187182080,2020-03-05 08:33:31+00:00,2,#Covid_19 #Coronvirus #selfemployed #COVID19 #tax,@LBC @BBCSurrey @LBCNews,0,0,With the self employed being out of pocket if they need to self isolate due to #Covid_19 perhaps the government should implement a 0% tax band for those people to help for a year @LBC #Coronvirus #selfemployed #COVID19 #tax @BBCSurrey @LBCNews,,government,,,# Coronvirus @LBCNews,0.2263,0.040999999999999995,0.897,0.062
djbhammer7,1235483409302028288,2020-03-05 08:32:53+00:00,0,#masktime,,0,0,Some woman coughing and spluttering all over the place on my train carriage. Welcome aboard the Coronavirus service to Charing Cross. Marvellous. #masktime,,,,Charing Cross,Coronavirus Charing Cross,0.4767,0.0,0.8370000000000001,0.163
RenegadePlayboy,1235483226367541248,2020-03-05 08:32:09+00:00,2,,,1,1,Are you stockpiling for coronavirus or for no-deal Brexit in Jan 2021?,,,,,coronavirus Brexit Jan,0.0,0.0,1.0,0.0
DanNouveau,1235481186044010497,2020-03-05 08:24:03+00:00,12,,,2,1,"That viral Viet song used to combat Coronavirus... the reason you might think it might be a great club hit is because it is! It’s a pop song from 2017: Ghen by Khac Hung, Min and Eric https://m.youtube.com/watch?v=Vk8_0QaJr3I",,,Eric,,Viet Coronavirus Ghen Khac Hung Min Eric,0.4574,0.055999999999999994,0.841,0.10300000000000001
ianjindal,1235481118469697536,2020-03-05 08:23:47+00:00,2,,@InfoMullet @daniel_kilger,0,0,H/t to @InfoMullet for this excellent piece on coronavirus - an approach to the statistics and perception of virus reporting - http://infomullet.com/2020/03/02/covid19mentalmodel/ found via @daniel_kilger,,,,,H @InfoMullet coronavirus http://infomullet.com/2020/03/02/covid19mentalmodel/ @daniel_kilger,0.657,0.0,0.846,0.154
Sam72736122,1235480983308206080,2020-03-05 08:23:15+00:00,0,,,0,0,Coronavirus: Boris Johnson to reveal government plan to tackle outbreak of COVID-19 | Politics News | Sky News – at Bus Stop D Whetstone - The Griffin,,government,Boris Johnson,,Coronavirus Boris Johnson | Politics News | Sky News Bus Stop D Whetstone Griffin,0.0,0.0,1.0,0.0
dannymcg,1235480346059210752,2020-03-05 08:20:43+00:00,15,#COVID #AskRenal,@DHSCgovuk @NHSEngland @RenalAssoc,10,7,Is anyone at a national level working out what we are going to do with dialysis units when #COVID kicks off? @DHSCgovuk @NHSEngland @RenalAssoc #AskRenal,,,,COVID,AskRenal,0.0,0.0,1.0,0.0
pam_das,1235479661536137216,2020-03-05 08:18:00+00:00,1,#Covid_19,@Telegraph,0,0,"43, 000 nursing vacancies (& this before #Covid_19). Florence Nightingale would be turning in her grave! Fears over pressure on care system as National Audit Office warns staff and funding are not sustainable' | via @telegraph",,,,National Audit Office,Florence Nightingale National Audit Office,-0.6239,0.214,0.713,0.07400000000000001
kapowaz,1235477971843952640,2020-03-05 08:11:17+00:00,0,,,0,0,"On the positive side, coronavirus is giving Londoners chance to act out their inner fetish clubber on the tube, gas masks and all. ",,,,,coronavirus Londoners,0.7906,0.0,0.7140000000000001,0.28600000000000003
