username,tweet_id,date,favorites,hashtags,mentions,retweets,replies,text,topical_persons,topical_orgs,persons,orgs,propn,compound,neg,neu,pos
AStarDiamonds,1235714815651348480,2020-03-05 23:52:25+00:00,1,#CoronaVirusSA #Coronvirus #CoronaVirusChallenge #coronavirus #TysonFuryGypsyKing #DERMUN #virginmediadown #lauvxbts #lauvxbts #WarrenToBernie #coronavirusinindia #SpotifyAwards #BidenWarren2020 #RubbishKumar #CoronaAlert #lol,,1,0,Diamond and Gemstone Dealer/Jeweller http://www.astardiamonds.com #CoronaVirusSA #Coronvirus #CoronaVirusChallenge #coronavirus #TysonFuryGypsyKing #DERMUN #virginmediadown #lauvxbts #WarrenToBernie #coronavirusinindia #SpotifyAwards #BidenWarren2020 #RubbishKumar #CoronaAlert #lol,,,,SpotifyAwards,Diamond Gemstone Dealer Coronvirus TysonFuryGypsyKing # WarrenToBernie # SpotifyAwards # # RubbishKumar # CoronaAlert,0.6369,0.0,0.7759999999999999,0.224
spizzenergi,1235707983654502402,2020-03-05 23:25:16+00:00,0,#coronavirus,,0,0,"#coronavirus Wash your hands, then wash your brains... @London Bridge https://www.instagram.com/p/B9Xsyixjvjz/?igshid=1w9e8klfyinsk",,,,@London Bridge https://www.instagram.com/p/B9Xsyixjvjz/?igshid=1w9e8klfyinsk,coronavirus Wash @London Bridge https://www.instagram.com/p/B9Xsyixjvjz/?igshid=1w9e8klfyinsk,0.0,0.0,1.0,0.0
Ntsaldaraki,1235705463225954305,2020-03-05 23:15:15+00:00,0,#manners #coronavirus #whatgoesaround,@TfL,0,1,"If you have strong opinions and reject it all as hysteria, please do not feel obliged to bully others, as some middle-aged moron just did to my daughter on the tube for covering her face with her scarf #manners #coronavirus #whatgoesaround @TfL",,,,,# coronavirus # whatgoesaround @TfL,-0.7506,0.224,0.672,0.104
CarstenLincke,1235703483778678784,2020-03-05 23:07:23+00:00,0,#coronavirus,@BBCOne @rivm,0,0,@BBCOne #coronavirus Dit is zo anders hier in Engeland dan in vele NL media Zelfs leden van de oppositie zeggen “...listen to the experts who are knowing what they are talking about...” @rivm,,,Zelfs leden van de oppositie zeggen,,@BBCOne coronavirus Dit zo Engeland dan vele NL Zelfs van de oppositie zeggen,0.0,0.0,1.0,0.0
aaronrutigliano,1235703138411311104,2020-03-05 23:06:01+00:00,3,#coronavirus,,1,1,"Le prossime 2/3 settimane saranno le piu’ dure per quasi tutto il pianeta, mi piace immaginare la sconfitta del #coronavirus con tanto di festeggiamenti in tutto il mondo con tutte le persone insieme a festeggiare! stringiamoci tutti insieme! Anzi non si puo’ , a 3 metri!",,,,,Le saranno le piu quasi tutto il pianeta mi piace immaginare la sconfitta del # coronavirus tanto festeggiamenti tutto il mondo con tutte le persone stringiamoci Anzi,0.0,0.0,1.0,0.0
ZR786,1235702686311477256,2020-03-05 23:04:13+00:00,0,#bbcqt #racism #coronavirus,,0,0,#bbcqt #racism on #coronavirus with people being beaten up for being Asian! Govts doing nothing,,,,,coronavirus,-0.8016,0.35600000000000004,0.644,0.0
AimeeLJames,1235700763256647687,2020-03-05 22:56:34+00:00,1,#coronavirus,@catholicEW,0,3,Lads - @catholicEW has spoken... please wash your hands but let’s all drink out the same cup You can have the infection and not be coughing etc yet! Come on! this needs to be amended! #coronavirus ,,,,,Lads @catholicEW coronavirus,0.3666,0.0,0.933,0.067
_josephdewey,1235700102917955585,2020-03-05 22:53:57+00:00,2,#brexit #coronavirus,,0,0,Remember that time we weren't talking about a #brexit trade deal! #coronavirus,,,,,coronavirus,0.0,0.0,1.0,0.0
WandsworthEye,1235699047903580160,2020-03-05 22:49:45+00:00,1,#coronavirus,,0,1,"V impressed by the sober approach of the Germans to #coronavirus. Tonight it’s the 5th item on their main TV news site after the Turkish migrant crisis, ceasefire in Idlib, and Bundestag debate on rightwing extremism. In a poll, 89% of Germans said they hadn’t gone panic-buying. ",,,,,V Germans Idlib Bundestag Germans,-0.25,0.079,0.862,0.059
ZR786,1235698713177264128,2020-03-05 22:48:26+00:00,1,#bbcqt #coronavirus,,0,0,"#bbcqt sensible advice on the panel , basically older people need to take care #coronavirus",,,bbcqt,,coronavirus,0.4939,0.0,0.8140000000000001,0.18600000000000005
nicktotty,1235696392775045122,2020-03-05 22:39:12+00:00,0,#coronavirus,,0,0,Been to asda tonight and shelves empty in the shower gel and tinned food aisles... honestly for what?! People believe too much nowadays #coronavirus,,,,,asda coronavirus,0.3595,0.066,0.812,0.122
CarstenLincke,1235695087222312960,2020-03-05 22:34:01+00:00,3,#coronavirus,@GSTTnhs @AmyandFriends @AmyandFriendsNL @rivm @BBCNews,1,1,"On a short visit to colleagues in London at @GSTTnhs and @AmyandFriends @AmyandFriendsNL, it is comforting to note that the British approach to #coronavirus is pretty much the same as advised by @rivm @BBCNews keep calm, and adhere to basic hygiene principles",,,,@rivm @BBCNews,London @GSTTnhs # coronavirus @rivm @BBCNews,0.802,0.0,0.826,0.174
KBallsays,1235691341096652800,2020-03-05 22:19:08+00:00,2,#Coronavirus,,0,0,I found a #Coronavirus based tweet I can trust. ,,,Coronavirus,,Coronavirus,0.5106,0.0,0.708,0.292
lifeof_chey,1235689917805715456,2020-03-05 22:13:29+00:00,1,#coronavirus,,0,1,Please don’t forget that there are way more people recovering from covid-19 than dying from it. Just wash your hands anyway. #coronavirus,,,coronavirus,,covid-19 coronavirus,0.1027,0.079,0.826,0.095
SamiSumner,1235688756704940034,2020-03-05 22:08:52+00:00,0,#CoronaVirus #Disappointed,,0,0,Sad that my gig next Thursday has been cancelled as the venue is scared about #CoronaVirus ... oh well I’ll book more gigs! #Disappointed,,,,,Thursday CoronaVirus,-0.8615,0.35600000000000004,0.58,0.064
SashaBirkin,1235688646356934658,2020-03-05 22:08:25+00:00,1,#coronaviruspets #coronavirusdogs #coronavirus,,0,0,Not sure whether to laugh or cry! #coronaviruspets #coronavirusdogs #coronavirus ,,,,,coronavirus,-0.1911,0.336,0.439,0.226
StefanoFugazzi,1235687652277522433,2020-03-05 22:04:28+00:00,2,#Cupid #psychosis #coronavirus #CoronaVirusUpdate,,0,0,#Cupid and... #psychosis #coronavirus #CoronaVirusUpdate,,,Cupid,,Cupid,0.0,0.0,1.0,0.0
e4billycab,1235686447753187338,2020-03-05 21:59:41+00:00,0,#coronavirus,@IainDale @TomSwarbrick1,0,0,@IainDale @TomSwarbrick1 Do you think the Mayoral election will be postponed !! #coronavirus,,,,,@IainDale @TomSwarbrick1 coronavirus,-0.3365,0.166,0.8340000000000001,0.0
jason7579,1235683271377326082,2020-03-05 21:47:04+00:00,0,#coronavirus #Coronvirus #COVID #music,,0,0,No 1 song worldwide by the weekend #coronavirus #Coronvirus #COVIDー19 #music,,,,,Coronvirus COVIDー19,-0.29600000000000004,0.18,0.82,0.0
ThatVetSean,1235683024655667200,2020-03-05 21:46:05+00:00,27,#Coronavirus #coronavirus #COVID #dogs #veterinary,,9,2,Did you hear about the dog in Hong Kong testing positive for #Coronavirus? Is that a thing? Watch to find out! #coronavirus #COVIDー19 #dogs #veterinary,,,,,Hong Kong # Coronavirus COVIDー19,0.643,0.0,0.8490000000000001,0.151
colinwatkins,1235682403974361090,2020-03-05 21:43:37+00:00,2,#coronavirus,,1,0,UK and US also top two countries least in fear of #coronavirus. ,,,coronavirus,,UK US # coronavirus,-0.34,0.213,0.667,0.12
MuradQureshiLDN,1235681005547241472,2020-03-05 21:38:04+00:00,4,#coronavirus,,0,0,Funnily enough on the New York subway they are cleaning down all the tunnels every night since the outbreak of #coronavirus,,,,,New York # coronavirus,0.4404,0.0,0.873,0.127
riethmayer,1235679745460891662,2020-03-05 21:33:03+00:00,4,#Coronavirus #zencargo #Remotework,,0,0,"Worked from home for 2 weeks due to #Coronavirus after feeling sick coming back from Berlin. Looking forward to seeing my #zencargo office again. Will pick up a flu shot to train my immune system further, advice from my smart scientist wife #Remotework = competitive advantage.",,,Remotework,,# Coronavirus Berlin # Remotework,0.29600000000000004,0.107,0.7090000000000001,0.184
cbm1001,1235679264445534209,2020-03-05 21:31:09+00:00,0,#coronavirus,@KFC_UKI,0,0,Latest @KFC_UKI TV spot is a long stream of people licking their fingers. Not the message to be sending right now. #coronavirus ,,,,Latest @KFC_UKI TV,coronavirus,0.0,0.0,1.0,0.0
LAvivson,1235678798978445313,2020-03-05 21:29:18+00:00,3,#Coronavirus,,0,1,"""Coronavirus: Cases rise in Europe as global death toll exceeds 3,200"" #Coronavirus ",,,,,Coronavirus Europe Coronavirus,-0.5994,0.262,0.738,0.0
dannywhite_off,1235676420724191234,2020-03-05 21:19:51+00:00,1,#coronavirus,,0,0,i’m actually kinda proud of this tiktok loool issa short story of #coronavirus in london ,,,,,tiktok loool issa # coronavirus london,0.4228,0.0,0.833,0.16699999999999998
Millsyrob,1235676318961786880,2020-03-05 21:19:26+00:00,7,#coronavirus,,1,0, Deaths in USA from Coronavirus during 2020 Deaths in USA from guns during 2020 #coronavirus,,,,,USA Coronavirus USA coronavirus,0.0,0.0,1.0,0.0
BigDaddyToes,1235675838642884609,2020-03-05 21:17:32+00:00,1,#handsanitiser #handwash #supermarket #London #coronavirus #COVID19,,0,0,Not much luck finding #handsanitiser and #handwash at a Sainsbury #supermarket in central #London tonight... the new gold in the age of #coronavirus #COVID19,,,,,Sainsbury # London,-0.35700000000000004,0.097,0.903,0.0
sha_braithwaite,1235672695800557582,2020-03-05 21:05:03+00:00,2,#Coronavirus,,0,0,Gotta love oat milk. #Coronavirus ,,,Coronavirus,,Coronavirus,0.6369,0.0,0.488,0.512
mbcomedian1,1235670502313783299,2020-03-05 20:56:20+00:00,0,#coronavirus,,0,0,Corona and Lime diseaae #coronavirus ,,,,,Corona Lime # coronavirus,0.0,0.0,1.0,0.0
JackpotRod,1235670494780755968,2020-03-05 20:56:18+00:00,0,#nopasta #coronavirus,,0,1,Apparently pasta is the cure. Should have told the Italians. #nopasta #coronavirus ,,,,,Italians nopasta coronavirus,0.0,0.0,1.0,0.0
AdamBates_D6,1235670348076445696,2020-03-05 20:55:43+00:00,1,#coronavirus,,0,0,Do not waste vodka! #coronavirus ,,,,,coronavirus,0.3867,0.0,0.604,0.396
Ruben_E_O,1235669390240018432,2020-03-05 20:51:54+00:00,1,#coronavirus #enserio #EspanaViva #Eurovision #CoronaAlert,,0,0,De verdad? #coronavirus #enserio #EspanaViva #Eurovision #CoronaAlert,,,,,De coronavirus EspanaViva Eurovision CoronaAlert,0.0,0.0,1.0,0.0
Angie_RejoinEU,1235664410036916224,2020-03-05 20:32:07+00:00,2,#NHS #Coronavirus #JustSaying,,0,0,In UK seems 2b opposite - my local (South London) #NHS GP surgery has nothing on show about #Coronavirus - when I asked I was told to look online for info and updates. I've already done that - but I'm probably a minority. Meanwhile death toll rises from 2% to 3.7? #JustSaying,,nhs,,,UK South London NHS GP Coronavirus JustSaying,-0.7469,0.095,0.905,0.0
patrickgjackson,1235662876645502976,2020-03-05 20:26:01+00:00,4,#Coronavirus,,0,4,My family in Reading (where the UK’s first #Coronavirus fatality was being treated) have been unable to buy anti-bacterial gel in the shops so they are making do with travel spray bottles filled with surgical spirit. Just passing on a tip,,,Coronavirus,,Reading UK Coronavirus,-0.5859,0.1,0.863,0.038
VixxPea,1235658538082603008,2020-03-05 20:08:47+00:00,0,#Coronavirus #UKfloods #Megxit #Flybe #PresidentialRace2020,,0,1,"I’ve been rather preoccupied with #Coronavirus, #UKfloods, #Megxit and #Flybe... so could somebody plz furnish me with a digest of the #PresidentialRace2020 in one tweet?",,,,,Coronavirus Flybe,0.14400000000000002,0.0,0.939,0.061
tonymiller_uk,1235657478739767297,2020-03-05 20:04:34+00:00,6,#coronavirusuk #handsanitiser #makeyourown #coronavirus #COVID,,6,0,Can’t find hand sanitizer? Make your own! Stir Isopropyl alcohol and aloe vera gel together until well blended. Add 8-10 drops of scented essential oil (optional). You’re welcome. #coronavirusuk #handsanitiser #makeyourown #coronavirus #COVIDー19,,,,,Isopropyl aloe vera # COVIDー19,0.8221,0.0,0.777,0.223
BakalLabICR,1235655582972960768,2020-03-05 19:57:03+00:00,4,#actin #focaladhesions #coronavirus #FAK,,0,0,More ThunderSTORM of #actin (red) and #focaladhesions (green). There is good literature on viruses like Ebola using integrins to get into cells....wonder if it is the same for #coronavirus? For sure #FAK is involved!,,,coronavirus,,# Ebola FAK,0.7901,0.0,0.795,0.205
BdexEntz,1235654096113332224,2020-03-05 19:51:08+00:00,0,#coronavirus #nhs #bdexentertainment #bdextv,,0,0,"guideline to fight #coronavirus #nhs #bdexentertainment #bdextv @London, United Kingdom https://www.instagram.com/p/B9XUSDYBMMw/?igshid=166na6t51r6ho",,nhs,,,coronavirus # nhs @London United Kingdom,0.0516,0.181,0.625,0.194
SpinksTom,1235652568489082880,2020-03-05 19:45:04+00:00,0,#coronavirus #toiletroll #panicbuy #waitrose #twickenham,,0,0,"When all about you are losing their heads, be over the moon that you get the last pack of toilet roll out of the supermarket #coronavirus #toiletroll #panicbuy #waitrose #twickenham – at Waitrose &amp; Partners",,,,Waitrose &amp,# coronavirus # toiletroll panicbuy # Waitrose Partners,-0.3818,0.071,0.929,0.0
hbbeautee,1235651605594333186,2020-03-05 19:41:14+00:00,0,#CoronaVirusSA #coronavirus #CoronavirusOutbreak,,0,0,The media needs to stop making the virus look bigger than it really is ... it's literally viral pneumonia... its been here for yearrssss. #CoronaVirusSA #coronavirus #CoronavirusOutbreak,,,,,yearrssss CoronavirusOutbreak,-0.29600000000000004,0.078,0.922,0.0
mbcomedian1,1235650457630109696,2020-03-05 19:36:41+00:00,0,#coronavirus,,0,0, My Corona #coronavirus ,,,,,Corona,0.0,0.0,1.0,0.0
rohit_rai9,1235647537857601536,2020-03-05 19:25:04+00:00,0,#coronavirus #investors #china,@BNPP_Wealth,0,0,The recent acceleration of the #coronavirus outbreak has started to unnerve #investors. So what can we expect to learn from the past. https://app.quuu.co/r/8jywG #china @BNPP_Wealth,,,,,# coronavirus china,0.0,0.0,1.0,0.0
aviosAdventurer,1235646590490226688,2020-03-05 19:21:19+00:00,7,#CoronaVirus,,0,1,"Due to #CoronaVirus a work event in Mallorca, has been postponed from April..... until June... Oh no, Mallorca in June is going to be terrible ",,,,,# CoronaVirus Mallorca April June Mallorca June,-0.5994,0.17600000000000002,0.8240000000000001,0.0
Liv80867502,1235645984782327813,2020-03-05 19:18:54+00:00,1,#coronavirus #masks #togo,,0,0,Masks to go anyone ? #coronavirus #masks #togo – at Nôm Living,,,,,coronavirus # Nôm Living,0.0,0.0,1.0,0.0
EricdeMarylebon,1235645893317099520,2020-03-05 19:18:32+00:00,0,#Coronavirus,,0,0,"""Coronavirus: Cases rise in Europe as global death toll exceeds 3,200"" #Coronavirus ",,,,,Coronavirus Europe Coronavirus,-0.5994,0.262,0.738,0.0
EricdeMarylebon,1235644004001370115,2020-03-05 19:11:02+00:00,0,#Coronavirus,,0,0,"""Coronavirus: Cases rise in Europe as global death toll exceeds 3,200"" #Coronavirus https://twitter.com/i/events/1219057585707315201",,,,,Coronavirus Europe Coronavirus https://twitter.com/i/events/1219057585707315201,-0.5994,0.245,0.755,0.0
RiyaWrite,1235642940271271939,2020-03-05 19:06:48+00:00,3,#coronavirus #COVID19 #CoronavirusOutbreak #uk,,0,1,The UK are not even prepared for snow how were they going to be prepared for coronavirus! #coronavirus #COVID19 #CoronavirusOutbreak #uk,,,,,UK coronavirus COVID19 # CoronavirusOutbreak uk,0.1346,0.073,0.831,0.096
adamswersky,1235642440029216771,2020-03-05 19:04:49+00:00,1,#coronavirus,,0,0,It feels like everyone on TV explaining why we shouldn’t touch our face does so while touching their face. Don’t touch your face! #coronavirus ,,,,,coronavirus,0.4199,0.0,0.892,0.108
adidar01,1235642250635419651,2020-03-05 19:04:04+00:00,0,#virus #antibacterial #outbreak #coronavirus #dettol,,0,2,Finally got some supplies from different sources. With the corona virus madness it's almost impossible to find antibacterial wipes/handgels in supermarket or online in the UK. Companies have also restricted bulk buying. #virus #antibacterial #outbreak #coronavirus #dettol,,,,,UK coronavirus # dettol,-0.6705,0.136,0.8640000000000001,0.0
Kevenlaw,1235641162939207681,2020-03-05 18:59:45+00:00,4,#coronavirusuk #panicbuying #coronavirus #toiletpapercrisis #ToiletPaperApocalypse,,0,0,"Lol, I've 24 rolls that I got a couple of weeks ago, that's me sorted for at least 6 months, bring on the zombie apocalypse #coronavirusuk #panicbuying #coronavirus #toiletpapercrisis #ToiletPaperApocalypse",,,,,coronavirusuk #,0.4215,0.0,0.912,0.08800000000000001
OllyMayMedia,1235638031811571712,2020-03-05 18:47:18+00:00,8,#coronavirus,,0,0,Throw-ins have also been replaced with kick-ins. Every player must now also wear an inflatable zorb to stop the spread during set pieces such as grappling during corner kicks. #coronavirus ,,,,,coronavirus,-0.29600000000000004,0.071,0.929,0.0
chriswright35,1235637425097052160,2020-03-05 18:44:53+00:00,1,#coronavirus #LFC #YNWA,,0,0,"Just imagine Liverpool lifting the Premier League title behind closed doors due to the #coronavirus, which could happen yano. Now wouldn't that be an anti-climax! #LFC #YNWA",,,YNWA,,Liverpool Premier League # yano,0.0,0.0,1.0,0.0
NeasdenTemple,1235636582415101952,2020-03-05 18:41:32+00:00,40,#NeasdenTemple #IWD2020 #IWD2020 #Holi #Holi #coronavirus #COVID19,,24,0,NEWS: Please note that all weekly assemblies and events at #NeasdenTemple have been postponed until further notice - including this Sunday’s #IWD2020 and Monday's #Holi celebrations. More news in due course. #coronavirus #COVID19 http://londonmandir.baps.org/2020/03/coronavirus-covid-19-public-announcement-regarding-all-baps-events-in-uk-europe/ – at BAPS Shri Swaminarayan Mandir,,,,,NeasdenTemple Sunday Monday # COVID19 http://londonmandir.baps.org/2020/03/coronavirus-covid-19-public-announcement-regarding-all-baps-events-in-uk-europe/ BAPS Shri Swaminarayan Mandir,0.128,0.043,0.903,0.055
chriswright35,1235636522227023872,2020-03-05 18:41:18+00:00,0,#coronavirus,@premierleague,0,0,OFFICIAL: No pre-match handshakes in @premierleague matches until further notice. #coronavirus ,,,,,OFFICIAL coronavirus,-0.29600000000000004,0.18,0.82,0.0
sha_braithwaite,1235635998517653505,2020-03-05 18:39:13+00:00,0,#italy #coronavirus,,0,0,"“I would like to invite everyone to carefully observe these indications: even if they may temporarily change some of our life habits. By respecting those criteria of behavior, each of us will concretely contribute to overcoming this emergency”, he added. #italy #coronavirus",,,italy,,# italy # coronavirus,0.7783,0.0,0.812,0.188
sha_braithwaite,1235635002777505793,2020-03-05 18:35:16+00:00,0,#italy #coronavirus,,0,1,"The Italian president invited the country to follow the the government’s indications of daily behavior, “suggested by scientists and valuable experts. They are simple but important to avoid the risk of widening the spread of the infection.” #italy #coronavirus",,government,,,italy # coronavirus,-0.29600000000000004,0.122,0.7829999999999999,0.095
sha_braithwaite,1235635000776830976,2020-03-05 18:35:15+00:00,0,#coronavirus #Italy,,0,1,"“The danger of a new virus that is hitting many countries around the world is causing concern. This is understandable and requires everyone's sense of responsibility, but we must absolutely avoid unmotivated and often counterproductive states of anxiety.” #coronavirus #Italy",,,,,coronavirus # Italy,-0.8384,0.195,0.805,0.0
deborah_bonetti,1235634980291850240,2020-03-05 18:35:10+00:00,3,#coronavirus,,0,0,What to look out for in #coronavirus symptoms. Diarrhoea included. ,,,,,Diarrhoea,0.0,0.0,1.0,0.0
SandyRashty,1235633427485003777,2020-03-05 18:29:00+00:00,1,#coronavirus,,0,0,Cockney for #coronavirus? http://www.newsbiscuit.com/2020/03/04/cockneys-announce-miley-cyrus-as-official-rhyming-slang-for-coronavirus/,,,,,,0.0,0.0,1.0,0.0
JaciniGiovanni,1235632913917472768,2020-03-05 18:26:58+00:00,0,#coronavirus,,0,0,Io sono stato favorevole a dare più autonomia alle regioni... Ma dopo questa esperienza del #coronavirus ci sto ripensando non siamo all'altezza,,,,,Io più autonomia alle regioni Ma esperienza del # coronavirus ci sto ripensando non siamo all'altezza,0.0,0.0,1.0,0.0
SLAcupuncture,1235632185379631109,2020-03-05 18:24:04+00:00,3,#covid_19 #coronavirus #kungfu,@KungAcupuncture @MeshalALjaser,1,0,"Kung-Fu’ing Coronavirus . . Thanks to @kungacupuncture for sharing &amp; @meshalaljaser for a great vid . #covid_19 #coronavirus #kungfu @London, United Kingdom https://www.instagram.com/p/B9XJolWHHcF/?igshid=1lcabtw9vd5lh",,,,,Kung Coronavirus amp covid_19 # coronavirus # @London United Kingdom,0.9118,0.0,0.601,0.399
coldandpressed,1235629830995091458,2020-03-05 18:14:43+00:00,2,#coronavirus #coronaviruslondon #facts #FactsMatter,,1,0,"Covent Garden is becoming ghost town due to coronavirus effects.... no people, no economy.... #coronavirus #coronaviruslondon #facts #FactsMatter",,,FactsMatter,,Covent Garden coronavirus coronavirus # coronaviruslondon FactsMatter,-0.3843,0.21,0.701,0.08800000000000001
GeordieRussell,1235627286461927425,2020-03-05 18:04:36+00:00,0,#coronavirus #dontbelievethehype,,0,1,#coronavirus has killed 0.0000014285% of the UK population. #dontbelievethehype @England https://www.instagram.com/p/B9XIGEkHrhn/?igshid=1pizqxgdn5c77,,,,,# coronavirus UK @England,-0.6705,0.31,0.69,0.0
paddyjbee,1235624841065054208,2020-03-05 17:54:53+00:00,0,#panicbuying #pasta #rice #Asda #CoronaVirus #covid19UK,,0,0,"The #panicbuying seems to only be having an impact on the #pasta and #rice aisles, everything else seems fine in this #Asda #CoronaVirus #covid19UK – at Putney Heath",,,Putney Heath,,# Asda # CoronaVirus # Putney Heath,0.2023,0.0,0.938,0.062
GunshopStone,1235624258954391554,2020-03-05 17:52:34+00:00,0,#coronavirus #HSBC #intercontinentalo2 #skybar,,0,0,So #coronavirus has just evacuated the 10th floor of #HSBC .... not too much visible from #intercontinentalo2 #skybar – at Eighteen Sky Bar,,,,,coronavirus HSBC Eighteen Sky Bar,0.0,0.0,1.0,0.0
nanakumi1976,1235623959976173568,2020-03-05 17:51:23+00:00,1,#Coronavirus #panicbuying #sanitisers #toiletissues,,0,0,#Coronavirus pandemic virus creating global issues and troubles and difficulties ahead for the whole wide world too many people around the world will die unfortunately #panicbuying #sanitisers #toiletissues @… https://www.instagram.com/p/B9XGlMzpmrm/?igshid=x2m42o3vh84v,,,,,Coronavirus https://www.instagram.com/p/B9XGlMzpmrm/?igshid=x2m42o3vh84v,-0.8519,0.297,0.6459999999999999,0.057
sha_braithwaite,1235621070142660609,2020-03-05 17:39:54+00:00,1,#coronavirus,,1,0,First #coronavirus death in UK ,,,,,UK,-0.5994,0.494,0.506,0.0
EddCrabtree,1235615831658291200,2020-03-05 17:19:05+00:00,3,#coronavirus,,0,1,"My dentist just insisted on my use of hand sanitiser before my appointment, stating that they’re: “taking hygiene seriously these days” They looked worryingly vacant when I pointed out that, considering where their hands were going, I hope they always did... #coronavirus",,,,,coronavirus,0.6597,0.036000000000000004,0.833,0.13
sinajtojayz,1235614425798885376,2020-03-05 17:13:30+00:00,0,#coronavirus #cancer #cancercure,,0,0,Funny how the world is going crazy cos of #coronavirus but yet people still dying from #cancer fucking sort your priorities. Antibacterial soaps or not can’t help you .. waiting on #cancercure ASAP.. ,,,,,ASAP,-0.867,0.257,0.696,0.047
DomLittlewood,1235613723663966208,2020-03-05 17:10:42+00:00,11,#theoneshow #coronavirus #flybe #london,,0,0,Waiting to go on tonight’s #theoneshow #coronavirus #flybe #london @Broadcasting House https://www.instagram.com/p/B9XB7HoB4yr/?igshid=jqk1dodzrq9v,,,,House,# london @Broadcasting House,0.0,0.0,1.0,0.0
susan_smith2405,1235612439976140800,2020-03-05 17:05:36+00:00,4,#coronavirus #CoronaAlert,,0,0,This.. #coronavirus #CoronaAlert,,,,,CoronaAlert,0.0,0.0,1.0,0.0
katesfxmakeup,1235611865717202951,2020-03-05 17:03:20+00:00,10,#coronavirus #COVID19,,1,6,"Who is actually wearing a face mask on here? Just driven through central to west London, worked in the studios where there are 100s/1000s people, caught two trains and not one mask in sight. No even anyone using alcohol gel. #coronavirus #COVID19",,,,,west London gel,-0.29600000000000004,0.051,0.949,0.0
SianCElliott,1235611237196627969,2020-03-05 17:00:50+00:00,8,#coronavirus,,9,0,"The CBI echoing our call for an end to the arbitrary threshold for statutory sick pay which sees 2 million of our lowest paid workers, 70% of whom are women, miss out on basic protection #coronavirus ",,,,,CBI coronavirus,-0.7845,0.218,0.782,0.0
ArandaQuim,1235610696894865409,2020-03-05 16:58:41+00:00,4,#coronavirus #paranoiavirus,@tonivall @JosepMartBlanch @JosepMartBlanch @gloriagasch,0,0,#coronavirus @tonivall @JosepMartBlanch @JosepMartBlanch @gloriagasch #paranoiavirus,,,,,# coronavirus @tonivall,0.0,0.0,1.0,0.0
Seales67,1235609412766765057,2020-03-05 16:53:35+00:00,5,#coronavirus #ClimateAction,,0,0,"Working from home, less business travel, less airlines - #coronavirus is dropping some useful pointers for #ClimateAction",,,,,# ClimateAction,0.4404,0.0,0.847,0.153
drnsood,1235607433483038721,2020-03-05 16:45:43+00:00,0,#coronavirus #coronoprevention,,0,0,#coronavirus #coronoprevention I can not over stress this point! Not to touch your face nose and eyes with unwashed hands. It’s easier said than done. Look at this video.,,,,,coronavirus #,0.6623,0.0,0.833,0.16699999999999998
HaasSophie,1235607397743419393,2020-03-05 16:45:34+00:00,3,#ClimateChange #coronavirus,,0,2,If only people could freak out about #ClimateChange the way they freak out about #coronavirus that would be amazing ,,,,,ClimateChange,-0.25,0.227,0.625,0.14800000000000002
