username,tweet_id,date,favorites,hashtags,mentions,retweets,replies,text,topical_persons,topical_orgs,persons,orgs,propn,compound,neg,neu,pos
ShadiBarez,1253962787283402753,2020-04-25 08:23:20+00:00,2,#coronavirus #Iran #Iranian #PMOI #MEK,@USAdarFarsi @mbachelet @JavaidRehman @UNHumanRights @JosepBorrellF @eu_eeas @GermanyDiplo @SpainMFA,2,0,"More than 34,700 people have died of the novel #coronavirus in 297 cities checkered across all of #Iran's 31 provinces, according to the #Iranian opposition #PMOI/#MEK. @USADarFarsi @mbachelet @javaidRehman @UNHumanRights @JosepBorrellF @eu_eeas @GermanyDiplo @SpainMFA",,,,@GermanyDiplo,# coronavirus Iran @mbachelet @javaidRehman @UNHumanRights @JosepBorrellF @eu_eeas,-0.3182,0.095,0.8440000000000001,0.061
ShadiBarez,1253962778626400256,2020-04-25 08:23:18+00:00,2,#Iran #Coronavirus #Covid_19 #COVID19 #Corona,@franceonu @SwedenUN @InigoNYC @NLatUN @PLinUN @KuwaitMissionUN @ItalyMFA @USUN @amnesty @AmnestyIran @WHO @tedros @MSF @WHOEMRO,2,1,Ali Khamenei and Hassan Rouhani have abandoned the people of #Iran amidst the #Coronavirus crisis without any support. #Covid_19 #COVID19 #Corona @franceonu @SwedenUN @InigoNYC @NLatUN @PLinUN @KuwaitMissionUN @ItalyMFA @USUN @Amnesty @amnestyiran @who @Tedros @MSF @WHOEMRO,,,,@SwedenUN @InigoNYC @NLatUN,Ali Khamenei Hassan Rouhani # Iran Coronavirus Corona @USUN @Amnesty @Tedros @WHOEMRO,-0.8540000000000001,0.226,0.774,0.0
ShadiBarez,1253962773991694338,2020-04-25 08:23:17+00:00,3,#Coronavirus #Iran #Covid_19,@WHO,3,1,"Fearing the eruption of another uprising, the regime’s supreme leader and president have considered paying subsidies 2 some 3 million impoverished households, a flagrant mockery in the face of the devastating blow dealt to them in the #Coronavirus outbreak #Iran #Covid_19 @WHO",,,,,supreme leader president Coronavirus Iran,-0.7717,0.198,0.732,0.069
ShadiBarez,1253962771374510080,2020-04-25 08:23:16+00:00,7,#coronavirus #Iran #Iranian #PMOI #MEK,@USAdarFarsi @mbachelet @JavaidRehman @UNHumanRights @JosepBorrellF @eu_eeas @GermanyDiplo @SpainMFA,9,1,"More than 34,700 people have died of the novel #coronavirus in 297 cities checkered across all of #Iran's 31 provinces, according to the #Iranian opposition #PMOI/#MEK. @USADarFarsi @mbachelet, @javaidRehman, @UNHumanRights @JosepBorrellF @eu_eeas @GermanyDiplo @SpainMFA",,,,@GermanyDiplo,# coronavirus Iran @USADarFarsi @mbachelet @javaidRehman @UNHumanRights @JosepBorrellF @eu_eeas,-0.3182,0.095,0.8440000000000001,0.061
dalewis89,1253962555929886720,2020-04-25 08:22:25+00:00,0,#COVID19 #coronavirus #Travel,@Expedia,0,0,"@Expedia I need to speak to a human being please about an up and coming booking, alternatively please provide an email address. I do not wish to communicate with an automated service #COVID19 #coronavirus #Travel",,,,,Travel,0.3274,0.058,0.8240000000000001,0.118
CarbonBubble,1253962172352389121,2020-04-25 08:20:54+00:00,6,#coronavirus,,5,0,"Higher fares, fewer routes, pre-flight health checks and less free food. The #coronavirus pandemic is ushering in a new era of air travel ",,,,,# coronavirus,0.4601,0.0,0.88,0.12
ReelNewsLondon,1253961756206141440,2020-04-25 08:19:14+00:00,19,#coronavirus #PPENow #ShutTheSites #PAYEveryWorker,@matsmadrid,23,0,"The #coronavirus global day of action is growing rapidly in support - this is from the rank and file healthworkers movement in Madrid, @matsmadrid. They are joining our international meeting at 5:30pm today too: https://us02web.zoom.us/j/89573338531 #PPENow #ShutTheSites #PAYEveryWorker",,,,,coronavirus Madrid,0.5267,0.0,0.8909999999999999,0.109
The_NewArab,1253960705885306880,2020-04-25 08:15:04+00:00,143,#coronavirus #Ramadan2020 #RamadanMubarak #RamadanMubarak,,3,0,How will the #coronavirus affect #Ramadan2020? What is the medical advice surrounding fasting during a pandemic? How do I ignore the stress and daily food cravings? We answer all of this in this week's podcast episode! #RamadanMubarak Listen in full:,,,,,coronavirus Ramadan2020 # RamadanMubarak Listen,-0.7296,0.139,0.861,0.0
a_m_molenda,1253960665854889985,2020-04-25 08:14:54+00:00,0,#ClapForNHS #COVID__19 #SARSCoV2 #coronavirus #COVID #COVID,,0,0,I thought that clapping for NHS is voluntary not mandatory. I hope that people will recognise that we should not going to clap on order as in communist or totalitarian country would happen. https://www.thesun.co.uk/news/11473891/mum-upset-neighbours-name-and-shame-facebook-clap/ #ClapForNHS #COVID__19 #SARSCoV2 #coronavirus #COVID #COVIDー19,,nhs,,COVID,NHS https://www.thesun.co.uk # COVIDー19,-0.6935,0.154,0.846,0.0
annasergi,1253960638432514048,2020-04-25 08:14:48+00:00,13,#fentanyl #coronavirus,,0,0,The short/medium term risk linked to #fentanyl shortages remains the availability and possibility that other drugs take on ~ Wuhan was a fentanyl capital. Then #coronavirus hit - Los Angeles Times ,,,,Los Angeles Times,Wuhan coronavirus Los Angeles Times,-0.4019,0.113,0.887,0.0
jamesmfahy,1253960613715275781,2020-04-25 08:14:42+00:00,0,#coronavirus #conservative,,0,0,"Record breaking month for migrant Channel crossings, as more than 500 arrive since #coronavirus lockdown #conservative",,,,,Channel coronavirus,0.0,0.0,1.0,0.0
jamesmfahy,1253960246973870080,2020-04-25 08:13:14+00:00,0,#lockdown #coronavirus,,0,0,Letters: Mission creep makes #lockdown an end in itself for an indecisive Cabinet. #coronavirus ,,,,Cabinet,Cabinet coronavirus,-0.25,0.133,0.867,0.0
NetworkRailEUS,1253960212609892357,2020-04-25 08:13:06+00:00,6,#CoronaVirus #StayHomeStaySafe #IsYourJourneyNecessary #ThankYouNHS,@nationalrailenq,5,0, Are you making an essential journey over 2-3May or the early May Bank Holiday please check before you travel. Vital improvements mean services will change and some won’t be running @NationalRailEnq #CoronaVirus #StayHomeStaySafe #IsYourJourneyNecessary #ThankYouNHS,,,,,May Bank Holiday CoronaVirus # ThankYouNHS,0.8176,0.0,0.765,0.235
h24news_uk,1253959872519036930,2020-04-25 08:11:45+00:00,0,#Coronavirus #YstradMynach,,0,0,The normally make environmentally friendly paper straws #Coronavirus #YstradMynach,,,Coronavirus,,Coronavirus YstradMynach,0.4939,0.0,0.7140000000000001,0.28600000000000003
awyliu,1253959777488719873,2020-04-25 08:11:23+00:00,1,#SocialDistanacing #COVID19 #coronavirus,,1,0,Good move - many businesses can operate safely within #SocialDistanacing rules. #COVID19 #coronavirus ,,,SocialDistanacing,,SocialDistanacing,0.7269,0.0,0.643,0.35700000000000004
CJay669,1253959598320558080,2020-04-25 08:10:40+00:00,2,#Covid19UK #coronavirus #fuming #mentalhealth,,0,1,"My blood is boiling!! Its not essential to get sport back on TV, its essential to get families and friends back together!! If rugby and football players are safe to play together then so should families be allowed!! #Covid19UK #coronavirus #fuming #mentalhealth",,,,,Covid19UK,0.7067,0.07200000000000001,0.741,0.187
HackneyBooks,1253959516913315840,2020-04-25 08:10:20+00:00,0,#HackneyBooks #Coronavirus #Ukraine #NUFC,,0,0,Morning News > Coronavirus The After Effects > Ex-Georgia President Now Ukraine Deputy PM > Football Read All About It https://hackneybooks.co.uk/HackneyNews.php All Free All The Time #HackneyBooks #Coronavirus #Ukraine #NUFC,,,,NUFC,Morning News Coronavirus Ex Georgia President Ukraine Deputy PM Time # HackneyBooks # Coronavirus # Ukraine NUFC,0.5106,0.0,0.898,0.102
OptometryToday,1253959445404663811,2020-04-25 08:10:03+00:00,1,#optometry #OT #coronavirus,@Inspecs,0,0,"Robin Totterman, @Inspecs CEO, spoke to us about receiving the Queen’s Award for Enterprise for a second time, the impact of coronavirus, and how Inspecs has been supporting PPE provisions, as worn by NHS staff below. http://ow.ly/MZV330qAzJK #optometry #OT #coronavirus ",,nhs,,,Robin Totterman @Inspecs CEO Queen Award Enterprise coronavirus Inspecs PPE NHS OT,0.6369,0.048,0.8109999999999999,0.14
antonio_pisano,1253959439947829250,2020-04-25 08:10:02+00:00,1,#covid_19 #coronavirus #architecture,,0,0,"With #covid_19 homes have multiplied their uses becoming our offices, our nurseries, our schools, our vegetable plots and our conference centres. We are experiencing both fragility of our infrastructure and resilience of our space. How to evolve from #coronavirus? #architecture",,,coronavirus,,covid_19 coronavirus,0.0,0.0,1.0,0.0
ShadiBarez,1253959378627170310,2020-04-25 08:09:47+00:00,2,#coronavirus #Iran #Iranian #PMOI #MEK,,5,0,"More than 34,700 people have died of the novel #coronavirus in 297 cities checkered across all of #Iran's 31 provinces, according to the #Iranian opposition #PMOI/#MEK.",,,,,# coronavirus Iran,-0.3182,0.12,0.8029999999999999,0.077
joelle47019650,1253959250650464256,2020-04-25 08:09:17+00:00,4,#pandemics #coronavirus #Covid_19 #AnimalRights #CancelAnimalAg #EndSpeciesism #mercy,,3,0,Murdered Animals for food MUST END. Or more #pandemics #coronavirus #Covid_19 #AnimalRights #CancelAnimalAg #EndSpeciesism #mercy,,,,,Animals MUST END AnimalRights # CancelAnimalAg # EndSpeciesism,-0.4404,0.221,0.653,0.126
Mac_campaigning,1253958739490725888,2020-04-25 08:07:15+00:00,5,#coronavirus,@VirendraSharma,1,0,We’re very grateful to @VirendraSharma for supporting our campaign to stop cancer becoming the “forgotten c” during the #coronavirus outbreak. ,,,@VirendraSharma,,@VirendraSharma forgotten coronavirus,-0.1045,0.229,0.556,0.215
bellboyffc,1253958435563077632,2020-04-25 08:06:03+00:00,0,#coronavirus,,0,0,"#coronavirus All we hear is we are being led by the science the concern now is the science is being led by the government, if true will we ever know the truth",,government,,,coronavirus,0.6249,0.0,0.855,0.145
timjmannion,1253958277446209536,2020-04-25 08:05:25+00:00,2,#TV #film #production #COVID19 #coronavirus,,0,0,Another return to work plan coming out of Hollywood. This one is more strict than others... #TV #film #production #COVID19 #coronavirus ,,,,,Hollywood,0.0,0.0,1.0,0.0
finpointUK,1253958186165559299,2020-04-25 08:05:03+00:00,0,#business #coronavirus #businessfinance #businessloan #BusinessGrowth #businessowner #fundingplatform,,0,0,"Helping #business to get access to #coronavirus loans in minutes - Check your options in one go, give it a try today! https://my.finpoint.uk/coronavirus-loans #businessfinance #businessloan #BusinessGrowth #businessowner #fundingplatform",,,,,# coronavirus # BusinessGrowth,0.3595,0.0,0.916,0.084
MarcelMauer,1253958182256476161,2020-04-25 08:05:02+00:00,0,#covid_19 #coronavirus #architecture,,0,0,"With #covid_19 homes have multiplied their uses becoming our offices, our nurseries, our schools, our vegetable plots and our conference centres. We are experiencing both fragility of our infrastructure and resilience of our space. How to evolve from #coronavirus? #architecture",,,coronavirus,,covid_19 coronavirus,0.0,0.0,1.0,0.0
SkyNews,1253958143090085888,2020-04-25 08:04:53+00:00,108,#coronavirus #COVID19,,23,11,The #coronavirus lockdown has seen work as a self-employed photographer dry up for Sasha Treanor. So she decided to do something different. Get the latest on #COVID19 here: https://trib.al/Y8YTc9u,,,,,Sasha Treanor,0.0,0.0,1.0,0.0
dezeen,1253957670001926144,2020-04-25 08:03:00+00:00,19,#coronavirus,,7,0,Creative agency &Walsh has designed emojis that detail life during the coronavirus pandemic. https://at.dezeen.com/2KquTeN #coronavirus,,,,,Walsh coronavirus pandemic coronavirus,0.4404,0.0,0.828,0.172
dailystar,1253957489864867840,2020-04-25 08:02:17+00:00,5,#coronavirus #Covid_19,,2,0,Brits urged to stay at home this weekend or 'risk police getting further powers' #coronavirus #Covid_19 https://www.dailystar.co.uk/news/latest-news/brits-urged-stay-home-weekend-21924713,,,,,Covid_19 https://www.dailystar.co.uk weekend-21924713,-0.2732,0.116,0.884,0.0
DFID_UK,1253957061471281153,2020-04-25 08:00:35+00:00,12,#coronavirus,@UKEMT,5,1,"“In the past I’ve deployed as part of UK aid responses overseas, which have helped me get the skills to deal with #coronavirus in the UK.” David is one of the British experts who has helped set up NHS Nightingale North West in Manchester, using experience gained with @UKEMT.",,nhs,,,UK UK David NHS Nightingale North West Manchester @UKEMT,0.3818,0.0,0.949,0.051
Colemans1,1253957052633931776,2020-04-25 08:00:33+00:00,0,#everyone #everywhere #Saturday #Weekend #Coronavirus,,0,0,"Wishing #everyone #everywhere a great #Saturday &amp; #Weekend ahead &amp; stay safe from #Coronavirus , regards Michael ",,,Michael,,Saturday amp Weekend amp # Coronavirus Michael,0.836,0.0,0.611,0.389
wearethentia,1253957026016833537,2020-04-25 08:00:27+00:00,2,#savenightlife #coronavirus #weareallinthistogether,,2,0,Coronavirus: Campari UK launches relief fund for hospitality industry! #savenightlife #coronavirus #weareallinthistogether,,,,,Coronavirus Campari UK,0.5255,0.0,0.764,0.236
_richardblack,1253957022871101441,2020-04-25 08:00:26+00:00,1,#coronavirus,,0,0,"There is some fantastic journalism around on #coronavirus - from scoops to data to long explainers. But boy, there is some thoughtless tosh and parroting as well",,,,,,-0.0129,0.121,0.728,0.15
EIA_News,1253956986049265665,2020-04-25 08:00:17+00:00,7,#deforestation #coronavirus,,11,0,Self-harming – how #deforestation drives emerging diseases and pandemics such as #coronavirus http://ow.ly/AgPw50znPEX,,,,,coronavirus http://ow.ly/AgPw50znPEX,0.0,0.0,1.0,0.0
UK_Music,1253956914007982080,2020-04-25 08:00:00+00:00,4,#coronavirus,@tom_watson,2,1,UK Music Chair @tom_watson calls on Government to help industry plan for the longer-term #coronavirus impact. Read the full piece here: http://bit.ly/2xXiFaF,,government,,,UK Music Chair @tom_watson Government coronavirus http://bit.ly/2xXiFaF,0.4019,0.0,0.8859999999999999,0.114
swany55,1253956618934464512,2020-04-25 07:58:49+00:00,1,#Covid_19 #covidgym #outdoortraining #COVID19 #coronavirus #StaySafe,,0,0,Hubby and daughter training session #Covid_19 #covidgym #outdoortraining #COVID19 #coronavirus #StaySafe,,,,,# COVID19 StaySafe,0.0,0.0,1.0,0.0
BiologyCase,1253956616098988033,2020-04-25 07:58:49+00:00,0,#SARSCoV2 #coronavirus #CoronaVirusUpdates,,0,0,"More Emerging Chinese Research Studies Shows That The #SARSCoV2 #coronavirus Also Attacks The Kidneys, Pancreas and Liver. #CoronaVirusUpdates Read Out https://bit.ly/2yDf95n https://bit.ly/2S5hXz8",,,Read Out,,Emerging Chinese Research Studies Kidneys Pancreas Liver https://bit.ly/2S5hXz8,-0.4404,0.121,0.879,0.0
PSUrol,1253956463434838016,2020-04-25 07:58:12+00:00,7,#urologists #Covid_19 #coronavirus #urology #patients #Monday #mentalhealth #uk,,3,0, that #urologists all over the continue this international initiative on how to combat the impact of #Covid_19 #coronavirus on our #urology #patients - on #Monday we will hear from those on the frontline &amp; those looking after our #mentalhealth Monday 7pm #uk time ,,,uk,,Covid_19 Monday amp Monday uk,-0.34,0.054000000000000006,0.946,0.0
jameswoudhuysen,1253956451724386304,2020-04-25 07:58:10+00:00,1,#science #Covid_19 #coronavirus #coronahysteria,,0,0,"‘No good adviser, especially a scientist on unsettled #science, would tell a PM “do this”.’ Enormously credulous. For years climate scientists have given HMG not just evidence, but prescriptions. That suits HMG; it likes to outsource stuff. #Covid_19 #coronavirus #coronahysteria",,,,,# HMG HMG Covid_19 # coronavirus #,0.6124,0.037000000000000005,0.835,0.128
10DowningStreet,1253956328860667904,2020-04-25 07:57:40+00:00,471,#coronavirus #StayHomeSaveLives,,192,122,Anyone can catch or spread #coronavirus. This is why you must stay at home. #StayHomeSaveLives,,,StayHomeSaveLives,,,0.0,0.0,1.0,0.0
jdaviescoates,1253956216495181825,2020-04-25 07:57:14+00:00,1,#coronavirus #Covid_19,,2,0,This is DEFINITELY the best way to watch Trump's off the scale idiotic speech about injecting disinfectant to treat #coronavirus #Covid_19 it's so tragic and farcical you've got to laugh (and yes he actually said this shit),,,,,Trump coronavirus #,0.6016,0.204,0.506,0.29
XpertHR,1253955924387135489,2020-04-25 07:56:04+00:00,0,#Coronavirus #HR,,0,0,#Coronavirus and #HR: Second XpertHR pulse survey (Benchmarking data) The XpertHR pulse survey on the workplace impact of coronavirus and the actions that HR functions are taking in response. The survey is based on data covering 388 organisations. https://bit.ly/2xbxeXY,,,,,Coronavirus Second coronavirus,0.0,0.0,1.0,0.0
audley_genus,1253955824621432832,2020-04-25 07:55:40+00:00,0,#Donald #coronavirus #Covid_19,@US_FDA,0,0,The source of #Donald Trump #coronavirus treatment ideas. See letter from ⁦@US_FDA⁩ to #Covid_19 bleach cure lobbyist Mark Brenon/Genesis 2 Church who wrote to Trump 2 weeks ago promoting the ‘remedy’,,,,,Donald Trump # ⁦@US_FDA⁩ Covid_19 Mark Brenon Genesis Church Trump,0.3612,0.0,0.923,0.077
markconradhack,1253955432487550977,2020-04-25 07:54:07+00:00,3,#DominicCummings #SAGE #Covid_19 #coronavirus,,1,0,One way to indicate whether #DominicCummings did indeed just “listen in” to #SAGE meetings would be to release the minutes of the meetings to the public. Let us all see whether he was a passive observer. Let’s see the evidence. #Covid_19 #coronavirus,,,,,DominicCummings # SAGE Covid_19,0.2023,0.0,0.958,0.042
sylviatra,1253955418566602757,2020-04-25 07:54:03+00:00,0,#Greece #lockdown #coronavirus #StayHome #StayHome #menoumespiti #hairdressers #quarantinehaircuts,,0,0,"Priorities, people! #Greece #lockdown #coronavirus #StayHome #menoumespiti #hairdressers #quarantinehaircuts ",,,,,Greece StayHome #,0.0,0.0,1.0,0.0
Sainaraha,1253955275436032000,2020-04-25 07:53:29+00:00,4,#Iran #coronavirus,@USAdarFarsi,2,0,"With every passing day, the consequences of #Iran regime’s inhuman policies cause hesitation among its own officials &amp; they ask if these policies are not accelerating the outbreak of uprisings, the very thing the regime was evading? #coronavirus @USAdarFarsi",,,,,# Iran amp # coronavirus @USAdarFarsi,-0.2732,0.052000000000000005,0.948,0.0
jasonjamesstone,1253955129138651138,2020-04-25 07:52:54+00:00,0,#coronavirus #Brexit #Covid19UK #brexitreality,@chrisgreybrexit,0,2,"""...the deepest connection between the #coronavirus and #Brexit is the way that the former has comprehensively discredited some of the central myths and lies of the latter."" A fascinating read - thanks @chrisgreybrexit. #Covid19UK #brexitreality https://chrisgreybrexitblog.blogspot.com/2020/04/coronavirus-and-brexit.html?m=1",,,,,# Brexit Covid19UK,0.1779,0.129,0.726,0.145
vetrissimo,1253954620591923200,2020-04-25 07:50:53+00:00,1,#Coronavirus #Covid_19,,0,1,"It's difficult because heart attack, stroke and pneumonia are all valid causes of death in themselves and in normal times would be sufficient. #Coronavirus can cause any of these but because #Covid_19 is a new disease, the gov't need to know how many die from it or with it.",,,Coronavirus,,Coronavirus gov't,-0.8909999999999999,0.205,0.795,0.0
Sainaraha,1253954546453405697,2020-04-25 07:50:35+00:00,4,#MEK #coronavirus #Iran,,1,0,The Iranian Resistance and #MEK revealed the regime’s criminal &amp;inhuman strategy of sending millions of ppl back to work while the spread of #coronavirus has not been contained &amp;upset the balance of regime both in relation to the Iranian people &amp; even within itself. #Iran,,,,,Resistance # MEK ’s criminal amp;inhuman ppl coronavirus amp;upset amp Iran,-0.5267,0.07200000000000001,0.928,0.0
aawsat_eng,1253954396737675264,2020-04-25 07:50:00+00:00,1,#Coronavirus #Libya,,0,0,New #Coronavirus Death in #Libya,,,Libya,,Coronavirus Death # Libya,-0.5994,0.494,0.506,0.0
1stSimona,1253954346674532355,2020-04-25 07:49:48+00:00,0,#coronavirus #bible #stayhome #stayhome #staysafe #quarantine #lockdown,,0,0,Following the instructions of #coronavirus #bible #stayhome #staysafe #quarantine #lockdown,,,,,# coronavirus # bible #,0.0,0.0,1.0,0.0
NorthLDNSport,1253954140570517504,2020-04-25 07:48:59+00:00,0,#PL #Covid_19 #coronavirus,,1,0,Coronavirus: Premier League discuss behind-closed-doors TV coverage #PL #Covid_19 #coronavirus Read more ,,,,,Coronavirus Premier League PL #,0.0,0.0,1.0,0.0
SimonNader,1253953874043510789,2020-04-25 07:47:55+00:00,5,#coronavirus #lockdown,,0,0,Wow. I spent all day yesterday believing it was Thursday. It’s only now my iPad tells me it’s Saturday that I realise. That. Is. Mental. #coronavirus #lockdown,,,,,Thursday iPad Saturday #,0.5859,0.0,0.872,0.128
EastLDNSport,1253953706531459072,2020-04-25 07:47:15+00:00,0,#PL #Covid_19 #coronavirus,,0,0,Coronavirus: Premier League discuss behind-closed-doors TV coverage #PL #Covid_19 #coronavirus Read more https://www.newhamrecorder.co.uk/sport/football/premier-league-discuss-behind-closed-doors-tv-coverage-1-6623851,,,,https://www.newhamrecorder.co.uk,Coronavirus Premier League PL # https://www.newhamrecorder.co.uk,0.0,0.0,1.0,0.0
suemitton1,1253953191072403456,2020-04-25 07:45:12+00:00,0,#BrexitShambles #Covid_19 #coronavirus #Covid19UK #HoldThemToAccount,,0,0,Do you remember reading a few months back that the government were 'stockpiling' freezer's & body bags? #BrexitShambles #Covid_19 #coronavirus #Covid19UK #HoldThemToAccount,,government,,,freezer # BrexitShambles # # Covid19UK,0.0,0.0,1.0,0.0
ACFER2,1253953156880519170,2020-04-25 07:45:04+00:00,1,#WHO #ACFview #coronavirus #economy #Trump #WHO #global #China #investment,,0,0,"Donald Trump has been condemned by world leaders for cutting off funding to the #WHO, but is he right this time? Read our #ACFview: http://ow.ly/QD9A50zofiN #coronavirus #economy #Trump #WHO #global #China #investment",,,,,Donald Trump China,-0.29600000000000004,0.096,0.904,0.0
sdp,1253953113997946880,2020-04-25 07:44:54+00:00,0,#coronavirus #journalism #research,,0,0,Call for papers - Covering #coronavirus #journalism #research,,,,,,0.0,0.0,1.0,0.0
SkyNews,1253952821285838849,2020-04-25 07:43:44+00:00,103,#coronavirus,,45,152,Downing Street has denied claims the prime minister's chief adviser Dominic Cummings sits on the sub-committee advising the government on #coronavirus ,,government,Dominic Cummings,,Downing Street prime minister Dominic Cummings # coronavirus,-0.4404,0.127,0.873,0.0
Sainaraha,1253951833623744513,2020-04-25 07:39:49+00:00,1,#coronavirus #Iran,,1,0,The regime’s all-encompassing role in the deadly #coronavirus crisis-the Iranian Resistance has published undeniable documents from inside the regime that showed how the regime was aware since December about the virus outbreak in #Iran,,,,,coronavirus Iranian Resistance December Iran,0.0,0.0,1.0,0.0
JosephineCumbo,1253951780804837377,2020-04-25 07:39:36+00:00,8,#Coronavirus,,5,0,Excellent long read on the #Coronavirus scandal inside UK care homes. ,,,,,Coronavirus UK,0.6124,0.163,0.449,0.388
AndyBanksideSE1,1253951680653201410,2020-04-25 07:39:12+00:00,0,#coronavirus #brexitreality,@BorisJohnson @10DowningStreet @Keir_Starmer @MattHancock @campbellclaret @afneil @Peston @bbclaurak @piersmorgan,0,1,@BorisJohnson @10DowningStreet @Keir_Starmer @MattHancock @campbellclaret @afneil @Peston @bbclaurak @piersmorgan Were Boris &amp; Co so obsessed by Brexit that they missed the elephant in the room despite warnings from experts? #coronavirus #brexitreality,johnson,,,,@BorisJohnson @10DowningStreet @Keir_Starmer Boris Brexit coronavirus #,-0.3722,0.129,0.816,0.055
FunnyBrent,1253951495013269510,2020-04-25 07:38:28+00:00,1,#disinfectant #coronavirus #humour,,0,0,It’s better with ice! #disinfectant #coronavirus #humour,,,,,,0.7424,0.0,0.443,0.557
BlessingCTaylor,1253950979529113600,2020-04-25 07:36:25+00:00,0,#death #disease #coronavirus #condition #questions,,0,0,Sad to hear. Was his #death caused by the #disease of #coronavirus or was his death caused by underlying #condition. We need to ask these #questions.,,,,,,-0.8979,0.322,0.6779999999999999,0.0
fundingtrack,1253950882980470785,2020-04-25 07:36:02+00:00,0,#businessadvice #coronavirus #openaccess,,0,0,When it comes to business an inability to act decisively coupled with complacency may spell disaster. https://buff.ly/2yDeP6O #businessadvice #coronavirus #openaccess,,,,,https://buff.ly/2yDeP6O # #,-0.7783,0.274,0.726,0.0
CoronaDoubter,1253950849933590529,2020-04-25 07:35:54+00:00,60,#stopthelockdown #coronavirus,,20,3,"Come on Boris hurry up and announce some easing of lockdown ,make it look as if it was your decision and not the peoples ,from what I am seeing out there might be too late #stopthelockdown #coronavirus",johnson,,Boris,,Boris coronavirus,0.25,0.0,0.947,0.053
theJeremyVine,1253950841423306753,2020-04-25 07:35:52+00:00,5,#coronavirus,,1,4,"The issue here is infection. Those twenty staff are all gateways for #coronavirus, which she must not get.",,,,,# coronavirus,0.0,0.0,1.0,0.0
sagami_uk,1253950489202434050,2020-04-25 07:34:28+00:00,0,#lockdown #onceadayworkout #coronavirus #Covid_19 #ExerciseAtHome,,0,0,Good Idea? #lockdown #onceadayworkout #coronavirus #Covid_19 #ExerciseAtHome,,,,,Idea,0.4404,0.0,0.674,0.326
MigrantConnect,1253950370562232320,2020-04-25 07:34:00+00:00,0,#coronavirusuk #coronavirus #CoronaLockdown,@DOTW_UK,0,0,@DOTW_UK have shared Coronavirus (COVID-19) advice in 48 languages! Very useful for everyone https://bit.ly/3eWF5d0 #coronavirusuk #coronavirus #CoronaLockdown,,,,,Coronavirus # coronavirus # CoronaLockdown,0.7082,0.0,0.718,0.282
suemitton1,1253950035538120706,2020-04-25 07:32:40+00:00,1,#NegligentHomicide #COVIDIOTS #COVID19 #coronavirus #LiesLiesLies #HoldThemToAccount #COVID,@BorisJohnson @Keir_Starmer,0,1,#NegligentHomicide @BorisJohnson #COVIDIOTS #COVID19 #coronavirus #LiesLiesLies #HoldThemToAccount Are we the only country not screening passengers #COVIDー19 at airports ? @Keir_Starmer,,,,,NegligentHomicide @BorisJohnson COVIDIOTS LiesLiesLies COVIDー19,0.0,0.0,1.0,0.0
