username,tweet_id,date,favorites,hashtags,mentions,retweets,replies,text,topical_persons,topical_orgs,persons,orgs,propn,compound,neg,neu,pos
halfeatenmind,1253964255486971905,2020-04-25 08:29:10+00:00,0,,,1,0,"NEWS DIGEST 25.04.2020: Mourning, questioning, and celebrating in the COVID-19 Lockdown https://halfeatenmind.wordpress.com/2020/04/25/news-digest-25-04-2020-mourning-questioning-and-celebrating-in-the-covid-19-lockdown/",,,Lockdown https://halfeatenmind.wordpress.com/2020/04/25/news-digest-25-04-2020-mourning-questioning-and-celebrating-in-the-covid-19-lockdown/,,DIGEST 25.04.2020 Lockdown https://halfeatenmind.wordpress.com/2020/04/25/news-digest-25-04-2020-mourning-questioning-and-celebrating-in-the-covid-19-lockdown/,0.1027,0.253,0.529,0.218
garypv7,1253963866213699584,2020-04-25 08:27:37+00:00,3,,,0,2,Well when someone you know or care for dies from Covid19 you may reevaluate your thinking.If the World can still spend trillions of dollars on nuclear weapons they can reprioritise that money for the wider economy. We have companies making Ventilators who were making engines now.,,,,Ventilators,Covid19 World,0.34,0.057,0.84,0.10400000000000001
dudleyandcoltd,1253963580782907394,2020-04-25 08:26:29+00:00,0,#LameStreamMedia,,0,0,"Im Surprised no one is Blaming Brexit for the Covid-19, Outbreak #LameStreamMedia",,,,Blaming Brexit,Blaming Brexit Covid-19 Outbreak,-0.5423,0.331,0.552,0.11699999999999999
Putneyman,1253963492656283649,2020-04-25 08:26:08+00:00,0,,,0,1,"Good morning Elizabeth I just use the BBC News app on my phone but it's just all COVID-19 now, which is understandable under the circumstances.",,,,BBC News,Elizabeth BBC News,0.2382,0.0,0.925,0.075
SteveBakerHW,1253962739501981696,2020-04-25 08:23:09+00:00,132,,,51,22,‘A Treasury proposal to “get Britain back to work” includes plans to ensure that offices and workplaces are free from coronavirus. [The Chancellor] is drawing up measures to allow non-essential businesses to reopen in a “safe and practical way”.’ ,,,,,Treasury Britain coronavirus Chancellor,0.8225,0.0,0.785,0.215
iamdavecook,1253961333453852673,2020-04-25 08:17:34+00:00,1,,,1,0,Covid-19: How to foster healthy home working | UCL News - UCL – University College London ,,,,University College London,| UCL News UCL University College London,0.4019,0.0,0.847,0.153
robinnarayan,1253961053320482818,2020-04-25 08:16:27+00:00,0,,,0,1,The hunt for a coronavirus vaccine – a perilous and uncertain path ,,,,,coronavirus,-0.29600000000000004,0.16699999999999998,0.833,0.0
ORIGINALMEMZEE,1253960931085860865,2020-04-25 08:15:58+00:00,0,,,0,0,Coronavirus. Still have symptoms after 7 days? Don’t leave home until they go. Your household should self-isolate for 14 days,,,,,Coronavirus,-0.0516,0.059000000000000004,0.941,0.0
KevNorth3,1253960558031908864,2020-04-25 08:14:29+00:00,0,,,0,0,"Can anyone tell me, are the migrants still being assisted by the Turkish to breach the Greek border? There has been nothing in the MSM except Covid?",,,,Covid,Turkish MSM Covid,0.0,0.0,1.0,0.0
FunPalaces,1253960057181605890,2020-04-25 08:12:29+00:00,10,,,7,0,"What can coronavirus teach us about hope? ""When this storm clears.. we may feel free to pursue change in ways that seemed impossible. We may have a profoundly different sense of ourselves, our communities, our systems of production and our future."" ",,,,,coronavirus,0.7579,0.0,0.835,0.165
smithbarryc,1253959506649899008,2020-04-25 08:10:18+00:00,1,,,0,0,"That said, Gov CMOs are being dangerously sceptical. Evidence of effectiveness of public wearing masks hasn’t been conclusively established - tho excepted by scientists in other countries. Same true for including loss of smell as a symptom of Coronavirus. Erring on the wrong side",,,,Coronavirus,Gov Coronavirus,-0.7783,0.20199999999999999,0.7440000000000001,0.053
LisaNainggolan1,1253959370783756288,2020-04-25 08:09:46+00:00,1,#AKI #RRT #COVID,@Medscape @_triciaward,0,0,Great piece on @Medscape on how to tackle #AKI and #RRT in #COVID-19 by @_triciaward,,,,,@Medscape # AKI,0.6249,0.0,0.773,0.22699999999999998
corazon_verde7,1253959053916737539,2020-04-25 08:08:30+00:00,0,#pandemic #PPE,@VICE,1,0,Essential farmworkers in the USA are highly vulnerable during the #pandemic due to lack of proper #PPE and layoffs. @VICE 'We’re Scared': These 'Essential' Farmworkers Have Little Protection from Coronavirus: ,,,,Coronavirus,USA Little Protection Coronavirus,-0.7501,0.215,0.785,0.0
RogerHighfield,1253958373017608192,2020-04-25 08:05:48+00:00,5,,@JeremyFarrar,2,0,"UK ministers were warned last year of risks of coronavirus pandemic https://www.theguardian.com/world/2020/apr/24/revealed-uk-ministers-were-warned-last-year-of-risks-of-coronavirus-pandemic?CMP=share_btn_tw Everyone was warned, says @JeremyFarrar https://www.google.com/amp/s/www.newsweek.com/coronavirus-predicted-report-pandemic-1494004%3famp=1",,,,,UK coronavirus pandemic https://www.theguardian.com/world/2020/apr/24/revealed-uk-ministers-were-warned-last-year-of-risks-of-coronavirus-pandemic?CMP=share_btn_tw Everyone,-0.6486,0.29600000000000004,0.7040000000000001,0.0
juliangbell,1253958326787936257,2020-04-25 08:05:37+00:00,1,#Covid_19,,0,0,Creating more space for safe walking and cycling - TRO process simplified during #Covid_19 pandemic ,,,,,Covid_19,0.6557,0.0,0.708,0.292
MusicNewsWeb,1253957693422702593,2020-04-25 08:03:06+00:00,5,#Goldfrapp,@goldfrapp,3,0,http://Music-News.com Alison Goldfrapp launches 'It’s A Strange Day' campaign to raise money for Covid-19 relief - #Goldfrapp @goldfrapp http://dlvr.it/RVQlJZ,,,Goldfrapp,,http://Music News.com Alison Goldfrapp Strange Day Goldfrapp http://dlvr.it/RVQlJZ,0.3182,0.08199999999999999,0.7759999999999999,0.142
Newsminster,1253957689652072448,2020-04-25 08:03:05+00:00,1,,,1,0,Martin Rowson on Donald Trump's coronavirus cures – cartoon https://bit.ly/2xazoXO,,,Donald Trump's,,Martin Rowson Donald Trump,0.0,0.0,1.0,0.0
drscottym,1253955946436534274,2020-04-25 07:56:09+00:00,104,#WorldVeterinaryDay #ThankYouVets #vets #vetnurses #AnimalWelfare #Covid_19,,28,11,It’s #WorldVeterinaryDay so please support the #ThankYouVets campaign and send love to the #vets #vetnurses and #AnimalWelfare workers near you who are still putting animals first despite the #Covid_19 pandemic ,,,,,AnimalWelfare Covid_19,0.8798,0.0,0.726,0.27399999999999997
Cristin04073262,1253955538012045313,2020-04-25 07:54:32+00:00,0,,@MailOnline,0,0,Trump walks out of coronavirus briefing after 22-minutes https://mol.im/a/8255403#v-1749282867299895691 via @MailOnline he is going back to the naughty step again. He is no listening .,,,,,Trump coronavirus,-0.29600000000000004,0.084,0.9159999999999999,0.0
TomTheProducer1,1253955084591005696,2020-04-25 07:52:44+00:00,0,,,0,0,"Lysol PR guy easing into Friday. Maybe clock off early, see what’s good on Netflix. Checks Trump’s daily coronavirus briefing: ",,,,,Lysol PR Friday Netflix Checks Trump coronavirus briefing,0.5994,0.0,0.7859999999999999,0.214
NorthLondonHour,1253953701590585349,2020-04-25 07:47:14+00:00,2,#Superhero,@iamsegunakande,3,0,Third lockdown Creative Writing Competition. Which #Superhero will save the world from Covid 19? Watch this video https://www.facebook.com/110593093924976/posts/127214835596135/?vh=e&amp;d=n @iamsegunakande,,,,,Creative Writing Competition Superhero Covid,0.755,0.0,0.725,0.275
liz_graham1966,1253953478432567296,2020-04-25 07:46:21+00:00,2,#nopee,,1,4,"Nurse daughter doing extra shifts over w/e told there was 1 covid patient, turns up this morning and there’s 14 and no masks. Response from matron is what do u want me to do about it? Get infected and carry on spreading it around the hospital? #nopee",,,,,Nurse w e matron,-0.6662,0.113,0.862,0.025
OlexKP,1253952996263804931,2020-04-25 07:44:26+00:00,8,#COVID19 #selfisolation #braincancer,,0,3,Just submitted my application to be tested for #COVID19 Have to wait for text in order to book appt. At least if I know I don’t have this virus I can stop #selfisolation and help out my elderly mum (90 in June) &amp; brother who has #braincancer ,,,,,June amp,0.128,0.044000000000000004,0.902,0.054000000000000006
reijas1,1253952875597828096,2020-04-25 07:43:57+00:00,1,#social #COVIDIOTS #Covid_19 #Covid19UK #SocialDistancing #Social_Distancing #StayHome #StayHome #StayAtHome #StayAtHome #StayHomeSaveLives #ProtectTheNHS,,0,0,The police had to break up a #social gathering yesterday. The people involved were old enough to know better. #COVIDIOTS #Covid_19 #Covid19UK #SocialDistancing #Social_Distancing #StayHome #StayAtHome #StayHomeSaveLives #ProtectTheNHS,,,,,# COVIDIOTS Covid19UK # SocialDistancing StayHome StayAtHome # StayHomeSaveLives ProtectTheNHS,0.4404,0.0,0.903,0.09699999999999999
seetasee,1253952685201592320,2020-04-25 07:43:12+00:00,3,,,0,0,Why do female leaders seem to be more successful at managing the coronavirus crisis? | World news | The Guardian ,,,,,coronavirus | World | Guardian,-0.0018,0.157,0.687,0.156
MattWrack,1253950551940874240,2020-04-25 07:34:43+00:00,11,,,7,2,Firefighters take on 'sweeping new areas' of work to help tackle the coronavirus crisis ,,,,,coronavirus,-0.34,0.218,0.638,0.14400000000000002
MattWrack,1253950430360621056,2020-04-25 07:34:14+00:00,6,,,5,1,COVID-19 and the Grenfell Tower Inquiry: an update on the FBU’s work ,,,,FBU,Grenfell Tower Inquiry FBU,0.0,0.0,1.0,0.0
SimonMDLord,1253950335628042241,2020-04-25 07:33:51+00:00,3,,,2,0,"sorted her medication so completely that her life has become so much easier. We'd walked past his office many times, but had no idea he had the knowledge she needed. NHS is very good at silos. Patients w LTCs can't always advocate for themselves without a map.",,nhs,,,NHS silos w LTCs,0.5467,0.053,0.828,0.11900000000000001
montymythen,1253949884580990977,2020-04-25 07:32:04+00:00,8,,,2,0,"How did Australia and New Zealand almost completely duck the COVID19 bullet? On ANZCA day. Time to reflect, lest we forget. ",,,,,Australia New Zealand ANZCA,-0.2263,0.087,0.9129999999999999,0.0
MattWrack,1253949823071420418,2020-04-25 07:31:49+00:00,148,#COVID19,,80,5,RT While we tackle #COVID19 other battles continue. I’m proud that we are continuing our fight for pension justice for public sector workers. Thanks to the 3 unions in that fight with us. Firefighters to take government to court over pension ‘robbery’ ,,government,,,RT,0.3818,0.147,0.677,0.177
flockcover,1253949701554163712,2020-04-25 07:31:20+00:00,8,,,0,1,Gareth - we’ve pledged £10k of free insurance to organisations using drones tackle COVID-19. We would love to support this project https://flockcover.com/covid-19 what’s the best way to reach you?,,,,,Gareth drones,0.9382,0.0,0.608,0.392
SimonMDLord,1253949564748472321,2020-04-25 07:30:48+00:00,2,,,2,1,I didn't say we should all know everything ;) However having been through it it's hard to get access to some services if you don't know they exist. After many years struggling w the impact of MS & pushing her GP she was eventually referred to someone who in one consultation /,,,,,;) w MS GP,-0.3182,0.076,0.889,0.034
TomTheProducer1,1253949265229086720,2020-04-25 07:29:36+00:00,2,#COVID19 #NHSheroes,@dewsburymoorARL @BrendanSherid16,0,0,"Fantastic news that our old @dewsburymoorARL teammate @BrendanSherid16 is out of ICU after being treated for #COVID19. In a coma for 2 weeks but fought back, welcome home Shez Amazing work being done by our #NHSheroes every day ",,,,,@dewsburymoorARL @BrendanSherid16 ICU Shez,0.8608,0.061,0.7020000000000001,0.237
MattWrack,1253949061432033280,2020-04-25 07:28:48+00:00,22,#Covid_19 #RememberTheDeadFightForTheLiving #IWMD20,,18,0,RT RT It’s International Workers Memorial Day on Tuesday. This year it’s especially important. Key workers across the world have died from #Covid_19 as a direct result of their work. Let’s honour them. 1 minute silence #RememberTheDeadFightForTheLiving #IWMD20,,,,,RT RT International Workers Memorial Day Tuesday,0.2944,0.081,0.7879999999999999,0.13
robinnarayan,1253948669440798720,2020-04-25 07:27:14+00:00,0,#BLEACH #sarcasm #COVID19,@US_FDA,0,0,Revealed: leader of group peddling bleach as coronavirus 'cure' wrote to Trump this week This ignoramus continues capture the hearts and minds of a large number of the US electorate. Is there a step too far? #BLEACH @US_FDA #sarcasm #COVID19 ,,,,,coronavirus Trump US BLEACH @US_FDA,-0.6092,0.121,0.8490000000000001,0.03
Margin4Error,1253948593611968512,2020-04-25 07:26:56+00:00,4,,,2,0,It's like a bunch of strikers trying to shore up defence. We have experts on international affairs - they're called diplomats and spies. So what are these politicians really up to? BBC News - Coronavirus: Tory MPs to examine 'rise of China' ,,,,,BBC News Coronavirus China,0.3182,0.036000000000000004,0.8759999999999999,0.08800000000000001
DayoAKK,1253948539698327553,2020-04-25 07:26:43+00:00,2,#COVID19,,0,1,Nigerian Doctor WhatsApp group identifies why black medics are dying more from #COVID19. Yet when they make the CORONA OUTBREAK Movie in 10 yrs they'll only feature white heroes – at Primrose Hill,,,,,Nigerian Doctor WhatsApp Movie Primrose Hill,0.5106,0.0,0.907,0.09300000000000001
MattWrack,1253947998586929157,2020-04-25 07:24:34+00:00,9,#TestTestTest,@YouTube,5,0,RT Video update. More to follow. Please share #TestTestTest COVID19 - FBU lobbying achieves testing for Fire Rescue https://youtu.be/cTSZjfEyNvU via @YouTube,,,,,RT Video TestTestTest COVID19 Fire Rescue https://youtu.be/cTSZjfEyNvU @YouTube,0.6557,0.133,0.5760000000000001,0.29
MattWrack,1253947767661244416,2020-04-25 07:23:39+00:00,1,,@YouTube,3,0,RT FBU video update New one soon. Please share. FBU general secretary answers members' COVID-19 questions https://youtu.be/6mQ4dg9m0Tg via @YouTube,,,,,RT FBU New FBU @YouTube,0.5423,0.0,0.7909999999999999,0.209
SimonMDLord,1253947602086891520,2020-04-25 07:23:00+00:00,5,,,1,1,There's huge public ignorance about many aspects of health services. It's only when you/yours experience an issue that you learn abt who can help. My daughter is a paediatric MH OT - how many think that OTs only work in geriatrics?,,,,,abt MH OT,0.3612,0.055,0.835,0.11
bahare_kh,1253946412825489409,2020-04-25 07:18:16+00:00,0,#COVID19,@ABC,0,0,Of course they did!! #COVID19 Coronavirus live updates: Maryland agency receives more than 100 disinfectant use calls - ABC News - https://abcn.ws/2Y8mEf8 via @ABC,,,,ABC News,COVID19 Coronavirus Maryland ABC News https://abcn.ws/2Y8mEf8,0.0,0.0,1.0,0.0
Epsom_Chinn,1253946086701576193,2020-04-25 07:16:58+00:00,3,,,1,1,Why do female leaders seem to be more successful at managing the coronavirus crisis? https://www.theguardian.com/world/2020/apr/25/why-do-female-leaders-seem-to-be-more-successful-at-managing-the-coronavirus-crisis?CMP=share_btn_tw@,,,,,https://www.theguardian.com/world/2020/apr/25/why-do-female-leaders-seem-to-be-more-successful-at-managing-the-coronavirus-crisis?CMP=share_btn_tw@,-0.0943,0.207,0.603,0.19
jADExXx888,1253943756656652292,2020-04-25 07:07:43+00:00,0,#blackworkersmatter,,0,0,#blackworkersmatter WTF are we going to do about this?! Does anyone even care? This chart reveals black Caribbean communities have suffered a disproportionate number of deaths from Covid-19 BLACK Brits… https://www.instagram.com/p/B_ZRdgfA2Fj/?igshid=s88fgtjfokv9,,,,,WTF Covid-19 BLACK Brits https://www.instagram.com/p/B_ZRdgfA2Fj/?igshid=s88fgtjfokv9,-0.7240000000000001,0.214,0.674,0.11199999999999999
TheWolfhounds,1253943333531136001,2020-04-25 07:06:02+00:00,3,,,0,0,Times: does it feel pretty good to be right all the time? Sun: was Corbyn part of the plot to keep this information from the public? Daily Mail: does the coronavirus vaccine cause autism? ,,,Sun,,Sun Corbyn Daily Mail coronavirus,0.7677,0.0,0.828,0.172
TheWolfhounds,1253943242284032001,2020-04-25 07:05:40+00:00,4,,,1,0,Times: does it feel pretty good to be right all the time? Sun: was Corbyn part of the plot to keep this information from the public? Daily Mail: does the coronavirus vaccine cause autism?,,,Sun,,Sun Corbyn Daily Mail coronavirus,0.7677,0.0,0.828,0.172
lkadinopoulos,1253942655039549440,2020-04-25 07:03:20+00:00,0,,,0,0,BBC News - Coronavirus: Tory MPs to examine 'rise of China' https://www.bbc.co.uk/news/uk-politics-52414635 interesting that this should come out on the same day the Washington Post publishes an article about increased Chinese political interference in HK ,,,,,BBC News Coronavirus China https://www.bbc.co.uk news uk politics-52414635 Washington Post HK,0.5859,0.0,0.873,0.127
RichardWrites2,1253942066796781568,2020-04-25 07:01:00+00:00,0,#SocialDistancing #lockdownuk #coronavirusuk #infection #Covid19UK #StayHomeSaveLives #StaySafe,,0,1,Another 6000+ reported Covid19 cases yesterday - and much the same all week. We’ve been social distancing and locked down for 5 weeks so how are all these people still contracting it? #SocialDistancing #lockdownuk #coronavirusuk #infection #Covid19UK #StayHomeSaveLives #StaySafe,,,,,Covid19 # SocialDistancing # lockdownuk # Covid19UK,0.0,0.0,1.0,0.0
robertjoseph,1253941176736133121,2020-04-25 06:57:28+00:00,0,,@Telegraph,0,0,@Telegraph quite reasonably worrying about the likely loss to its readership of the govt relaxed attitude to COVID-19 impact on the elderly ,,,,govt,govt,-0.19699999999999998,0.183,0.6990000000000001,0.11800000000000001
GravityMath,1253940850108895232,2020-04-25 06:56:10+00:00,0,,,0,0,Clapping is for seals and children. The value you placed on key workers never existed but now it does. Clap to show the deferred shame you now have. Okay. BBC News - Coronavirus: Applause for key workers 'is not enough' ,,,,BBC News - Coronavirus,BBC News Coronavirus,0.3818,0.087,0.752,0.162
DaiIyLONDON,1253939303027113984,2020-04-25 06:50:01+00:00,0,,,0,0,Coronavirus: Met Police making 100 domestic violence arrests a day https://j.mp/2zoNm96,,,,,Coronavirus Met,-0.7906,0.43799999999999994,0.562,0.0
tiggsie,1253939248182562816,2020-04-25 06:49:48+00:00,0,#designyoursuperbear,@jlandpartners,0,0,"@jlandpartners good morning I’m sarah and I’m a nurse who’s been working with covid-19 and my friends lovely daughter sent me this lovely card and thought it would be a great idea for the bear competition, she called Willow and she’s 8 #designyoursuperbear",,,,,sarah covid-19 Willow,0.9607,0.0,0.674,0.326
PeterLachman,1253936621470339072,2020-04-25 06:39:22+00:00,0,,@Banjomax,1,0,Live Webinar: Parenting and COVID-19 Global Resources with Dr Jamie Lachman @Banjomax,,,Jamie Lachman,,Resources Dr Jamie Lachman @Banjomax,0.0,0.0,1.0,0.0
1975jpm,1253932280852156416,2020-04-25 06:22:07+00:00,2,#COVID19,,0,1,"As much as I love sport and can't wait to have live sport back, can we please ensure all key and essential workers are tested for #COVID19 first before testing sports stars and resuming live sport (even in closed stadia)",,,,,,0.8442,0.0,0.8029999999999999,0.19699999999999998
TessaStef,1253931363901804544,2020-04-25 06:18:28+00:00,0,,,0,0,Can nurseries remain sustainable now and beyond COVID-19? ,,,,,,0.0,0.0,1.0,0.0
robertjoseph,1253929980188385282,2020-04-25 06:12:58+00:00,0,,,1,0,"A long, damning analysis of the UK approach to covid-19 ",,,,,UK covid-19,-0.34,0.21100000000000002,0.789,0.0
DickonFarmar,1253929798851756032,2020-04-25 06:12:15+00:00,1,,,0,1,Come on now. He ran away from any questioning about his lethal suggestion that injecting disinfectant might be a cure for covid-19...you can’t spin that any other way...!,,,,,,-0.1759,0.059000000000000004,0.941,0.0
OmarMansoor,1253929174168997890,2020-04-25 06:09:46+00:00,0,,@Yale,0,0,Should Low-Income Countries Impose the Same Social Distancing Guidelines as Europe and North America to Halt the Spread of COVID-19? https://som.yale.edu/should-low-income-countries-impose-the-same-social-distancing-guidelines-as-europe-and-north-america-to-halt-the-spread-of-covid-19#.XqPUGU0CyRE.twitter @Yale,,,,,Low Income Countries Social Distancing Guidelines Europe North America https://som.yale.edu/should-low-income-countries-impose-the-same-social-distancing-guidelines-as-europe-and-north-america-to-halt-the-spread-of-covid-19#.XqPUGU0CyRE.twitter @Yale,-0.29600000000000004,0.095,0.905,0.0
ceciliaissmart,1253928245537505281,2020-04-25 06:06:05+00:00,0,,,0,0,The COVID-19 Pandemic is already accelerating economic and societal change at an unimaginable velocity,,,,,Pandemic,0.0,0.0,1.0,0.0
MarcusHowarth,1253923042406907904,2020-04-25 05:45:24+00:00,0,,,0,0,BBC News - Coronavirus: Transport usage will change after lockdown ,,,,BBC News - Coronavirus,BBC News Coronavirus,0.0,0.0,1.0,0.0
MarcusHowarth,1253922935913558016,2020-04-25 05:44:59+00:00,0,,,0,0,BBC News - Coronavirus: Banning cars made easier to aid social distancing ,,,,BBC News - Coronavirus,BBC News Coronavirus,0.4215,0.0,0.797,0.203
CJHnow,1253918671954751489,2020-04-25 05:28:02+00:00,0,,,0,0,"Prince gently shook my shoulder and I awoke; Brexit, Trump and Coronavirus had been a bad dream.",,,,Coronavirus,Prince Brexit Trump Coronavirus,0.0258,0.214,0.568,0.218
filarge89,1253917384567590912,2020-04-25 05:22:55+00:00,0,#StayHome #StayHome #StayHomeSaveLives #Covid_19,,0,0,Stop sharing some useless videos people have mental health issues help them too.. #StayHome #StayHomeSaveLives #Covid_19,,,StayHome,,StayHome # StayHomeSaveLives,0.128,0.222,0.5329999999999999,0.244
RMJewell,1253906680594739202,2020-04-25 04:40:23+00:00,0,,,0,0,If they did they wouldn’t die of Covid-19. I bet they wish they had.,,,,,,-0.29600000000000004,0.21,0.645,0.145
paulinust,1253899631894937600,2020-04-25 04:12:23+00:00,0,#PleaseDon #InjectBleach,,0,0,‘#PleaseDon’t #InjectBleach’: Trump’s wild coronavirus claims prompt disbelief ,,,,,# InjectBleach Trump,0.0,0.0,1.0,0.0
PJejeman,1253898412753330177,2020-04-25 04:07:32+00:00,1,#Health #treatment #Corrupt #Shame #Shame,,0,0,"It’s a shame to all leaders of ECOWAS to nominate Nigeria to lead them in the fight against COVID-19, it is obvious that Nigeria government have bribed them to get the position, All Nigeria leaders #Health #treatment abroad #Corrupt #Shame to ECOWAS #Shame to ECOWAS leaders.",,government,,ECOWAS,ECOWAS Nigeria Nigeria Nigeria Health ECOWAS,-0.8979,0.221,0.779,0.0
Pairsonnalites,1253897035733798918,2020-04-25 04:02:04+00:00,0,,,1,0,Homophobic governor spends coronavirus lockdown celebrating a ban on abortions with an anti ...: Homophobic Texas state representative Jeff Leach celebrated the state's abortion ban during the coronavirus pandemic with an anti-LGBT+ group. http://dlvr.it/RVQMtm,,,Jeff Leach,,coronavirus lockdown Homophobic Texas Jeff Leach coronavirus http://dlvr.it/RVQMtm,-0.2732,0.207,0.632,0.161
hollers63,1253896383146479616,2020-04-25 03:59:28+00:00,0,,,0,0,"""We've just had a presentation from one of data scientists regarding coronavirus spread and, given…"" — James C ",,,James C,,coronavirus James C,0.0,0.0,1.0,0.0
oilyoils,1253891222927806467,2020-04-25 03:38:58+00:00,4,,,0,0,"i have decided (for menthol health reasons) to only care about one thing at once henceforth,, help me choose between covid19 and my crippling epilepsy",,,,,menthol health,0.7096,0.0,0.7959999999999999,0.204
FifiC7,1253890317755068418,2020-04-25 03:35:22+00:00,0,,@BarackObama,0,1,"I’m thinking that we have slipped into a parallel universe, and if we could only go back, there would be no coronavirus &amp; @BarackObama in the White House. *Sighs* ",,,,,coronavirus amp White House Sighs,-0.29600000000000004,0.073,0.927,0.0
IlyehNahdiSLT,1253874801720135683,2020-04-25 02:33:43+00:00,16,#ramadankareem #ramadankareem #COVID19 #StayHome #StayHome,,1,1,Ramadan Mubarak to all It will be an especially difficult month for our communities but I hope what we are lacking physically we can find through personal reflection and spiritual exploration at home #ramadankareem #COVID19 #StayHome,,,StayHome,,Ramadan Mubarak,0.649,0.046,0.8029999999999999,0.151
OscarKlass2,1253865953466728448,2020-04-25 01:58:33+00:00,0,,@WashTimes,0,0,@WashTimes I use disinfectant covered cloth ( UK Dettol) this is inhaled of course and must have some plausible effect on COVID 19. Surely Pres. Trump might just be onto something. Necessity after all is the mother of invention...,,,Trump,,UK Dettol COVID Pres Trump,0.4404,0.0,0.929,0.071
naaykeji,1253860180531523584,2020-04-25 01:35:37+00:00,1,#stayhome #stayhome,,0,0,"anyways #stayhome guys, small small covid cases are reducing in london ",,,,,london,0.0,0.0,1.0,0.0
islingtonsport1,1253860098469965824,2020-04-25 01:35:17+00:00,8,,,5,0,In order for Islington Boxing Club to exist after The COVID 19 Crisis Please donate what you can to the Just Giving webpage below. Add Gift Aid so that the club gets 25% extra from the Government Please share with your friends http://www.justgiving.com/islingtonboxingclub RT,,government,,,Islington Boxing Club COVID Crisis Add Gift Aid Government RT,0.8442,0.073,0.657,0.27
J4TA1,1253859439863529473,2020-04-25 01:32:40+00:00,9,#WeNeedHelp,,6,0,In order for Islington Boxing Club to exist after The COVID 19 Crisis Please donate what you can to the Just Giving webpage below. Add Gift Aid so that the club gets 25% extra from the Government Please share with your friends #WeNeedHelp http://www.justgiving.com/islingtonboxingclub RT,,government,,,Islington Boxing Club COVID Crisis Add Gift Aid Government RT,0.8442,0.07200000000000001,0.6629999999999999,0.265
