username,tweet_id,date,favorites,hashtags,mentions,retweets,replies,text,topical_persons,topical_orgs,persons,orgs,propn,compound,neg,neu,pos
MattAndersonNYT,1235982262975582209,2020-03-06 17:35:09+00:00,6,,,1,0,"Leonardo da Vinci lived to 67, Michelangelo to 88. But poor Raphael only made it to 37. His blockbuster Rome show opened this week, despite coronavirus restrictions and a kerfuffle over loans. ",,,,,Leonardo da Vinci Michelangelo Raphael Rome coronavirus,0.29600000000000004,0.105,0.759,0.135
MFenderesky,1235981178521489408,2020-03-06 17:30:51+00:00,7,,,3,1,SARSCoV2 / COVID-19 now listed as a notifiable disease. ,,,,,,0.0,0.0,1.0,0.0
SMcqueenluvChld,1235980749851037697,2020-03-06 17:29:08+00:00,0,,,0,0,"So to protect against flu you get the flu jab which i am told gives you the flu for your antibodies to know it and fight it if you get it..so same logic says if i stick to drinking Corona beer i’ll be safe from the coronavirus,right??",,,Corona,,jab Corona coronavirus,-0.61,0.187,0.713,0.1
Alreidy,1235978713466114050,2020-03-06 17:21:03+00:00,2,#COVID19,@SueDHellmann,0,0,Totally agree. Excellent reasoned comments by @SueDHellmann on #COVID19. Her lifelong experience in public health makes her a voice we should be listening to at the moment. ,,,,,@SueDHellmann #,0.7764,0.0,0.787,0.213
DeliaCazzato,1235978042092269568,2020-03-06 17:18:23+00:00,0,,@UKChange,0,0,eBay: Stop online sellers cashing in on hand sanitizer amidst Covid-19 crisis. - Sign the Petition! http://chng.it/JfwH7zCL via @UKChange this is disgraceful it’s already causing pandemonium in shops let alone rogues online cashing in ,,,,eBay,eBay Covid-19 http://chng.it/JfwH7zCL,-0.6588,0.20600000000000002,0.718,0.077
MusicNewsWeb,1235977075783172096,2020-03-06 17:14:32+00:00,0,#BuyTickets #JonasBlueMusic #JonasBlue,@JonasBlue,3,0,http://Music-News.com Jonas Blue has 'got to do a job' despite the threat of coronavirus - #BuyTickets #JonasBlueMusic @JonasBlue #JonasBlue http://dlvr.it/RRNTGm,,,JonasBlue,,http://Music News.com Jonas Blue coronavirus BuyTickets # @JonasBlue JonasBlue,0.4168,0.0,0.873,0.127
RosieEHDodds,1235976642306232320,2020-03-06 17:12:49+00:00,0,,,0,0,Coronavirus spreading is easy to avoid. Sneeze into a tissue put it in the bin. Wash your hands. Cough on your arm.. simple. It’s scaremongering now.,,,bin,,Coronavirus,0.1779,0.076,0.825,0.1
boringcarlos,1235975992285544448,2020-03-06 17:10:14+00:00,0,,@UKChange,0,0,eBay: Stop online sellers cashing in on hand sanitizer amidst Covid-19 crisis. - Sign the Petition! http://chng.it/QBJWc8Xq via @UKChange,,,,,eBay Covid-19 Petition http://chng.it/QBJWc8Xq,-0.5255,0.256,0.62,0.124
Pairsonnalites,1235975826585186304,2020-03-06 17:09:35+00:00,0,,,1,0,Mum with HIV 'terrified she will die' takes daughter out of school after coronavirus case confirmed: “I want to reassure people that anyone who has been in close contact with that individual will be contacted by Public Health England. “I would also like… http://dlvr.it/RRNSVV,,,,Public Health England,Mum HIV coronavirus Public Health England http://dlvr.it/RRNSVV,-0.7351,0.153,0.775,0.07200000000000001
Pairsonnalites,1235975823342981121,2020-03-06 17:09:34+00:00,0,,,1,0,Spanish coronavirus patient recovers after being treated with an HIV drug that stops the deadly ...: The combination of lopinavir and ritonavir inhibits and blocks HIV. ... The news came as England's Chief Medical Officer suggested that existing drugs ... http://dlvr.it/RRNSTD,,,,,coronavirus HIV lopinavir ritonavir HIV England Chief Medical Officer http://dlvr.it/RRNSTD,-0.5267,0.124,0.8759999999999999,0.0
Stuckinarock,1235975604941570054,2020-03-06 17:08:42+00:00,0,#CoronaVirusChallenge #COVID,@BBCNews @MattHancock @ByDonkeys,0,0,"@BBCNews #CoronaVirusChallenge #COVIDー19 @MattHancock why is the government lead minister in charge of the crisis lying about prep with supermarkets and why is PM saying he’s been shaking hands with covid19 sufferers. Lies, lies and @ByDonkeys",,government,,,@BBCNews COVIDー19,-0.9531,0.37799999999999995,0.622,0.0
MusicNewsWeb,1235975450553241600,2020-03-06 17:08:05+00:00,0,#OzzyOsbourne #BlackSabbath,@OzzyOsbourne,4,0,http://Music-News.com Ozzy Osbourne cancells plans to appear at the SXSW due to coronavirus - #OzzyOsbourne @OzzyOsbourne #BlackSabbath http://dlvr.it/RRNRzm,,,BlackSabbath,,http://Music Ozzy Osbourne coronavirus OzzyOsbourne @OzzyOsbourne # BlackSabbath http://dlvr.it/RRNRzm,0.0,0.0,1.0,0.0
Shirshah_L,1235974156434444293,2020-03-06 17:02:56+00:00,0,,,0,0,This week the World Bank made $12bn and the imf $50bn available for covid-19.,,,,,World Bank imf covid-19,0.0,0.0,1.0,0.0
CacTusJ4cK__,1235973102170976258,2020-03-06 16:58:45+00:00,1,,,0,0,How mandem are gonna be sounding on their tracks when they get the coronavirus ,,,,,,0.0,0.0,1.0,0.0
MaxineIsATwit,1235972269794566145,2020-03-06 16:55:27+00:00,2,,,1,0,"Every headline I’ve read confirming a coronavirus death doesn’t tell you the victim’s age. The last two taken by the virus here in the UK, as horrible as their deaths are, were over 70 years old. You know what virus has plagued the world longer than COVD-19? Media scare tactics.",,,,,coronavirus UK,-0.8909999999999999,0.184,0.816,0.0
mouseldn,1235970967219945478,2020-03-06 16:50:16+00:00,0,,,0,1,"Coronavirus has got a little scarier now, my entire building has been put on an 8 week quarantine rotation ",,,,,Coronavirus,0.0,0.0,1.0,0.0
Kav_Kaushik,1235970210877894657,2020-03-06 16:47:16+00:00,10,,,1,2,someone at watford temple has tested positive for coronavirus and north west london indian mum facebook is losing their minds,,,,,watford temple coronavirus north west london indian mum facebook,0.25,0.107,0.7440000000000001,0.149
andyoung77,1235969148431319041,2020-03-06 16:43:02+00:00,20,#COVID19,,0,1,I’m sure you’ll be ok James I’m sure even #COVID19 can’t survive in the West Bank toilets,,,,,James West Bank,0.7003,0.0,0.6729999999999999,0.327
NathanSandrooo,1235969076771647490,2020-03-06 16:42:45+00:00,1,,,0,0,what’s coronavirus distracting us from ,,,,,coronavirus,-0.29600000000000004,0.355,0.645,0.0
mfaizal_m,1235967480784474113,2020-03-06 16:36:25+00:00,0,,,0,0,Ffs— 163 people test positive for coronavirus in the UK ,,,,,Ffs coronavirus UK,0.5574,0.0,0.7140000000000001,0.28600000000000003
drjanenicholls,1235967192308551681,2020-03-06 16:35:16+00:00,5,#bashh06march #BASHH #COVID19,@drjohnwhite,0,1,One good thing about coronavirus is it shines the light on developing molecular diagnostics Always an upside! @drjohnwhite #bashh06march #BASHH #COVID19,,,,,coronavirus,0.4926,0.0,0.862,0.138
MTEDx,1235967034799816705,2020-03-06 16:34:38+00:00,42,,,2,0,I’ve got Coronavirus ,,,,,Coronavirus,0.0,0.0,1.0,0.0
tobitests,1235963833166041088,2020-03-06 16:21:55+00:00,0,,,0,4,"I’ve stuck at home for one and a half weeks now due to flu. No not COVID-19 l, just a severe case of man flu. I’m on antibiotics since Tuesday and improvements have been slow, I’m still coughing and I haven’t trained for more than 2 weeks. I’m agitated, help! Off to play Diablo 3",,,Diablo,,flu Tuesday,-0.784,0.223,0.67,0.10800000000000001
FouadLatif1,1235963176740704256,2020-03-06 16:19:19+00:00,0,,,0,0,London coronavirus panic: Sadiq Khan ‘will NOT get extra funding’ after ‘no risk’ claim http://break.ma/uk/10313293,,,Sadiq Khan ‘,,London Sadiq Khan http://break.ma/uk/10313293,-0.5106,0.191,0.809,0.0
Nellvious,1235962853900922881,2020-03-06 16:18:02+00:00,0,#COVID,@NHSEngland,0,1,"Obviously, i want to check I'm not going to be spreading this new virus around so i take the @NHSEngland automated self-assesment form. But the questions 'Have you been to Italy etc in the last 14 days' or 'do you have a sore throat or a fever'... #COVID",,,,,Italy,-0.4767,0.064,0.9129999999999999,0.023
rodolfor,1235960725845217282,2020-03-06 16:09:34+00:00,1,,,0,1,If you are going to pass could you give me an intro to the CEO of Covid? I know someone who might be interested ,,,,,CEO Covid,0.4019,0.0,0.895,0.105
Kevenlaw,1235960059861110787,2020-03-06 16:06:55+00:00,2,#toiletpaperpanic #COVID #COVID19 #FridayThoughts #FridayFeeling,,0,0,Enough now lol #toiletpaperpanic #COVIDー19 #COVID19 #FridayThoughts #FridayFeeling,,,FridayThoughts,,FridayThoughts FridayFeeling,0.4215,0.0,0.7140000000000001,0.28600000000000003
Ruben_E_O,1235958381288009729,2020-03-06 16:00:15+00:00,2,#CoronaVirusChallenge #Eurovision #ESC2020 #mgp2020 #ItalyCoronavirus #COVID,,0,0,Eurovision and Coronavirus MY OPINION New video on https://youtu.be/rX1JKtymXo8 #CoronaVirusChallenge #Eurovision #ESC2020 #mgp2020 #ItalyCoronavirus #COVIDー19,,,,,Eurovision Coronavirus OPINION New ItalyCoronavirus COVIDー19,0.0,0.0,1.0,0.0
KoikiMedia,1235956966935203841,2020-03-06 15:54:38+00:00,0,,,0,0,"Today PM borisjohnson visited Mologic Lab, to meet with scientists developing a home testing device for coronavirus. @London, United Kingdom https://www.instagram.com/p/B9ZeAu9HoLF/?igshid=aytvuagyi620",,,,,PM Mologic Lab coronavirus @London United Kingdom,0.4215,0.0,0.877,0.12300000000000001
Yvie777,1235954549770391552,2020-03-06 15:45:02+00:00,0,,,0,0,This is what a LIAR looks like WTF Trump blames Obama for his own administration's mistakes in dealing with coronavirus ,,,,,LIAR WTF Trump Obama coronavirus,-0.9055,0.44,0.48,0.08
ICN_UK,1235953923330117632,2020-03-06 15:42:32+00:00,0,,@ICN_UK,1,0,FHL launch appeal as Coronavirus shuts down Bethlehem https://www.indcatholicnews.com/news/39070 via @icn_uk,,,,Bethlehem,FHL Coronavirus Bethlehem @icn_uk,0.0,0.0,1.0,0.0
YogReport,1235953130837286912,2020-03-06 15:39:23+00:00,0,,,0,0,"47 new cases confirmed - taking UK total to 163. The government's chief scientific adviser says ""extreme"" action including the isolation of whole households is being considered. Two British Airways staff test positive for Coronavirus.",,government,,Coronavirus,UK British Airways Coronavirus,0.2263,0.069,0.84,0.092
anayaxposso,1235953079092219905,2020-03-06 15:39:11+00:00,8,,,0,0,Starting to think this Coronavirus is being hyped up so much by the media. All the deaths have been by people with other underlying health issues and who were elderly. ,,,,Coronavirus,Coronavirus,0.0,0.0,1.0,0.0
bosszukung,1235952723574616065,2020-03-06 15:37:46+00:00,0,,,0,0," ""163 people test positive for coronavirus in the UK"" ",,,,,coronavirus UK,0.5574,0.0,0.69,0.31
enzandz,1235952286364577792,2020-03-06 15:36:02+00:00,0,,,0,0,"Okay this Coronavirus Covid-19 ting is actually scary, SARS and AIDS mixed into one disease? Dead that",,,,,Coronavirus Covid-19 SARS AIDS,-0.765,0.321,0.598,0.081
EveK1979,1235952271105626112,2020-03-06 15:35:58+00:00,4,,@mercer,0,2,Interesting Coronavirus/ Investment webinar from @mercer,,,,,Coronavirus/ Investment @mercer,0.4019,0.0,0.649,0.35100000000000003
lorenaetal,1235948231558868995,2020-03-06 15:19:55+00:00,1,,,0,2,mano do céu Many suggest namaste as an alternative to shaking hands as coronavirus spreads ,,,mano do céu,,mano coronavirus,-0.1779,0.10800000000000001,0.892,0.0
Tapiwaaaaa,1235947888242495489,2020-03-06 15:18:34+00:00,0,,,0,0,*COVID-19 but yeah I hear you still ,,,,,,0.4215,0.0,0.682,0.318
CedarTreeAdvice,1235947857259134976,2020-03-06 15:18:26+00:00,0,,,0,0,"The rate of COVID19 infection is that it doubles every three days. It was reported that outside of the PRC, there were 17,000 reported cases in the rest of the world. So that would mean in just under 3 weeks o e would expect 1.7 million cases outsode of China",,,,,PRC China,0.0,0.0,1.0,0.0
1966Dear,1235945227506126848,2020-03-06 15:07:59+00:00,0,,,0,1,Dettol is referring to the common cold which is a coronavirus not Covid-19 ,,,,Dettol,Dettol Covid-19,0.0,0.0,1.0,0.0
FredStreams,1235944992721588224,2020-03-06 15:07:03+00:00,9,,,0,6,"SF is on lock down right now because of Coronavirus (All the major companies are telling their workers to operate from home). No surprise their cancelling TwitchCon. There's no cause for alarm in the UK thankfully, but the US healthcare situation makes this a good call.",,,,,SF Coronavirus TwitchCon UK US,0.3905,0.11800000000000001,0.7709999999999999,0.111
Newsminster,1235944866690895872,2020-03-06 15:06:33+00:00,0,,,0,0,"What is coronavirus, how did it start and could the outbreak grow bigger? http://bit.ly/2Tx6f1v",,,,,coronavirus http://bit.ly/2Tx6f1v,0.0,0.0,1.0,0.0
EricdeMarylebon,1235944643096981504,2020-03-06 15:05:40+00:00,0,,,0,0,"""Many suggest namaste as an alternative to shaking hands as coronavirus spreads"" ",,,,,coronavirus,-0.1779,0.134,0.866,0.0
EricdeMarylebon,1235944492689219584,2020-03-06 15:05:04+00:00,0,,,0,0,"""163 people test positive for coronavirus in the UK"" ",,,,,coronavirus UK,0.5574,0.0,0.69,0.31
DesJouleAdam,1235944431301406722,2020-03-06 15:04:49+00:00,1,#oxfordafricaforum #Oxford #Africa #Business,,0,0,"#oxfordafricaforum Update In light of the continuing spread of the coronavirus (COVID-19), it is with regret that the team have made the difficult decision to cancel the #Oxford #Africa #Business Forum.. See link below for full announcement",,,,,coronavirus COVID-19 Oxford # Africa # Business Forum,-0.743,0.177,0.823,0.0
SuttonGymnastic,1235944256679940097,2020-03-06 15:04:08+00:00,0,,,0,0,Any further information about the development of the COVID-19 and the classes at Sutton School of Gymnastics will be posted on the website and via social media.,,,,Sutton School of Gymnastics,Sutton School Gymnastics,0.0,0.0,1.0,0.0
SuttonGymnastic,1235944254188503040,2020-03-06 15:04:07+00:00,0,,,0,1,"Following guidelines from Public Health England, the NHS and British Gymnastics, classes will be on as normal at Sutton School of Gymnastics and we strongly encourage washing hands regularly to help prevent the further spread of the COVID-19 virus. ",,nhs,,Sutton School of Gymnastics,Public Health England NHS British Gymnastics Sutton School Gymnastics,0.802,0.0,0.792,0.20800000000000002
Tweet_Dec,1235940914184491008,2020-03-06 14:50:51+00:00,2,,,0,0,163 people test positive for coronavirus in the UK ,,,,,coronavirus UK,0.5574,0.0,0.69,0.31
ChaseApartment,1235939379245350914,2020-03-06 14:44:45+00:00,0,,@MailOnline,0,0,Britain faces a 'recession' amid first coronavirus death on UK soil https://www.dailymail.co.uk/news/article-8082153/Britain-facing-recession-amid-coronavirus-death-UK-soil.html?ito=amp_twitter_share-top via @MailOnline,,,,,Britain coronavirus UK https://www.dailymail.co.uk article-8082153 Britain UK soil.html?ito,-0.7717,0.358,0.642,0.0
EJWardNews,1235937267421794306,2020-03-06 14:36:21+00:00,1,,@LBCNews @LBC,0,2,"Coronavirus: A pub manager tells me their sales are down this week, ""we're just not getting tourists in"", they blamed cancelled flights and concern among the public. ""Normally at this time on a Friday we'd be packed"" they said. There are only 5 others here. @LBCNews @LBC",,,,,Coronavirus Friday @LBCNews @LBC,-0.6249,0.102,0.898,0.0
NCrezz,1235936609318637571,2020-03-06 14:33:44+00:00,2,,,0,1,"Seriously? Your saying yummy to a seriously endangered species of animal, that may or may not have helped to cause the coronavirus? Well done to the demise of your species dude.",,,,,,0.5362,0.094,0.745,0.162
benjamingardner,1235935541771808769,2020-03-06 14:29:30+00:00,0,,,0,0, Coronavirus-themed parody of Natalie Imbruglia’s ‘Torn’ ,,,Natalie Imbruglia,,Coronavirus Natalie Imbruglia,0.0,0.0,1.0,0.0
tugsandtost,1235935078766850049,2020-03-06 14:27:39+00:00,0,,,0,0,BBC News - Coronavirus: UK cases rise to 163 ,,,,,BBC News Coronavirus UK,0.0,0.0,1.0,0.0
PeteKennedy,1235933990810501120,2020-03-06 14:23:20+00:00,1,#coronavirusuk,,2,1,This is still the NHS 111 advice. Still treating the virus as isolated incidents based on foreign exposure. Likely cases of coronavirus in the UK are seriously underreported and undetected. #coronavirusuk,,nhs,coronavirusuk,,NHS coronavirus UK,-0.4588,0.121,0.879,0.0
CateringHot,1235930893912616961,2020-03-06 14:11:02+00:00,0,,,0,0,Two British Airways staff members test positive for coronavirus ,,,,British Airways,British Airways coronavirus,0.5574,0.0,0.69,0.31
ibundle,1235928404517703682,2020-03-06 14:01:08+00:00,2,,,0,0,"Morrison’s on Holloway Rd frequently gets sold out of basics too, coronavirus or no coronavirus",,,,Holloway Rd,Morrison Holloway Rd coronavirus coronavirus,-0.29600000000000004,0.136,0.8640000000000001,0.0
Herbieherbert10,1235927290523115520,2020-03-06 13:56:43+00:00,19,,,0,6,"The new form of currency in post Brexit, post COVID-19 Britain. ",,,,,Brexit Britain,0.0,0.0,1.0,0.0
paullferrer,1235924176986353665,2020-03-06 13:44:20+00:00,0,,,0,0,"""Should conditions relating to COVID-19 continue or worsen, we have measures at our disposal to reduce the impact on our business"" Are these measures like cutting daytime cinema staff and staff late night travel allowances from £8 to £2? ",,,,,,-0.3182,0.111,0.831,0.057999999999999996
Shezclayton,1235923828561362946,2020-03-06 13:42:57+00:00,0,,,0,0,"Gotta thank COVID-19 for stopping me moving to China and bagging a job in the south instead, somehow that’s more foreign than China would’ve been",,,,,China China,0.2263,0.059000000000000004,0.8490000000000001,0.092
Maverickaizer,1235923694842757121,2020-03-06 13:42:25+00:00,0,,,0,0,"Possibly the bird flu? Like a Nostradamus these predictions are not always spot on and are sometimes dependent on actions and reactions. Say for argument sake the ‘coronavirus’ prediction was a guess, it sure was one in a billion heck of a lucky guess!",,,,,Nostradamus coronavirus,0.4199,0.098,0.75,0.152
rmdbutler,1235922150390931457,2020-03-06 13:36:17+00:00,5,,,0,0,I'm going to protect myself from coronavirus by only getting on the tube whilst dressed as Queen Bee from The Masked Singer,,,The Masked Singer,,coronavirus Queen Bee Masked,0.3818,0.0,0.89,0.11
coldandpressed,1235921811587641344,2020-03-06 13:34:56+00:00,0,,,0,0,BBC News - Government clarifies coronavirus insurance stance ,,government,,BBC News - Government,BBC News Government coronavirus,0.2263,0.0,0.787,0.213
jonathancreaser,1235919725219196933,2020-03-06 13:26:39+00:00,0,,,0,0,"Yep, Tesco Twickenham is totally out of pasta... BBC News - Coronavirus: Supermarkets won't run out of food, vows Matt Hancock ",hancock,,Matt Hancock,,Tesco Twickenham BBC News Coronavirus Matt Hancock,0.29600000000000004,0.0,0.9009999999999999,0.099
AndyWoodturner,1235916825604558849,2020-03-06 13:15:08+00:00,12,#fuckingmorons,,0,3,Obituary: ******* sadly passed away due to coronavirus yesterday. Please send flours. #fuckingmorons,,,,,coronavirus,-0.128,0.174,0.6829999999999999,0.14300000000000002
blisswords,1235916515431546880,2020-03-06 13:13:54+00:00,4,,,1,5,"In Paddington station yesterday I was wondering if pigeons could be Covid carriers? Also is it safe to go swimming in municipal baths, eg Seymour, Porchester, Marshall Street?",,,Porchester,,Paddington Covid eg Seymour Porchester Marshall Street,0.504,0.0,0.892,0.10800000000000001
misterscoop,1235914903522865152,2020-03-06 13:07:29+00:00,0,,,0,0,You’ve missed a trick. Does going on a single’s holiday increase your risk of coronavirus? Top dating advice. Wipe right after swiping...,,,,,coronavirus,0.3182,0.19399999999999998,0.565,0.24
RobertCorp,1235914167997083649,2020-03-06 13:04:34+00:00,3,,,0,2,"You probably had imunity to the particular strain of flu he had. However, the novel coronavirus is a new virus - no-one has immunity to it until they’ve had it.",,,,,coronavirus,-0.128,0.115,0.816,0.069
serialTweeper,1235914134161678336,2020-03-06 13:04:26+00:00,1,#COVID19,,0,0,Be Kind & support one another during #COVID19,,,,,Kind,0.7269,0.0,0.496,0.504
xxkelly_kellsxx,1235908895538896897,2020-03-06 12:43:37+00:00,0,,@Hermesparcels,0,0,@Hermesparcels you can promise a million £ to support self employed drivers with coronavirus yet you can’t promise your customers next day delivery. I’ve been waiting for my parcel for 2 days now. And nothing. Your service is beyond a joke,,,,,@Hermesparcels coronavirus,0.8176,0.0,0.7959999999999999,0.204
hradojev,1235907639730634752,2020-03-06 12:38:38+00:00,4,,,0,0,Bryan doing the lord’s work tracking the coronavirus hand sanitiser splurge ,,,Bryan,,Bryan lord coronavirus hand sanitiser splurge,0.4939,0.0,0.758,0.242
lucycolleer,1235907185051414528,2020-03-06 12:36:49+00:00,2,,,1,0,There really is no need to worry. I completed Theme Hospital back in 2002 and am a qualified hospital chief exec. I have contained hundreds of epidemics. COVID-19 is no challenge. ,,,,,Theme Hospital exec COVID-19,-0.6809,0.191,0.809,0.0
HarryWatson63,1235906561911988230,2020-03-06 12:34:21+00:00,4,,,1,1,"Yep, travelled by train and tube this morning to London and now in a busy gastro pub. Not a mask in sight. Did see a sweet marriage proposal (and acceptance) at platform 9 3/4 in Kings Cross station... Love conquers coronavirus",,,,Kings Cross,London gastro Kings Cross coronavirus,0.9081,0.0,0.7490000000000001,0.251
danpalmer,1235906340893097985,2020-03-06 12:33:28+00:00,0,,,0,1,Why go back to work when you could join “Covid-19 Spectators” on WhatsApp. It’s a hoot.,,,,WhatsApp,Covid-19 Spectators WhatsApp,0.29600000000000004,0.0,0.872,0.128
Sonic_Screwup,1235905239225597953,2020-03-06 12:29:05+00:00,14,,,0,2,Why can’t there be good news like ‘ten cases of coronavirus detected in the White House’?,,,,,coronavirus White House,0.6597,0.0,0.722,0.278
carolinerichmnd,1235903462002397186,2020-03-06 12:22:01+00:00,0,,,0,0,"If a Chinese herb inhibited the coronavirus there wouldn't be an epidemic, would there? ",,,,,,-0.1027,0.09699999999999999,0.903,0.0
PascualJeanloui,1235903099883196416,2020-03-06 12:20:35+00:00,0,,@realDonaldTrump,0,0,"@realDonaldTrump good morning President Trump. I will like you advise all America to don't hunt birds migratory from east or west. The are contaminated, coronavirus. The must stop .Leader of the Roman party. AVE",,,,,President Trump America east coronavirus AVE,0.7096,0.055,0.7440000000000001,0.201
SiobhanMonagh10,1235902558071394304,2020-03-06 12:18:26+00:00,3,,@BroxbourneBC @hcccareer,1,0,Help Us Keep Broxbourne Coronavirus Free @BroxbourneBC @hcccareer,,,,,Broxbourne Coronavirus Free @BroxbourneBC,0.7184,0.0,0.5,0.5
PascualJeanloui,1235902214524350465,2020-03-06 12:17:04+00:00,0,,,0,0,"All hunters .British and others don't hunt any birds migratory.A big majority have coronavirus, don't eat or http://touch.you dog is in http://danger.new . you must follow me.summer will change the ptocess. Wave of heat will stop 99 %. Leader of the Roman party.Ave",,,,the Roman party,coronavirus http://danger.new me.summer Ave,-0.29600000000000004,0.05,0.95,0.0
carolinerichmnd,1235901921988407296,2020-03-06 12:15:54+00:00,0,,,0,0,Here's my coronavirus tip: buy a new nailbrush for the kitchen and bathroom. Better than facemasks.,,,,,,0.4404,0.0,0.838,0.162
katechristie4,1235901618882781184,2020-03-06 12:14:42+00:00,0,,@BBCRadio2,0,0,@BBCRadio2 sanitiser won’t kill the coronavirus so using it for this is pointless.,,,,,@BBCRadio2 sanitiser,-0.6908,0.281,0.7190000000000001,0.0
LebbyE,1235899735552266241,2020-03-06 12:07:13+00:00,5,,,0,6,Practising for the coronavirus by self-isolating with the norovirus instead. For the second time in two months.,,,,,,0.0,0.0,1.0,0.0
SrKanLondon,1235898974793498624,2020-03-06 12:04:12+00:00,1,#London #spring #COVID,,0,0,"Welcome Spring, bye bye Covid-19 #London #spring #COVIDー19",,,,,Welcome Spring London COVIDー19,0.4588,0.0,0.7,0.3
cgledhill,1235895292957990913,2020-03-06 11:49:34+00:00,1,#COVID19,,0,0,#COVID19 hopefully,,,COVID19,,,0.4019,0.0,0.27,0.73
r_m_meredith,1235891612301119488,2020-03-06 11:34:56+00:00,0,,@CostaCruises,0,1,"Hello @CostaCruises some family members are currently on Costa Victoria, due to disembark in Venice on 28th March. Is disembarkation port likely to change due to Coronavirus?",,,,Coronavirus,Costa Victoria Venice March Coronavirus,0.0,0.0,1.0,0.0
spmatovu,1235890820529754113,2020-03-06 11:31:48+00:00,1,,,0,0,"Coronavirus: 3 questions, Does anyone know if; 1- it can infect a person suffering from normal flu(common cold)? 2- it has mutated enough to reinfect someon who has been healed? 3- behaves differently in a hot climate?",,,,,Coronavirus flu(common,-0.5632,0.092,0.9079999999999999,0.0
drummersark,1235888562081607680,2020-03-06 11:22:49+00:00,0,,,0,0,Khan is the worst mayor of London ever! Must be replaced by someone more competent soon! London coronavirus panic: Sadiq Khan ‘will NOT get extra funding’ after ‘no risk’ claim ,,,Sadiq Khan ‘,,Khan London London Sadiq Khan,-0.75,0.212,0.7190000000000001,0.069
AmielWayne,1235887024374272001,2020-03-06 11:16:42+00:00,5,,@jackwallington,0,2,Top of my list of emergency rations would be peat-free compost because I’m spending the Coronavirus crisis in the garden. But I’m with @jackwallington as Prosecco would be second on the list. What would others have on their emergency list?,,,,,Coronavirus Prosecco,-0.7469,0.172,0.797,0.031
Alonso_GD,1235886625642573824,2020-03-06 11:15:07+00:00,10,,,1,1,Maybe we have a shot as a species if we say the only way to stop the Coronavirus is to stop Climate Change?,,,,Coronavirus,Coronavirus Climate Change,-0.5267,0.17300000000000001,0.8270000000000001,0.0
ItsLewis7592,1235886619128926208,2020-03-06 11:15:06+00:00,0,,,0,0,"So health experts advised not to touch eyes, mouth or face to avoid the spread of coronavirus. What happens if you get an itch somewhere? it does make make you ask the question",,,,,coronavirus,-0.29600000000000004,0.064,0.9359999999999999,0.0
MunatsiEdgar,1235885736362217473,2020-03-06 11:11:35+00:00,78,,,41,8,It is important for people to understand that wearing surgical masks for protection against COVID-19 might actually increase your risk of getting it as you are bound to be constantly touching your face when adjusting the mask.Masks are only recommended when you have symptoms. ,,,,,,0.4215,0.044000000000000004,0.833,0.12300000000000001
