username,tweet_id,date,favorites,hashtags,mentions,retweets,replies,text,topical_persons,topical_orgs,persons,orgs,propn,compound,neg,neu,pos
abrustolon,1235607332194791425,2020-03-05 16:45:19+00:00,0,#coronavirus #CoronaVirusUpdate,@sainsburys @Tesco @asda @AsdaServiceTeam @Morrisons @DailyMailUK @BBCWorld @BBCBreaking @SkyNews @SkyNewsBreak @skysarahjane @KayBurley,0,0,That’s how u get #coronavirus #CoronaVirusUpdate @sainsburys @Tesco @asda @AsdaServiceTeam @Morrisons @DailyMailUK @BBCWorld @BBCBreaking @SkyNews @SkyNewsBreak @skysarahjane @KayBurley,,,,@BBCWorld @BBCBreaking @SkyNews,@Tesco @AsdaServiceTeam @Morrisons @DailyMailUK @SkyNews @SkyNewsBreak,0.0,0.0,1.0,0.0
gerimclean,1235607032457199617,2020-03-05 16:44:07+00:00,2,#Italian #London #coronavirus,,0,0,They’re emptying my #Italian apartment tomorrow to ship back to #London. Company is quite impressive with their speed of evacuation activities. Perfect timing too as apartment lease was up on Sunday so they lost no money. #coronavirus,,,,,# London Sunday coronavirus,0.3921,0.145,0.6970000000000001,0.159
abrustolon,1235606652835057669,2020-03-05 16:42:37+00:00,0,#CoronaVirusUpdate #coronavirus,,0,0,#CoronaVirusUpdate that’s how u get #coronavirus ,,,,,coronavirus,0.0,0.0,1.0,0.0
SInglesfield,1235605160019275777,2020-03-05 16:36:41+00:00,0,#ResignNowTrump #25thAmendment #ImpeachTrumpAgain #coronavirus,,1,0,Bloody hell. #ResignNowTrump #25thAmendment #ImpeachTrumpAgain DO SOMETHING! #coronavirus ,,,,,# ResignNowTrump coronavirus,-0.8313,0.565,0.435,0.0
LAvivson,1235604000797593600,2020-03-05 16:32:04+00:00,1,#Coronavirus,,0,0,"""Coronavirus: Cases rise in Europe as global death toll exceeds 3,200"" #Coronavirus ",,,,,Coronavirus Europe Coronavirus,-0.5994,0.262,0.738,0.0
motabalawwd,1235601084581908485,2020-03-05 16:20:29+00:00,30,#VIDEO #Makkah #Coronavirus #Saudi,@OKAZ_online,195,2,"#VIDEO: The circling area around Holy Kaaba at the Holy Mosque in #Makkah was emptied of people temporarily in order to clean and sterilize it, due to #Coronavirus fears and to insure the safety of pilgrims. ———— VIDEO : @OKAZ_online For #Saudi Press",,,Coronavirus,,Holy Kaaba Holy Mosque Makkah Coronavirus @OKAZ_online Press,0.25,0.092,0.7959999999999999,0.112
lisamainwaring,1235598835348639747,2020-03-05 16:11:33+00:00,0,#Coronavirus #COVID19,,0,0,The #Coronavirus podcast is here #COVID19 ...,,,Coronavirus,,Coronavirus,0.0,0.0,1.0,0.0
EricdeMarylebon,1235598667047829505,2020-03-05 16:10:53+00:00,0,#Coronavirus,,0,0,"""Coronavirus: Cases rise in Europe as global death toll exceeds 3,200"" #Coronavirus ",,,,,Coronavirus Europe Coronavirus,-0.5994,0.262,0.738,0.0
EmilieRance,1235592592336842754,2020-03-05 15:46:44+00:00,2,#Coronavirus,,0,0,"If I’m going to chime in on #Coronavirus with just one tweet, let this be it. ",,,,,# Coronavirus,0.0,0.0,1.0,0.0
Margot_Hank,1235587582043422720,2020-03-05 15:26:50+00:00,0,#coronavirus,@piersmorgan @BorisJohnson,0,0,"@piersmorgan - not usually a fan, but loved the coronavirus piece: @BorisJohnson has “conveyed a relaxed view of the virus, even boasting that he shook as many hands as possible during a visit to a hospital containing #coronavirus patients.This struck me as a stupid thing to say”",,,,,coronavirus @BorisJohnson,0.3546,0.16699999999999998,0.674,0.159
AngryWaspAppare,1235586948007411718,2020-03-05 15:24:19+00:00,1,#DRWHO #Coronvirus #CoronaAlert #coronaviruslondon #coronavirus #bbc #daleks #Cybermen,,1,0,This new #DRWHO is shite.. .. #Coronvirus #CoronaAlert #coronaviruslondon #coronavirus #bbc #daleks #Cybermen,,,Cybermen,,DRWHO Coronvirus # CoronaAlert # # coronavirus # bbc #,0.0,0.0,1.0,0.0
LTHlondon,1235582997241487360,2020-03-05 15:08:37+00:00,1,#Coronavirus,,0,0,"“Sir, have you heard of #Coronavirus?” ",,,Coronavirus,,Sir Coronavirus,0.0,0.0,1.0,0.0
clarkysun,1235582031687380992,2020-03-05 15:04:47+00:00,1,#coronavirus #bury,,0,0,Scary when it’s on your doorstep! #coronavirus #bury GP surgery shuts suddenly over potential coronavirus case,,,,,coronavirus # GP coronavirus,-0.5411,0.189,0.8109999999999999,0.0
steffmushy,1235579087839621120,2020-03-05 14:53:05+00:00,5,#Philippines #Covid19 #Coronavirus,@inquirerdotnet @gmanewsbreaking @DOHgovph,2,0,#Philippines 3 cases and 1 death ONLY? Doubt it. #Covid19 #Coronavirus @inquirerdotnet @gmanewsbreaking @DOHgovph,,,,,Philippines Covid19 Coronavirus,-0.7506,0.348,0.652,0.0
Callumundo,1235579025306705920,2020-03-05 14:52:50+00:00,5,#SelfIsolation #coronavirus #coronavirusuk,,0,0,Day 4 of #SelfIsolation - Cheese on Toast is LIFE - Cats still hate me - No results as yet - Life goes on. #coronavirus #coronavirusuk,,,,,SelfIsolation Cheese Toast LIFE coronavirus # coronavirusuk,-0.7096,0.197,0.8029999999999999,0.0
cgledhill,1235574308522483720,2020-03-05 14:34:05+00:00,4,#coronavirus #COVID19 #panicbuying,@sainsburys,3,1,More panic buying at @sainsburys giant Croydon store in south London! #coronavirus #COVID19 #panicbuying – at Sainsbury's,,,,Sainsbury,Croydon London Sainsbury,-0.5974,0.195,0.805,0.0
WillButterworth,1235572377964199937,2020-03-05 14:26:25+00:00,0,#coronavirus #Flybe #CoronaAlert,,0,0,Can’t believe #coronavirus took down an entire airline... #Flybe #CoronaAlert,,,,,coronavirus Flybe CoronaAlert,0.0,0.0,1.0,0.0
mikewarburton,1235570506511912960,2020-03-05 14:18:59+00:00,4,#coronavirus #moronvirus,,2,0,"Don’t do as I do, do as I say. #coronavirus #moronvirus",,,,,coronavirus # moronvirus,0.0,0.0,1.0,0.0
suffolkchamber,1235569473282871297,2020-03-05 14:14:52+00:00,9,#BBC #coronavirus #bccconf,,5,0,Matthew Darroch-Thompson and John Mayhew interviewed by #BBC Radio Five. Matthew was also filmed live by BBC News asking Matt Hancock about the impact of #coronavirus on business. #bccconf – at Queen Elizabeth II Conference Centre,hancock,,,Queen Elizabeth II Conference Centre,Matthew Darroch Thompson John Mayhew BBC Radio Five Matthew BBC News Matt Hancock Queen Elizabeth II Conference Centre,0.0,0.0,1.0,0.0
dancingbella23,1235568727011266561,2020-03-05 14:11:54+00:00,1,#ateez #coronavirus,,0,0,"Unpopular opinion: ATEEZ should postpone all their EU concerts. We, the EU countries, are unequipped and unprepared to handle an outbreak... Despite what the UK government is saying, honestly we need to be way more cautious #ateez #coronavirus",,government,,,ATEEZ EU EU UK coronavirus,0.1045,0.086,0.841,0.07200000000000001
JJ1Travels,1235566518982737926,2020-03-05 14:03:08+00:00,3,#coronavirus,@abtotmembers @AITOHQ,0,1,@abtotmembers have been telling me how great and useful our #coronavirus updates have break. Great to hear feedback at the @AITOHQ AGM.,,,,,# coronavirus @AITOHQ AGM,0.9022,0.0,0.631,0.369
KulpaBart,1235562634264678400,2020-03-05 13:47:42+00:00,1,#Coronvirus #coronavirusuk #CoronaAlert #coronavirus #COVID19 #COVID #UK #London #Britain #Creative #creativity #TFL #CoronavirusOutbreak #Coro,,1,0,How to avoid catching or spreading Coronavirus? Here is the answer #Coronvirus #coronavirusuk #CoronaAlert #coronavirus #COVID19 #COVIDー19 #UK #London #Britain #Creative #creativity #TFL #CoronavirusOutbreak #Coro,,,,,Coronavirus Coronvirus CoronaAlert UK # London Britain # TFL CoronavirusOutbreak Coro,0.5106,0.07400000000000001,0.741,0.185
elancschamber,1235562309701025794,2020-03-05 13:46:24+00:00,0,#coronavirus #BCCConf,@MattHancock,0,0,Interesting to hear the plans for #coronavirus from Rt Hon @MattHancock Secretary for State for Health and Social Care at #BCCConf in London today. “We’ve published virus-specific guidance for businesses and employers on http://gov.uk. We’ll come out of the other side. https://twitter.com/britishchambers/status/1235531778926002177,,,,,# coronavirus Rt Hon Secretary State Health Social Care London http://gov.uk,0.7096,0.0,0.871,0.129
SiFrew,1235554347208953856,2020-03-05 13:14:46+00:00,2,#coronavirus #luxury #brandambassador #bankingconsultant #London,@theresjenn @TheNedLondon,1,0,@theresjenn - @TheNedLondon is still busy. #coronavirus - #luxury #brandambassador &amp; #bankingconsultant http://www.sifrew.com in #London – at Zobler's Delicatessen,,,,,@theresjenn @TheNedLondon coronavirus London Zobler Delicatessen,0.1027,0.0,0.928,0.07200000000000001
WineFetcher,1235554305890865153,2020-03-05 13:14:36+00:00,2,#coronavirus,@TheGymGroup @helensmindfulPT,1,0,@TheGymGroup surprised by the lack of hand gels available at Kingston this morning. Surely you should be encouraging everyone to clean their hands upon entry? @helensmindfulPT #coronavirus,,,,,Kingston coronavirus,0.8957,0.061,0.561,0.377
DawnNeesom,1235550474255781889,2020-03-05 12:59:23+00:00,16,#coronavirus,,0,0,"Exactly. We’ve created a panic pandemic and that’s far more deadly that #coronavirus. Keep calm, carry on and wash your bloody hands. ",,,,,,-0.4404,0.218,0.632,0.151
DawnNeesom,1235549784917803009,2020-03-05 12:56:38+00:00,37,#goingouthappy #coronavirus,,0,0,"Happy to say we have stockpiled red wine. Oh, wait, sorry no. That’s just a normal week’s supply. #goingouthappy #coronavirus",,,,,# coronavirus,0.5267,0.057,0.7829999999999999,0.161
IBDPassport,1235548549485486082,2020-03-05 12:51:44+00:00,49,#COVID19 #COVID #coronavirus #IBD #Crohns #colitis,@TheLancet @IBDMD,30,2,Good commentary in @TheLancet regarding #COVID19 &amp; the potentially beneficial effects of biologics to 'reduce immunopathology &amp; boost immune response' . Check out the threads from @IBDMD for more info . #COVIDー19 #coronavirus #IBD #Crohns #colitis,,,,,@TheLancet COVID19 amp @IBDMD COVIDー19 # IBD # Crohns,0.8658,0.0,0.7490000000000001,0.251
JordySMarshall,1235547864421588992,2020-03-05 12:49:00+00:00,0,#Coronavirus,,1,0,We want to hear what construction’s biggest #Coronavirus concerns are ,,,Coronavirus,,Coronavirus,0.0772,0.0,0.8740000000000001,0.126
ItsArupGanguly,1235547122654679040,2020-03-05 12:46:04+00:00,0,#deewaar #coronavirus #Bollywood #AmitabhBachchan,,0,0,#deewaar #coronavirus #Bollywood #AmitabhBachchan ,,,,,# Bollywood # AmitabhBachchan,0.0,0.0,1.0,0.0
deeokelly1,1235546608181358592,2020-03-05 12:44:01+00:00,2,#Coronavirus,,0,1,This would be me. I can't turn a page without licking my fingers. I'm screwed #Coronavirus,,,Coronavirus,,# Coronavirus,-0.4939,0.17600000000000002,0.8240000000000001,0.0
KindnessCode,1235544733608480768,2020-03-05 12:36:34+00:00,18,#Coronavirus,,11,0,"#Coronavirus, 1. what's the risk? 2. Symptoms 3. How to avoid? 4. Check if you need medical help? ""Let's not panic!"" Be kind. ",,,,,# Coronavirus,-0.3624,0.253,0.575,0.173
Boycey_Boy,1235544204362858496,2020-03-05 12:34:28+00:00,1,#Coronavirus,,0,2,Got hundreds of these at work.. might go sell em outside Hammersmith station make a killing. Loads of hand sanitiser too.. #Coronavirus ,,,Coronavirus,,Hammersmith Coronavirus,-0.29600000000000004,0.159,0.725,0.116
stu_bro,1235544031926550528,2020-03-05 12:33:47+00:00,3,#London #coronavirus,@TfL,0,0,Level of paranoia on #London public transport is fever pitch. Guy sneezed into his hands just now and everyone edges away and gives him a serious death stare #coronavirus @TfL,,,Guy,,London Guy # coronavirus @TfL,-0.7351,0.211,0.789,0.0
oregentraining,1235543855702949888,2020-03-05 12:33:05+00:00,1,#coronavirus #ThursdayThought,,0,0,To put #coronavirus in context #ThursdayThought,,,,,# ThursdayThought,0.0,0.0,1.0,0.0
OgilvyHealthUK,1235543752921567233,2020-03-05 12:32:40+00:00,7,#CoronaVirus #COVID19,,2,0,Live now from our London office. Link to stream below #CoronaVirus #COVID19,,,,,London CoronaVirus,0.0,0.0,1.0,0.0
BibbyFinanceUK,1235542885266796544,2020-03-05 12:29:13+00:00,1,#SMEUK #trade #coronavirus #COVID19,@MattHancock,0,0,"‘Businesses must prepare for the worst and work for the best.’ @MattHancock says ‘businesses have a crucial role to play in tackling Coronvirus’ advising everyone to engage, stay informed and do the right thing to help mitigate the spread. #SMEUK #trade #coronavirus #COVID19 – at Queen Elizabeth II Conference Centre",,,,Queen Elizabeth II Conference Centre,@MattHancock Coronvirus SMEUK # Queen Elizabeth II Conference Centre,0.34,0.071,0.799,0.13
elancschamber,1235540096020955138,2020-03-05 12:18:08+00:00,0,#coronavirus #BCCConf,@MattHancock,0,0,Interesting to hear the plans for #coronavirus from Rt Hon @MattHancock Secretary for State for Health and Social Care at #BCCConf in London today. “We’ve published virus-specific guidance for businesses and employers on http://gov.uk. We’ll come out of the other side. https://twitter.com/britishchambers/status/1235531778926002177,,,,,# coronavirus Rt Hon Secretary State Health Social Care London http://gov.uk,0.7096,0.0,0.871,0.129
stewartelee,1235538027923075072,2020-03-05 12:09:55+00:00,6,#CoronaVirus,,0,1,"One of the side affects of my genetic condition and disabilities is i can cough quite frequently sometimes. This is going down wonderfully with commuters on the tube today, getting a train after this too #CoronaVirus ",,,,,CoronaVirus,0.5994,0.0,0.9,0.1
BibbyFinanceUK,1235537582844493825,2020-03-05 12:08:09+00:00,4,#Coronavirus #SMEUK #trade #bccconf #BelieveInBusiness,@MattHancock,1,0,"‘Business done right is a force for good in the world, it links effort and reward.’ @MattHancock shares why he is passionate about supporting UK SMEs and discusses the government’s 4 part action plan to tackling #Coronavirus. #SMEUK #trade #bccconf #BelieveInBusiness – at Queen Elizabeth II Conference Centre",,government,,Queen Elizabeth II Conference Centre,UK # Coronavirus SMEUK # BelieveInBusiness Queen Elizabeth II Conference Centre,0.8859999999999999,0.0,0.794,0.206
TValleyChamber,1235537193243901952,2020-03-05 12:06:36+00:00,2,#coronavirus #bccconf,@MattHancock,0,0,Clear message from @MattHancock - no one should be penalised for doing the sensible thing #coronavirus #bccconf,,,,,@MattHancock coronavirus,0.1027,0.111,0.758,0.131
AdamHerriott,1235536551792308224,2020-03-05 12:04:03+00:00,0,#Coronvirus #COVID19 #coronavirus,,0,0,Anyone else a little concerned about how surprised people are about being told to wash hands? #Coronvirus #COVID19 #coronavirus,,,,,,0.2263,0.0,0.905,0.095
SInglesfield,1235536231464828929,2020-03-05 12:02:47+00:00,2,#coronavirus #COVID19 #Quarantine #SelfQuarantine,@BorisJohnson,1,0, I think @BorisJohnson was trying to emulate the 80s YOU CAN SHAKE HANDS with aids patients awareness efforts when he boasted to shake hands with #coronavirus patients. What a dangerous moron! How thick can one be???? #COVID19 #Quarantine #SelfQuarantine,,,,,@BorisJohnson aids coronavirus COVID19 # Quarantine SelfQuarantine,-0.893,0.25,0.75,0.0
SInglesfield,1235534981159628801,2020-03-05 11:57:49+00:00,1,#25thAmendment #coronavirus,@realDonaldTrump @BorisJohnson,1,1,"#25thAmendment pronto for @realDonaldTrump . Comparable nonsense as @BorisJohnson bizarre boast of shaking hand with #coronavirus patients. This is not an aids inclusion exercise, you idiot. ",,,coronavirus,,@realDonaldTrump @BorisJohnson coronavirus aids,-0.7003,0.292,0.614,0.094
CNBCJulianna,1235534378400444416,2020-03-05 11:55:25+00:00,3,#coronavirus,,3,2,Definitely worth a read - why the UK government’s #coronavirus planning vastly OVERESTIMATES the #of people likely to contract the virus ,,government,,,UK # coronavirus,0.5574,0.0,0.805,0.195
mneemomusic,1235533633835974657,2020-03-05 11:52:28+00:00,3,#Coronavirus,,0,1,"One of the worst days so far for - #Coronavirus was the 10th of February. On that day, 108 persons in CHINA died of Coronavirus. BUT, on the same day... 26,283 people died of Cancer24,641 people died of Heart Disease 4,300 people died of Diabetes and on that day.",,,,,"Coronavirus February CHINA Coronavirus Cancer24,641 Heart Disease Diabetes",-0.9664,0.308,0.6920000000000001,0.0
ChrissyKinsella,1235532697566621696,2020-03-05 11:48:44+00:00,2,#coronavirus,,0,0,"The fanciest, most exclusive 3-day cultural conference at the poshest hotel I have ever been invited to has been cancelled due to bloody #coronavirus. ",,,,,# coronavirus,-0.4779,0.177,0.758,0.065
KristineGarina,1235526841433235464,2020-03-05 11:25:28+00:00,8,#coronavirus,@DollyParton @BoyGeorge,1,2,Hmmmm... Jolene or chorus of Karma Chameleon? @DollyParton @BoyGeorge #coronavirus ,,,Karma Chameleon,,Hmmmm Jolene Karma Chameleon @DollyParton @BoyGeorge coronavirus,0.0,0.0,1.0,0.0
mikesanuk,1235524531684626433,2020-03-05 11:16:17+00:00,0,#coronavirus,@PHE_uk,0,0,"The Best way to beat #coronavirus follow @PHE_uk advice. WASH YOUR HANDS WITH SOAP AND WATER. COUGH IN TO YOUR SLEEVE. It is simple really. No need for Hysteria, just be sensible.",,,,,coronavirus SOAP WATER SLEEVE Hysteria,-0.0498,0.14,0.7509999999999999,0.109
UB5simon,1235521193165365249,2020-03-05 11:03:01+00:00,0,#flybe #coronavirus #Flybecollapse,,0,0,"#flybe downfall in bookings won't just be #coronavirus. It'll also likely be a lack of consumer confidence that they were going to be around for long anyway. It was just the final nail, sadly. #Flybecollapse",,,Flybecollapse,,flybe Flybecollapse,-0.2023,0.126,0.792,0.08199999999999999
BaizhouCai,1235521079512268800,2020-03-05 11:02:34+00:00,1,#coronavirus #CoronaAlert #coronavirusuk #CoronavirusOutbreak #pandemic,,0,0,So rather than updating the public with the latest info on #coronavirus the government want to delay it to once a week? Also not allowing people know where the infected are?? #CoronaAlert #coronavirusuk #CoronavirusOutbreak #pandemic,,government,CoronaAlert,,coronavirus # CoronaAlert # CoronavirusOutbreak #,-0.6946,0.154,0.813,0.033
ToastTheBride,1235519715482701828,2020-03-05 10:57:09+00:00,0,#coronavirus #Coronvirus #COVID #ThursdayThoughts #ThursdayMotivation #thursdayvibes #coronavirusinindia,,0,0,Please RT If you cannot buy a mask for #coronavirus / #Coronvirus then why not consider a Plan B ....... #COVIDー19 #ThursdayThoughts #ThursdayMotivation #thursdayvibes #coronavirusinindia,,,,,# coronavirus # Coronvirus Plan B COVIDー19 ThursdayThoughts # ThursdayMotivation #,0.3182,0.0,0.913,0.087
vrynqueen,1235516794359762946,2020-03-05 10:45:33+00:00,25,#Coronvirus #coronavirus #CoronavirusESP,@el_pais,25,2,Los números del #Coronvirus #coronavirus son mentira. España no está atendiendo todos los posibles casos. Ayuden a difundir. @el_pais #CoronavirusESP,,,Ayuden,,Los del # Coronvirus # coronavirus España todos los posibles casos CoronavirusESP,-0.29600000000000004,0.104,0.8959999999999999,0.0
TheSomersTown,1235516692094160896,2020-03-05 10:45:08+00:00,1,#Coronavirus #London #StaySafe,,1,0,"Worried about #Coronavirus &amp; travelling to #London then we can help, our toilets are open to all, buy something or don’t, pop in or stick around, just know we’re here.... #StaySafe",,,London,,Coronavirus amp London StaySafe,0.128,0.065,0.855,0.08
walijon,1235516498883592192,2020-03-05 10:44:22+00:00,93,#coronavirus,,6,1,These bloody US marines are probably the source of the new #coronavirus.,,,,,US,-0.4404,0.209,0.7909999999999999,0.0
FriendsSriLanka,1235511747718590464,2020-03-05 10:25:30+00:00,3,#SriLanka #Coronavirus,@VegaInnovations @codegen_int,4,0,"VIDEO: South Asia's first fully-electric supercar Vega EVX,designed & manufactured in #SriLanka, was officially unveiled on March 3rd at the Geneva International Motor Show 2020 which was affected due to #Coronavirus concerns @VegaInnovations @codegen_int",,,,@codegen_int,South Asia Vega EVX SriLanka March Geneva International Motor Show Coronavirus,-0.1531,0.046,0.954,0.0
MarkGitsham,1235511589505314818,2020-03-05 10:24:52+00:00,6,#coronavirus #MultipleSclerosis #NHS,@LibDemHealth @munirawilson,3,0,"I'm sorry to hear your treatment has been cancelled due to #coronavirus. It's really concerning seeing the affect on people with #MultipleSclerosis and other serious illnesses. The huge shortage of 43,000 nurses in #NHS surely not helping too. @LibDemHealth @munirawilson",,nhs,,,MultipleSclerosis NHS @LibDemHealth,-0.5405,0.239,0.655,0.106
mneemomusic,1235510736815886336,2020-03-05 10:21:28+00:00,3,#coronavirus #ultramiami2020 #Tomorrowland,,0,0,"So many show cancellations, guys, I think next year will be epic in terms of festivals etc coz I have a feeling that the whole world will feel reborn after this #coronavirus shit #ultramiami2020 #Tomorrowland",,,,,Tomorrowland,-0.1531,0.091,0.8079999999999999,0.101
discobabe76,1235510378584592386,2020-03-05 10:20:03+00:00,22,#floods #bullying #austerity #cuts #coronavirus #RussiaReport #PartTimePrimeMinister #sickpay #farmers #nhscrisis #educationcuts #Brexit,,11,3,This government is screwing ALL of us over! #floods #bullying #austerity #cuts #coronavirus #RussiaReport #PartTimePrimeMinister #sickpay #farmers #nhscrisis #educationcuts and I haven't even mentioned the obvious!!! #Brexit anything else I've missed off???!!!,,government,Brexit,,coronavirus # RussiaReport # Brexit,-0.8981,0.298,0.7020000000000001,0.0
OliverMcGrath,1235502646469038080,2020-03-05 09:49:20+00:00,13,#coronavirus #CoronaAlert,,0,0,The middle class are very worried about coronavirus. Absolute scenes in Waitrose! #coronavirus #CoronaAlert – at North Finchley,,,,,coronavirus Waitrose # CoronaAlert North Finchley,-0.4186,0.141,0.8590000000000001,0.0
StJamesChurchWS,1235502616693571584,2020-03-05 09:49:13+00:00,1,#coronavirus,,0,1,We've made the difficult decision to close clubs this week as a precaution in the light of the closure of St.Cecilia’s School due to possible cases of #coronavirus. As we have children from school families in our clubs we want to ensure the vulnerable amongst us remain safe. 1/2 ,,,,,St Cecilia School,0.34,0.08,0.797,0.123
positivelyslim,1235502216330477568,2020-03-05 09:47:37+00:00,0,#coronavirus,,0,0,"Have had lovely interactions with two strangers today. Random conversations both of which ended with them saying, ""Be safe."" Times are changing. #coronavirus ",,,,,coronavirus,0.7717,0.0,0.758,0.242
elvisismyguru,1235501718177296385,2020-03-05 09:45:38+00:00,1,#coronavirus,@BBCSounds,1,0,Apocalypse OR scaremongering. The truth on #coronavirus lies somewhere between the two. But where? The BBC's brilliant experts are discussing this and how Covid-19 is going to affect YOU in our brand new weekly podcast. Subscribe via @BBCSounds ,,,,,coronavirus BBC Covid-19,0.7140000000000001,0.043,0.8,0.157
Dodi_,1235496050900774912,2020-03-05 09:23:07+00:00,1,#coronavirus,,0,1,Still no person to@person transmission since an Italian National flew to Nigeria with #coronavirus I suspect the virus cannot survive in the heat over there?,,,,,National Nigeria coronavirus,-0.5267,0.161,0.8390000000000001,0.0
mahdi,1235494188369625090,2020-03-05 09:15:43+00:00,59,#CoronaVirus,,7,2,Doctors and nurses in Iran dance at work to keep their spirits up during the fight against #CoronaVirus. ,,,CoronaVirus,,Iran CoronaVirus,-0.3818,0.133,0.867,0.0
TheSnakeoilGal,1235493026518241285,2020-03-05 09:11:06+00:00,0,#Coronavirus,,0,0,"It’s in the flipping Faroe Islands for pity’s sake!!! I mean it’s not as if this virus is having to go through passport control at every border post so perhaps there is a lot, lot more to #Coronavirus than our controllers are letting on?",,,Coronavirus,,Faroe Islands # Coronavirus,0.0,0.0,1.0,0.0
LycettPhotog,1235492377277526016,2020-03-05 09:08:31+00:00,1,#CoronaVirus #Covid19,,0,0,"Crikey people!! Passing through London, train full of coughs and sneezes and hardly a tissue to be seen!!! GET your ACT TOGETHER!!! #CoronaVirus #Covid19",,,CoronaVirus,,London CoronaVirus # Covid19,0.0,0.0,1.0,0.0
jorisevers,1235491828687872000,2020-03-05 09:06:20+00:00,0,#Coronavirus,@muradahmed,0,0,"At the FT Business of Football Summit where @muradahmed starts the day talking about “truckloads of hand sanitizer” and how seeing Brits fist pump each other is rather odd #Coronavirus – at The Biltmore Mayfair, LXR Hotels &amp; Resorts",,,,LXR Hotels &amp,FT Business Football Summit @muradahmed sanitizer Brits Coronavirus Biltmore Mayfair LXR Hotels Resorts,0.2263,0.054000000000000006,0.871,0.075
MeetZentoshi,1235490832603582464,2020-03-05 09:02:23+00:00,1,#Coronavirus #vaccine #clinicaltrials,,0,0,#Coronavirus #vaccine #clinicaltrials,,,Coronavirus,,Coronavirus,0.0,0.0,1.0,0.0
beeeej91,1235490397339738113,2020-03-05 09:00:39+00:00,0,#coronavirus,,0,0,Yeah was annoying. They run out of cups actually. They started handing out ones that had already been used to people who said they didn’t mind which is definitely not allowed from a health and safety perspective #coronavirus,,,,,# coronavirus,0.6124,0.061,0.7659999999999999,0.173
amalab,1235488748038692866,2020-03-05 08:54:06+00:00,1,#CoronaVirus #SriLanka #EDB #lka,,6,0,"#CoronaVirus impact on #SriLanka: Export Development Board (#EDB) Chairman Prabhash Subasinghe predicts 25% or $750m drop in exports in 2Q due to COVID-19 fallout. Top export industries affected–apparel, tea, rubber, coconut, processed food – affected #lka",,,,,CoronaVirus SriLanka Export Development Board # EDB Chairman Prabhash Subasinghe coconut,-0.2263,0.096,0.857,0.047
maria_aguete,1235484439003697152,2020-03-05 08:36:59+00:00,1,#Brexit #Coronavirus,@BorisJohnson,0,0,"Too much social media noise, fake news, and stories we don’t know if they are true or false. But in the UK @BorisJohnson said after #Brexit 350million a week are coming back to the NHS so I am sure he is using that money in research to protect us from #Coronavirus",,nhs,Coronavirus,,UK @BorisJohnson Brexit 350million NHS # Coronavirus,0.7647,0.036000000000000004,0.815,0.15
jjgabay,1235484437741277185,2020-03-05 08:36:58+00:00,5,#Coronavirus,@BorisJohnson @SadiqKhan,1,1,This is the London underground. A total #Coronavirus incubating timebomb waiting to burst with germs @BorisJohnson @SadiqKhan when are you going to stop a disaster from happening? Save London,,,Save London,,London Coronavirus @SadiqKhan Save London,-0.4767,0.177,0.732,0.09
